Document Number,Document Type,Publication Date,Title,Abstract,Inventor Name,Assignee,Filing Date
WO/2014/190332A1,WIPO,2014-11-27,PRODUCING FUELS AND BIOFERTILIZERS FROM BIOMASS,"An IBTL system having a low GHG footprint for converting biomass to liquid fuels in which a biomass feed is converted to liquids by direct liquefaction and the liquids are upgraded to produce premium fuels. Biomass residues from the direct liquefaction, and optionally additional biomass is pyrolyzed to produce structured biochar, hydrogen for the liquefaction and upgrading, and CO2 for conversion to algae, including blue green algae (cyanobacteria) in a photobioreactor (PBR). Produced algae and diazotrophic microorganisms are used to produce a biofertilizer that also contains structured biochar. The structured biochar acts as a nucleation agent for the algae in the PBR, as a absorption agent to absorb inorganics from the biomass feed to direct liquefaction or from the liquids produced thereby, and as a water retention agent in the biofertilizer.",FIATO ROCCO A (US); SUN YUHAN (CN); ALLEN MARK (US); ZHAO QUANYU (CN),ACCELERGY CORP (US); SHANGHAI ADVANCED RES INST OF THE CHINESE ACADEMY OF SCIENCE (CN),2014-05-23
DE60028599T2,DE,2007-05-16,BRENNSTOFFZUSATZ ZUR VENTILSITZRÜCKSCHLAGVERHINDERUNG,"There is provided use of a composition for the prevention and/or inhibition of valve seat recession of an internal combustion engine, the composition comprising (i) (a) phosphorus and/or a phosphorus compound; and/or (b) potassium and/or a potassium compound; and (ii) iron and/or an iron compound.",MULQUEEN SIMON CHRISTOPHER (GB); VINCENT MATTHEW (GB); COOK STEPHEN LEONARD (GB),ASS OCTEL (GB),2000-07-07
WO/2017/173165A1,WIPO,2017-10-05,SYSTEMS AND METHODS FOR IMPROVING YIELDS OF HYDROCARBON FUELS FROM ALCOHOLS,Systems and methods are provided that permit temperature control of a catalyst bed for conversion of alcohols to fuel hydrocarbons by modulating the water content of the alcohol feed stream provided to the catalyst bed. Heat generated by exothermic reactions in the catalyst bed can be utilized to pre-heat the alcohol feed stream. In some embodiments a secondary catalyst bed is provided for the conversion of light hydrocarbons found in the initial hydrocarbon product to fuel hydrocarbons that are liquid at ambient temperature and pressure.,WYMAN CHARLES E (US); HANNON JOHN R (US),VERTIMASS LLC (US),2017-03-30
WO/2011/020955A2,WIPO,2011-02-24,VARIABLE PARAMETER ROTARY WING,"The present application takes into account an approach adapted to aviation which, through rigid wings, forces and imposes the flight envelope thereof into onerous and non-modifiable configurations. A specific modification to the principle of known airplane technology which represents the abandonment of stationary wings for a rotary double wing constitutes the present application, referred to as Pica-Gyr. Conventional airplanes comprise a mechanical rigidity which by default leads to crashes in the event of not adhering to regulations. Flight configuration is rendered difficult, maneuverability which is unsuitable for the circumstances is learnt by our brain but is not natural, the rigid wing tool is not adapted for useful speeds which are different on the same airplane, and the rigid wing imposes minimal speeds and behaviors to which one must conform and respect in any given circumstances. More flexible behaviors in terms of lift variables enable the easier adaptation of flight configurations and practical demands, and ensure translations at high speeds and safe vertical departure. The solution of the equation of the demand for flexibility of use is integrating a modifiable lift parameter by modifying the driving of the speed of the rotary wing, driven by at least one separate engine for this purpose or coupled to the translation engine. The principle of the double rotary wing is in fact the main lift technique that is adaptable in the known field of aeronautics, but replaces the stationary wings of airplanes, and reduces drag, fuel consumption, vibration, and noise.",BUENDIA JOSE (FR); PERRICHON CLAUDE ANNIE (FR); GIRY FRANCOIS (FR); PICCALUGA PIERRE (CH),BUENDIA JOSE (FR); PERRICHON CLAUDE ANNIE (FR); GIRY FRANCOIS (FR); PICCALUGA PIERRE (CH),2010-08-16
EP2467298A2,EP,2012-06-27,VARIABLE PARAMETER ROTARY WING,"The present application takes into account an approach adapted to aviation which, through rigid wings, forces and imposes the flight envelope thereof into onerous and non-modifiable configurations. A specific modification to the principle of known airplane technology which represents the abandonment of stationary wings for a rotary double wing constitutes the present application, referred to as Pica-Gyr. Conventional airplanes comprise a mechanical rigidity which by default leads to crashes in the event of not adhering to regulations. Flight configuration is rendered difficult, maneuverability which is unsuitable for the circumstances is learnt by our brain but is not natural, the rigid wing tool is not adapted for useful speeds which are different on the same airplane, and the rigid wing imposes minimal speeds and behaviors to which one must conform and respect in any given circumstances. More flexible behaviors in terms of lift variables enable the easier adaptation of flight configurations and practical demands, and ensure translations at high speeds and safe vertical departure. The solution of the equation of the demand for flexibility of use is integrating a modifiable lift parameter by modifying the driving of the speed of the rotary wing, driven by at least one separate engine for this purpose or coupled to the translation engine. The principle of the double rotary wing is in fact the main lift technique that is adaptable in the known field of aeronautics, but replaces the stationary wings of airplanes, and reduces drag, fuel consumption, vibration, and noise.",BUENDIA JOSE (FR); PERRICHON CLAUDE ANNIE (FR); GIRY FRANCOIS (FR); PICCALUGA PIERRE (CH),BUENDIA JOSE (FR); PERRICHON CLAUDE ANNIE (FR); GIRY FRANCOIS (FR); PICCALUGA PIERRE (CH),2010-08-16
EP4227224A1,EP,2023-08-16,HYBRID-ELECTRIC AIRCRAFT PROPULSION SYSTEM AND METHOD FOR OPERATING THE SAME,"A method of operating a hybrid-electric propulsion system (18) for an aircraft includes: a) providing at least one thermal engine sized to provide sufficient thrust to the aircraft for at least one flight mission independent of a second non-thermal engine source of thrust for the at least one flight mission; b) providing at least one electric motor powered by a non-hydrocarbon-fuel-burning electrical energy source, the at least one electric motor configured to provide thrust to the aircraft for the at least one flight mission; and c) selectively providing thrust during one or more segments of the at least one flight mission using the electric motor.
",FREER RICHARD (CA); QUILLET DOMINIK (CA); RANCOURT DAVID (CA),"PRATT & WHITNEY CANADA (Longueuil, Québec J4G 1A1, CA)",2023-02-13
EP3471840A1,EP,2019-04-24,LANDING PAD,"A landing pad including at least one integrally formed elongated hollow decking unit having an elongated landing plate with a plurality of holes, an elongated base plate aligned longitudinally with respect to the elongated landing plate which is designed as an orifice plate and spaced a distance apart from the elongated landing plate, and two elongated side wall plates connecting the elongated landing plate to the elongated base plate. The plurality of holes may be configured to drain unburned fuel spilled on the elongated landing plate through the plurality of holes into the elongated hollow decking unit and to suppress flame of burning fuel from propagating through the plurality of holes into the elongated hollow decking unit by reducing the temperature of drained unburned fuel. The distance apart between the elongated landing plate and the elongated base plate may be configured to prevent re-ignition of the drained unburned fuel on the elongated base plate inside the elongated hollow decking unit.",UPPAL NEELESH (SG),"ALUMINIUM OFFSHORE PTE LTD (Singapore 609930, SG)",2016-06-16
DE102009012914A1,DE,2009-09-17,Aktive Musterfaktorsteuerung/regelung für Gasturbinenmotoren,"Ein Verfahren zur aktiven Steuerung/Regelung eines Musterfaktors in einem Gasturbinenmotor umfasst die Schritte, Brennstoff in eine Brennkammer eines Gasturbinenmotors durch eine oder mehrere in Umfangsrichtung angeordnete Brennstoffeinspritzeinrichtungen auszugeben, einen Anfangsumfangsmusterfaktor in der Brennkammer zu bestimmen und die Brennstoffströmung durch eine oder mehrere ausgewählte Brennstoffeinspritzeinrichtungen basierend auf dem Anfangsumfangsmusterfaktor einzustellen, um einen modifizierten Umfangsmusterfaktor in der Brennkammer zu erhalten. Der Schritt, den Umfangsmusterfaktor zu bestimmen, kann die Schritte umfassen, eine chemilumineszente Signatur innerhalb der Brennkammer zu erfassen, die chemilumineszente Signatur mit einem Äquivalenzverhältnis zu korrelieren und den Anfangsumfangsmusterfaktor basierend auf dem Äquivalenzverhältnis zu berechnen. Alternativ kann der Schritt, den Umfangsmusterfaktor zu bestimmen, die Schritte umfassen, Temperaturen an einer Mehrzahl von Umfangspositionen an dem Brennkammerausgang zu messen und den Anfangsumfangsmusterfaktor basierend auf den gemessenen Temperaturen zu berechnen.",WILLIAMS BRANDON P (US); GOEKE JERRY L (US),DELAVAN INC (US),2009-03-12
WO/2015/042253A1,WIPO,2015-03-26,"SINGLE-STEP PROCESS FOR PRODUCTION OF BRANCHED, CYCLIC, AROMATIC, AND CRACKED HYDROCARBONS FROM FATTY ACIDS","A catalytic process is provided which produces in a single reaction branched, cyclic and aromatic hydrocarbons, or cracked straight-chain hydrocarbons, from fatty acids in which the fatty acids are reacted over a multifunctional catalyst and undergo both decarboxylation and either conversion or cracking to form reaction products useful as fuels and for other applications that require a source of energy, or as feedstock for hydrocarbon-based commercial products such as surfactants, solvents and lubricants.",RATNASAMY PAUL (IN); CARREON MOISES A (US); AHMADI MASOUDEH (US),UNIV LOUISVILLE RES FOUND (US),2014-09-18
WO/2012/003005A2,WIPO,2012-01-05,"PROCESS FOR HIGH EFFICIENCY, LOW POLLUTION FUEL CONVERSION","A process for reducing the CO2 and other pollutants produced by the combustion of a fuel in a combustion chamber while maintaining or increasing the efficiency of said combustion includes feeding to the combustion chamber, or preconditioning the combustion chamber, with a catalyst, preferably a lithium based salt Monitoring the energy output and components of the exhaust gas stream to maintain optimum operation allows reduction, during the process, of the catalyst delivery and feed air. The presence of the catalyst results in increased efficiency of operation and reduction of pollutants generated.",TAPLIN HARRY R JR (US),TAPLIN HARRY R JR (US),2011-07-01
WO/2012/083236A2,WIPO,2012-06-21,"CATALYSTS, METHODS OF PREPARATION OF CATALYST, METHODS OF DEOXYGENATION, AND SYSTEMS FOR FUEL PRODUCTION","Presented are one or more aspects and/or one or more embodiments of catalysts, methods of preparation of catalyst, methods of deoxygenation, and methods of fuel production.",NGUYEN THIEN DUYEN THI (US); PARIMI KRISHNIAH (US),EN TECHNOLOGIES INC (US); NGUYEN THIEN DUYEN THI (US); PARIMI KRISHNIAH (US),2011-12-16
WO/2015/002936A1,WIPO,2015-01-08,METHOD OF PROCESSING ADULTERATED BIOMASS FEEDSTOCKS,A method is provided that involves contacting a feed stream including a biorenewable feedstock and adulterants with a catalyst in a fixed bed hydroprocessing reactor to produce a hydroprocessed product with less adulterants than the feed stream.,HAVLIK PETER Z (US); ABHARI RAMIN (US); ROTH E GARY (US); TOMLINSON H LYNN (US),REG SYNTHETIC FUELS LLC (US),2014-07-01
EP4327893A1,EP,2024-02-28,VEHICLE HYDROGEN FIRE DETECTION DEVICE,"The invention is designed to make hydrogen fires detectable in aviation operations and similar applications, whether it is for the purpose of detecting a fire around an aircraft prior to passenger and crew emergency evacuation, or to identify fires in proximity to airport ground vehicles that utilise hydrogen as a fuel or vehicles that are used for transporting or transforming hydrogen in any transport context. The invention can be designed to be nontoxic and safe for use in proximity to humans.
",ORCHARD MATTHEW NOEL (GB),"ZERO EMISSIONS AEROSPACE LTD (Bristol BS6 5EZ, GB)",2022-08-22
EP4324898A1,EP,2024-02-21,"ORGANIC FEEDSTOCK DECOMPOSITION METHOD, AND METHOD FOR MANUFACTURING LIQUID FUEL, SOLID FUEL, OR ACTIVATED CARBON USING SAME","A method for decomposing an organic raw material, comprising: a raw material supply step of supplying an organic raw material containing biomass and/or organic polymer waste, and an artificial carbon particle to a fluidized-bed-type decomposition apparatus, and a decomposition step of decomposing the organic raw material into a non-solid decomposition component and a solid residue while fluidizing the artificial carbon particle with introducing a carrier gas to the fluidized-bed-type decomposition apparatus, to discharge the non-solid decomposition component with the carrier gas as well as to discharge the solid residue separately from the non-solid decomposition component.",MATSUNAGA KOTETSU (JP); KOSHIKAWA TETSUYA (JP); AZUMA YUICHIRO (JP); KOSHIKAWA SHOI (JP); MOCHIDA ISAO (JP),"REVO INT INC (Kyoto-shi, Kyoto 612-8473, JP)",2022-04-12
DE102022204761A1,DE,2023-11-16,Antriebssystem für ein Luftfahrzeug,"Ein Antriebssystem (1; 1') für ein Fahrzeug, insbesondere für ein Luftfahrzeug (2; 2'), umfasst: einen Brennstofftank (10) für Brennstoff (3), eine Stromerzeugungseinheit (11; 11`), welche dazu ausgebildet ist, mit Brennstoff (3) aus dem Brennstofftank (10) elektrischen Strom zu erzeugen, einen elektrischen Antrieb (12) und einen Wärmetauscher (13; 13') mit einem ersten Strömungspfad (130) und einem zweiten Strömungspfad (131), zwischen welchen Wärme austauschbar ist, wobei die Stromerzeugungseinheit (11; 11') über den ersten Strömungspfad (130) mit dem Brennstofftank (10) in Fluidverbindung steht und der elektrische Antrieb (12) mit dem zweiten Strömungspfad (131) verbunden ist, um mittels durch den zweiten Strömungspfad (131) strömbarem Fluid gekühlt zu werden.",BOLL MARTIN (DE),"ROLLS ROYCE DEUTSCHLAND LTD & CO KG (Blankenfelde-Mahlow, DE)",2022-05-16
DE102021125384A1,DE,2023-03-30,Verfahren zum Betreiben eines Verbrennungssystems einer Strömungsmaschine für einen Flugantrieb sowie Strömungsmaschine,"Die Erfindung betrifft ein Verfahren zum Betreiben eines Verbrennungssystems (2) einer Strömungsmaschine (1) für einen Flugantrieb mit einem Verdichter (11), einem Brennraum (4), einer Turbine (15), einem stromabwärts der Turbine (15) angeordneten Wärmetauscher (16, 17) und einem Brennstoffaufbereitungssystem (3). Bei dem Verfahren wird im Wärmetauscher (17) Dampf erzeugt und in eine Mischkammer (33, 37) des Brennstoffaufbereitungssystems (3) geführt, welcher ferner Brennstoff zugeführt wird. Ferner betrifft die Erfindung eine Strömungsmaschine (1) mit einem Verbrennungssystem (2) insbesondere zur Anwendung des Verfahrens.",KLINGELS HERMANN (DE); SCHMITZ OLIVER (DE); KONLE MARCO (DE),"MTU AERO ENGINES AG (München, DE)",2021-09-30
DE3233645C2,DE,1995-04-13,Verwendung eines Schmiermittels zur Verminderung des Treibstoffverbrauchs,"Fuel consumption is reduced in internal combustion engines by lubricating them with a lubricant containing certain alkyl or alkenyl esters of polycarboxylic acids. Acid-esters of formula  R'(COOR)m are novel, where R' is a C10-35 aliphatic hydrocarbon-based radical free of acetylenic unsaturation and having at least 8C atoms in straight-chain configuration, each R is H or C2-18 alkenyl, at least one H and and least one alkenyl being present.",KOCH FREDERICK WILLIAM (US),LUBRIZOL CORP (US),1982-09-10
EP1611226A1,EP,2006-01-04,FUEL FOR MOTOR VEHICLES,Abstract not available,D ELIA LUIGI (IT); SCORLETTI PIETRO (IT); RAUSA RICCARDO (IT); RIVOLTA GUIDO (IT); DE AMICIS ALBERTO (IT); AMBROSINI TIZIANO (IT),ENI SPA (IT); PIRELLI & C AMBIENTE TECNOLOGI (IT); ENITECNOLOGIE SPA (IT),2004-03-22
WO/2021/094657A1,WIPO,2021-05-20,METHOD FOR PRODUCING RENEWABLE FUEL AND BASE OIL,The present invention provides a base oil produced from feedstock of biological origin and a method for producing the same. The present invention further provides base oil blends comprising the base oil of biological origin and at least one additional base oil.,RANTASALO TEEMU (FI); TUOMALA OLLI (FI); NEUVONEN ARTO (FI); VILJA JESSE (FI),NESTE OYJ (FI),2020-11-13
EP1817231B1,EP,2014-02-12,"SUPPLY SYSTEM FOR THE ENERGY SUPPLY IN AN AIRCRAFT, AIRCRAFT AND METHOD FOR SUPPLYING AN AIRCRAFT WITH ENERGY",An engine (101) propels the aircraft. A fuel cell (102) supplies electric energy to the aircraft. A kerosene reservoir (103) supplies the engine with engine fuel. A hydrogen reservoir (104) supplies the fuel cell with fuel cell fuel. The kerosene reservoir is decoupled and arranged separately from the hydrogen reservoir.,HOFFJANN CLAUS (DE); SCHULDZIG HANSGEORG (DE); PFAFFEROTT TORGE (DE); FRAHM LARS (DE); NICKEL LARS (DE),AIRBUS OPERATIONS GMBH (DE),2005-12-02
WO/2006/084286A2,WIPO,2006-08-10,HYDROCARBON COMPOSITIONS USEFUL FOR PRODUCING FUELS,"A hydrocarbon composition comprises at least 90 wt.% of C9 to C20 non- normal olefins, non-normal saturates or combinations thereof based on the weight of the hydrocarbon composition, at least 2 wt.% and not greater than 25 wt.% of C9 hydrocarbons based on the weight of the hydrocarbon composition, and less than 15 wt.% of C17+ hydrocarbons based on the weight of the hydrocarbon composition, wherein said hydrocarbon composition has a specific gravity at 15°C of at least 0.730 and less than 0.775. The composition is produced by oligomerization of at least one C3 to C8 olefin and an olefinic recycle stream rich in C9- hydrocarbons. The composition is useful in producing fuel blends, such as jet fuel and diesel fuel.",BROWN STEPHEN H (US); KUECHLER KEITH H (US); VERBERCKMOES AN (BE); PUTTEMANS MARC (BE); SILVERBERG STEVEN E (US); LUO SHIFANG (US); CHENG JANE C (US); JAENSCH HELGE (DE); MATHYS GEORGES M (BE),EXXONMOBIL CHEM PATENTS INC (US); BROWN STEPHEN H (US); KUECHLER KEITH H (US); VERBERCKMOES AN (BE); PUTTEMANS MARC (BE); SILVERBERG STEVEN E (US); LUO SHIFANG (US); CHENG JANE C (US); JAENSCH HELGE (DE); MATHYS GEORGES M (BE),2006-01-27
WO/2022/087618A1,WIPO,2022-04-28,PROCESS FOR PRODUCING JET FUEL FROM A BIORENEWABLE FEED,The process produces a diesel stream from a biorenewable feedstock by hydrotreating to remove 5 heteroatoms and hydroisomerization to improve cold flow properties. Heavy diesel can be hydrocracked to jet fuel range material or further hydroisomerized to increase its value lower its freeze point while light diesel may be taken as a motor fuel.,BOZZANO ANDREA G (US); WANG HAIYAN (US); MANI KRISHNA (US); FREY STANLEY JOSEPH (US),UOP LLC (US),2021-10-21
EP2999682A1,EP,2016-03-30,PRODUCING FUELS AND BIOFERTILIZERS FROM BIOMASS,"An IBTL system having a low GHG footprint for converting biomass to liquid fuels in which a biomass feed is converted to liquids by direct liquefaction and the liquids are upgraded to produce premium fuels. Biomass residues from the direct liquefaction, and optionally additional biomass is pyrolyzed to produce structured biochar, hydrogen for the liquefaction and upgrading, and CO2 for conversion to algae, including blue green algae (cyanobacteria) in a photobioreactor (PBR). Produced algae and diazotrophic microorganisms are used to produce a biofertilizer that also contains structured biochar. The structured biochar acts as a nucleation agent for the algae in the PBR, as a absorption agent to absorb inorganics from the biomass feed to direct liquefaction or from the liquids produced thereby, and as a water retention agent in the biofertilizer.",FIATO ROCCO A (US); SUN YUHAN (CN); ALLEN MARK (US); ZHAO QUANYU (CN),ACCELERGY CORP (US); SHANGHAI ADVANCED RES INST CAS (CN),2014-05-23
EP2999682B1,EP,2019-11-13,PRODUCING FUELS AND BIOFERTILIZERS FROM BIOMASS,"An IBTL system having a low GHG footprint for converting biomass to liquid fuels in which a biomass feed is converted to liquids by direct liquefaction and the liquids are upgraded to produce premium fuels. Biomass residues from the direct liquefaction, and optionally additional biomass is pyrolyzed to produce structured biochar, hydrogen for the liquefaction and upgrading, and CO2 for conversion to algae, including blue green algae (cyanobacteria) in a photobioreactor (PBR). Produced algae and diazotrophic microorganisms are used to produce a biofertilizer that also contains structured biochar. The structured biochar acts as a nucleation agent for the algae in the PBR, as a absorption agent to absorb inorganics from the biomass feed to direct liquefaction or from the liquids produced thereby, and as a water retention agent in the biofertilizer.",FIATO ROCCO A (US); SUN YUHAN (CN); ALLEN MARK (US); ZHAO QUANYU (CN),"ACCELERGY CORP (Houston, TX 77008, US); SHANGHAI ADVANCED RES INST CAS (Pudong, Shanghai 201203, CN)",2014-05-23
EP2257738A1,EP,2010-12-08,SWIRLER WITH GAS INJECTORS,"The invention relates to a swirler for premixing a flow of fuel (14) and a flow of air (12) provided to a burner (1) for a gas turbine engine, which burner (1) is provided with a swirler (3) for mixing the air (12) and the fuel (14) and wherein the swirler (3) is provided with swirler wings (3a), wherein a channel formed between two adjacent swirler wings (3a) defines a passage. It is one object of the invention to provide stability to a lean premixed combustion. This is achieved by a swirler of the above mentioned type having one fuel tube (15) for gaseous fuel positioned in parallel on each side of a mixing rod (15b) in said passage, wherein said fuel tubes (15) are provided with a plurality of diffuser holes (15a) distributed along the tube (15) acting as gas injectors for efficiently distributing fuel (14) in a flow of air passing through said swirler (3) passage.",MILOSAVLJEVIC VLADIMIR (SE); PERSSON ALLAN (SE); PERSSON MAGNUS (SE),SIEMENS AG (DE),2009-03-26
WO/2023/184001A1,WIPO,2023-10-05,OILY BIOFUEL SUSPENSION AND METHOD FOR MANUFACTURING SAME,"The present invention relates to oily biofuel suspensions with biocarbon in their composition. The present invention provides an oily biofuel suspension comprising 50% by mass micronised biocarbon and 50-95% by mass oil. The oily biofuel suspension according to the present invention is better suited to existing, commercially available internal combustion engines with compression (diesel type), dispensing with greater retrofitting outlays of same. Moreover, the oily biofuel composition according to the present invention is highly sustainable and has an energy volumetric density and viscosity comparable to those of the existing, commercially available liquid fossil fuels.",DE OLIVEIRA RONALD (BR); GONÇALVES GUILHERME FRANCISCO (BR); POTTER STEPHEN MICHAEL (BR); SOARES ÁLVARO (BR); DE ALMEIDA EWERTON (BR); DE MOURA LEONARDO (BR); RIBEIRO RILEI (BR),TECNORED DESENVOLVIMENTO TECNOLOGICO S A (BR),2023-02-15
WO/2021/066695A1,WIPO,2021-04-08,PROCESS FOR MANUFACTURING ORGANIC CHEMICALS AND/OR DISTILLATE HYDROCARBON FUELS FROM WASTE TEXTILES,"The present disclosure relates to a process for manufacturing organic chemicals and/or distillate hydrocarbon fuels from waste textiles comprising cellulosic fibers, wherein the process includes providing waste textiles comprising cellulosic fibers, processing the waste textiles into an aqueous slurry of comminuted waste textiles, saccharification of the comminuted waste textiles into monomer sugars in the presence of a catalyst; and processing the monomer sugars into organic chemicals and/or distillate hydrocarbon fuels.",STIGSSON LARS (SE),SHARETEX AB (SE),2020-08-06
US20230323822,US,10/12/2023,FUEL DELIVERY,"The present application discloses a method of determining one or more fuel characteristics of an aviation fuel suitable for powering a gas turbine engine of an aircraft, the gas turbine engine having a combustor supplied with fuel from a fuel system, the method comprising: determining a mass of the fuel being supplied to the combustor; determining a corresponding volume of the fuel being supplied to the combustor; and determining one or more fuel characteristics based on the determined mass and volume. Also disclosed is a fuel characteristic determination system, a method of operating an aircraft, and an aircraft.","Bemment, Craig W. (Derby, GB)                
                            Keeler, Benjamin J. (Derby, GB)                
                            Ferra, Paul W. (Derby, GB)                
                            Hobday, Alastair G. (Derby, GB)                
                            Mcnally, Kevin R. (Derby, GB)                
                            Minelli, Andrea (Derby, GB)                
                            Yates, Martin K. (Northamptonshire, GB)","ROLLS-ROYCE PLC (London, GB)",03/23/2023
