Document Number,Document Type,Publication Date,Title,Abstract,Inventor Name,Assignee,Filing Date
US20200031666,US,01/30/2020,"MODIFIED PHYLLOSILICATES FOR USE IN SOLID CHEMICAL OXYGEN GENERATING COMPOSITIONS, OXYGEN GENERATOR, AND METHOD OF GENERATING OXYGEN","A composition for generating oxygen includes at least one oxygen source selected from chlorates and perchlorates. An oxygen generating device includes such a composition. Oxygen is generated by decomposing such a composition. In the context, phyllosilicate compounds are used as multifunctional components in the oxygen generating compositions.","Kallfass, Christoph (SCHWAEBISCH HALL, DE)                
                            Hejczyk, Arthur (BERLIN, DE)","DIEHL AVIATION GILCHING GMBH (Gilching, DE)",07/30/2019
US20120205188,US,08/16/2012,SYSTEM AND METHOD FOR GENERATING AND CONTROLLING CONDUCTED ACOUSTIC WAVES FOR GEOPHYSICAL EXPLORATION,"An improved system and method for generating and controlling conducted acoustic waves for geophysical exploration are provided. A plurality of overpressure waves are generated by at least one overpressure wave generator comprising at least one detonation tube having an open end that may be directed away from, parallel to, or towards a target media. Recoil forces of the at least one overpressure wave generator, produced shear forces, or the forces of the plurality of overpressure waves are coupled to the target media to generate conducted acoustic waves. The timing of the generation of the plurality of overpressure waves can be in accordance with a timing code and can be used to steer the conducted acoustic waves to a location of interest in the target media.","Fullerton, Larry W. (New Hope, AL, US)","SOUNDBLAST TECHNOLOGIES LLC (Winter Park, FL, US)",03/16/2011
US20150008137,US,01/08/2015,METHOD AND DEVICE OF CARBON-DIOXIDE DECOMPOSITION,"In this proposal, we provide a highly original solution to resolve/decompose carbon dioxide into useful by-products which provide industrial values to businesses around the world and meanwhile carbon emission control is the most importance. By taking high energy of light particles from Ultraviolet light, our innovational equation, (uv)+CO2+(AgM)+2H2→2H2O+(4e−Δ)+C4+(AgM)+[4e−↓]→C+(AgM), is designed to break the quantum effect of electron bond between carbon and oxygen, hence to restore carbon and release oxygen to achieve reduction of green house gas.","Chen, Shu-chin (Pingzhen City, TW)                
                            Fang, Wei (Taipei, TW)                
                            LU, Yen-wen (Taipei, TW)                
                            Chen, Hsun-yi (Taipei, TW)","CHEN SHU-CHIN                
                            FANG WEI                
                            LU YEN-WEN                
                            CHEN HSUN-YI",10/30/2013
US20070221785,US,09/27/2007,ROCKET-POWERED VEHICLE RACING COMPETITION,"A method for racing rocket-powered vehicles directly against one another is provided in which a first rocket-powered vehicle simultaneously races against a second rocket-powered vehicle to be the first to complete a race course. The method may include the first and second rocket-powered vehicles performing a pre-determined maneuver while proximate a group of spectators, and/or the rocket-powered vehicles strategically performing the steps of gliding and boosting the flight of their rocket-powered vehicle in accordance with a pre-determined maximum fuel criteria. The method further may include permitting spectator interaction with participants of the racing competition and enabling spectators to compete with actual participants via virtual vehicles. The method may also include the rocket-powered vehicles performing a refueling operation. The method may further include providing audible or visual identifiers of the vehicles. In addition, the method may include providing safety data to ensure safe separation between competing vehicles.","Diamandis, Peter H. (Los Angeles, CA, US)                
                            Whitelaw, Granger B. (Red Bank, NJ, US)                
                            D'angelo, Michael R. (Melrose, MA, US)","Rocket Racing, Inc. (Melrose, MA, US)",10/03/2005
US20230415882,US,12/28/2023,"HIGH IMPACT-RESISTANT, REINFORCED FIBER FOR LEADING EDGE PROTECTION OF AERODYNAMIC STRUCTURES","Systems and methods for protecting an aerodynamic structure, e.g., a wind turbine blade, rotor blade, aerodynamic aerostructure, etc., are provided. Long fiber reinforced composites having a helicoidal architecture with material aligned with a graded hardness and stiffness are used to develop an efficient and highly tailorable leading edge protection (LEP) solution with longer durability than conventional solutions while yielding lighter, and optionally, more environmentally sustainable solutions. At least a portion of the plurality of plies are helicoidally arranged relative to one another to tailor stress wave propagation speed of the aerodynamic blade and to provide load carrying strength for the aerodynamic blade.","Bert, Anthony (Irigny, FR)                
                            Mencattelli, Lorenzo (London, GB)                
                            Kisailus, David (Irvine, CA, US)                
                            Wasilenkoff, Chadwick (Indio, CA, US)","Helicoid Industries Inc. (Indio, CA, US)",06/14/2023
US20210179060,US,06/17/2021,EXTERNAL COMBUSTION ENGINE SERIES HYBRID ELECTRIC DRIVETRAIN,"A vehicle is provided which includes an engine; an electric motor; a drivetrain driven by said engine and said electric motor, said drivetrain including a rotatable shaft; a generator which is attached to said rotatable shaft, and which generates electrical energy in response to the rotation of said shaft; an energy recovery system; and an electrical energy storage system.","Mcdowell, Joseph Shea (San Antonio, TX, US)","QUANTUM INDUSTRIAL DEVELOPMENT CORPORATION (Seguin, TX, US)",10/27/2018
US20200167872,US,05/28/2020,METHOD FOR MANAGING ENVIRONMENTAL INSURANCE,"A method for identifying and managing the appropriate environmental insurance plan that is specifically customized for High Net Worth (HNW) insured's. The method provides an accurate and customized approach for assessing the risk tolerance of the HNW insured's for their environmental exposure. The method involves determining the amount of environmental risk, in the form of environmental exposures and environmental liability, the HNW can fiscally tolerate for its resources. Specifically, this method involves providing the HNW with the information necessary to determine whether it makes fiscal sense to transfer its environmental liabilities to an environmental/pollution risk transfer model, as opposed to waiting until an environmental loss actually occurs.","Bunbury, John Christopher (Leland, MI, US)",Assignee not found,01/31/2020
US20180300817,US,10/18/2018,METHOD FOR MANAGING ENVIRONMENTAL INSURANCE,"A method for identifying and managing the appropriate environmental insurance plan that is specifically customized for the HNW insured's. The method provides an accurate and customized approach for assessing the risk tolerance of the HNW insured's for their environmental exposure. The method involves determining the amount of environmental risk, in the form of environmental exposures and environmental liability, the HNW can fiscally tolerate for its resources. Specifically, this method involves providing the HNW with the information necessary to determine whether it makes fiscal sense to transfer its environmental liabilities to an environmental/pollution risk transfer model, as opposed to waiting until an environmental loss actually occurs.","Bunbury, John Christopher (Leland, MI, US)",Bunbury John Christopher,04/13/2018
US20200392406,US,12/17/2020,"MACROMOLECULAR ANTIOXIDANTS BASED ON DUAL TYPE MOIETY PER MOLECULE: STRUCTURES, METHODS OF MAKING AND USING THE SAME","Disclosed are compounds represented by structural formula





methods of producing compounds represented by structural formula, and their use in inhibiting oxidation in an oxidizable material.","Cholli, Ashok L. (Lowell, MA, US)                
                            Kumar, Vijayendra (Lowell, MA, US)","Polnox Corporation (Lowell, MA, US)",04/29/2020
US20180128182,US,05/10/2018,SYSTEM AND METHOD FOR STARTING GAS TURBINE ENGINES,"A method of starting a gas turbine engine includes determining an abnormal shutdown condition during operation of the gas turbine engine and determining a first set of lightoff parameters for the gas turbine engine. The method also includes restarting the gas turbine engine using the first set of lightoff parameters. The method further includes iteratively determining subsequent first sets of lightoff parameters and restarting the gas turbine engine using a respective subsequent first set of the determined subsequent first sets of lightoff parameters until the gas turbine maintains a first set of operational parameters, where the first set of operational parameters is representative of a robust lightoff of the gas turbine engine.","Hayama, Mauro (Mason, OH, US)                
                            Zhao, Xin (West Chester, OH, US)                
                            Tian, Ming (Mason, OH, US)                
                            Hawkins, Mikhel (Cincinnati, OH, US)                
                            Asari, Koji (Sharonville, OH, US)                
                            Swager, Thomas Charles (Maineville, OH, US)                
                            Clawson, Michael Allen (Cincinnati, OH, US)","General Electric Company (Schenectady, NY, US)",11/07/2016
US20210113130,US,04/22/2021,HYDROGEN POWERED DEVICE,A method to handle urine includes collecting urine using a pad or garment; exposing the urine to an aluminum alloy to generate hydrogen gas and heat in an exothermic reaction; and storing the hydrogen in a sealed chamber.,"Tran, Bao Q. (Saratoga, CA, US)",Assignee not found,10/20/2019
US20210148285,US,05/20/2021,STARTER ASSEMBLY AND METHODS FOR STARTING A COMBUSTION ENGINE,"A starter assembly includes a housing defining an interior, a rotatable pinion gear wherein the rotatable pinion gear extends exteriorly of the housing and operably coupling to a combustion engine, a torque sensor providing a torque output indicative of a torque experienced by the pinion gear, and a controller module configured operate a starting sequence for the starter assembly.","Blanco Aviles, Ruben (Querétaro, MX)                
                            Ledesma, Saul (El Marques, MX)","GE Aviation Systems LLC (Grand Rapids, MI, US)",01/06/2021
US20170081972,US,03/23/2017,METHOD AND SYSTEM FOR AN ELECTRIC AND STEAM SUPPLY SYSTEM,"An electric and steam system includes an electrical generator assembly configured to receive a first portion of a flow of a boil off gas (NBOG). An oxidizing unit is configured to receive a second portion of the flow of the boil off gas (NBOG), the second portion being an excess of the flow of the boil off gas (NBOG) that the electrical generator can process, and a crossover duct configured to receive a first flow of exhaust gas from the electrical generator assembly and a second flow of exhaust gas from the oxidizing unit and channel the first and second flows to an inlet of a heat recovery steam generator.","Park, Cheol (Seongnam-si, KR)                
                            Baek, Byeong-yeol (Busan City, KR)                
                            Tuddenham, Read Stapley (Sandpoint, ID, US)                
                            Maciulewicz, Paul Thomas (West Chester, OH, US)","General Electric Company (Schenectady, NY, US)",12/30/2015
US20100096491,US,04/22/2010,ROCKET-POWERED ENTERTAINMENT VEHICLE,"A rocket-powered vehicle used for entertainment, namely races, exhibitions, competitions, and revenue-generating events.","Whitelaw, Granger (Red Bank, NJ, US)                
                            D'angelo, Michael R. (Orlando, FL, US)                
                            Diamandis, Peter H. (Santa Monica, CA, US)","Rocket Racing, Inc. (Orlando, FL, US)",07/29/2009
US20120329593,US,12/27/2012,HYBRID TRANSMISSION USING PLANETARY GEARSET FOR MULTIPLE SOURCES OF TORQUE FOR VEHICLES,"Provided are alternative hybrid transmission systems for vehicles, as well as, propulsion systems and vehicles comprising such transmission systems, to improve various propulsion systems using a combination of at least two power sources with the option for simultaneous or alternating power input from two or more power sources, while providing desired characteristics or components. Such characteristics or components can include, but are not limited to: power, torque, acceleration, cruising speed or power, fuel efficiency, battery charging, endurance, power sizing, weight, capacity, efficiency, speed, mechanically and/or electrically added system requirements, design, fuel selection, functional design, structural design, lift to drag ratio, weight, and/or other desired characteristic or component.","Larrabee, Daniel (Centennial, CO, US)                
                            Wormer, Thomas Northrop (Denver, CO, US)                
                            Rhoade, Matthew (Lakewood, CO, US)                
                            Serani, Eric (Broomfield, CO, US)                
                            Marshman, Joshua B. (Broomfield, CO, US)                
                            Humbarger, Cody (Denver, CO, US)                
                            Gaide, Daniel (Boulder, CO, US)                
                            Hillery, Derek (Boulder, CO, US)                
                            Velazco, Alec (Boulder, CO, US)                
                            Petersen, Eric (Boulder, CO, US)                
                            Koster, Jean Nicolas (Boulder, CO, US)","LARRABEE DANIEL                
                            WORMER THOMAS NORTHROP                
                            RHOADE MATTHEW                
                            SERANI ERIC                
                            MARSHMAN JOSHUA B.                
                            HUMBARGER CODY                
                            GAIDE DANIEL                
                            HILLERY DEREK                
                            VELAZCO ALEC                
                            PETERSEN ERIC                
                            KOSTER JEAN NICOLAS",03/15/2012
US20100087687,US,04/08/2010,PROCESSING BIOMASS,"Biomass (e.g., plant biomass, animal biomass, and municipal waste biomass) is processed to produce useful products, such as fuels. For example, systems can use feedstock materials, such as cellulosic and/or lignocellulosic materials and/or starchy or sugary materials, to produce ethanol and/or butanol, e.g., by fermentation.","Medoff, Marshall (Brookline, MA, US)","XYLECO, INC. (Woburn, MA, US)",04/03/2009
US20240063690,US,02/22/2024,ADVANCED KINETIC ENERGY RECOVERY SYSTEM (AKERS) FOR ELECTRIC AIRCRAFT,"An electric aircraft powered and recharged by multiple redundant independent charging systems to ensure extended operation of the aircraft during normal operations. All systems are configured as electrical machine generators responsive to kinetic energy for generating electricity and are operatively combined to provide a constant high volume of charge sufficient to sustain operation of the aircraft for great distances and speeds. This means that this long-range aircraft can fly nonstop for almost 8 hours. The multiple redundant independent charging systems includes three advanced kinetic energy recovery systems including: a Paddlewheel Air Brake system, an Air Turbine with Exhaust Cone Generator system, and a Blade Rotors generation system and a first fly-by-wire aircraft to aircraft midair recharging system. The power from each machine system is routed to a smart charge combiner, a smart high-voltage ultracapacitor storage system, then the aircraft or battery bank under control of a smart charge controller.","Grayson, Michael Curtis (Bolivar, TN, US)",Assignee not found,06/05/2023
US20070264183,US,11/15/2007,"OIL-BEARING SANDS AND SHALES AND THEIR MIXTURES AS STARTING SUBSTANCES FOR BINDING OR DECOMPOSING CARBON DIOXIDE AND NOX, AND FOR PREPARING CRYSTALLINE SILICON AND HYDROGEN GAS, AND FOR PRODUCING NITRIDE, SILICON CARBIDE, AND SILANES","The crude oil reserves have a calculable time limit. Before, for example, the automobile industry, aviation, the weapons industry, and space travel change their combustion engines over to silanes, which are known to combust with the air nitrogen in a hot chamber and provide atomic hydrogen, a possibility must be found to reduce the high oil prices. The very large reserves of oilbearing sands and jails provide the requirement for this purpose. The hydrocarbons of the minerals are decomposed into hydrogen and hydrocarbon residues to provide primary energy.","Krass, Florian (Weggis, CH)","SINCONO AG (Zug, CH)",05/09/2007
US20230044154,US,02/09/2023,T-SCAVENGED OPPOSED PISTON ENGINE,"A novel two-stroke opposed piston engine with sleeve valves and T-scavenging breathing is provided. The two-stroke opposed piston engine has a unique uni-flow scavenging breathing that can deliver higher power density than the traditional uniflow-scavenging two-stroke opposed piston engine. Furthermore, a method of operating a two-stroke opposed piston engine is provided. The novel opposed piston engine can be a hybrid engine with one or more electric machines.","Naber, Clayton (San Mateo, CA, US)","Pinnacle Engines, Inc. (San Carlos, CA, US)",08/23/2022
US20220363613,US,11/17/2022,RENEWABLE ALKENE PRODUCTION ENGAGING METATHESIS,"Herein is provided a process for producing renewable products, such as alkenes, from a feedstock of biological origin. The process includes subjecting a feedstock including fatty acid glycerides and optionally free fatty acids, wherein at least one hydrocarbon chain is unsaturated, to esterification reaction in the presence of an alcohol. The ester stream thereby obtained is then fractionated and a fraction including esters of unsaturated C18 fatty acids is subjected to metathesis conditions in the presence of an alkene to obtain metathesis products. Fractionation of the metathesis products includes recovery of at least renewable 1-decene, and unsaturated C10-C15 fatty acid esters.","Hietala, Jukka (Porvoo, FI)                
                            Leminen, Anja (Porvoo, FI)                
                            Rämö, Virpi (Porvoo, FI)                
                            Räsänen, Jukka (Porvoo, FI)","Neste Oyj (Espoo, FI)",09/25/2020
US20120149516,US,06/14/2012,HYBRID TRANSMISSION USING PLANETARY GEARSET FOR MULTIPLE SOURCES OF TORQUE FOR AERONAUTICAL VEHICLES,"Provided are alternative hybrid transmission systems for marine, or two wheeled land vehicles, as well as propulsion systems and vehicles comprising such transmission systems, to improve various propulsion systems using a combination of at least two power sources with the option for simultaneous or alternating power input from two or more power sources, while providing desired characteristics or components. Such characteristics or components can include, but are not limited to: power, torque, acceleration, cruising speed or power, fuel efficiency, battery charging, endurance, power sizing, weight, capacity, efficiency, speed, mechanically and/or electrically added system requirements, design, fuel selection, functional design, structural design, lift to drag ratio, weight, and/or other desired characteristic or component.","Larrabee, Daniel (Centennial, CO, US)                
                            Wormer, Thomas Northrop (Denver, CO, US)                
                            Rhode, Matthew (Boulder, CO, US)                
                            Serani, Eric (Boulder, CO, US)                
                            Marshman, Josh (Broomfield, CO, US)                
                            Humbarger, Cody (Denver, CO, US)                
                            Gaide, Daniel (Pueblo, CO, US)                
                            Hillery, Derek (Boulder, CO, US)                
                            Velazco, Alec (Boulder, CO, US)                
                            Petersen, Eric (Centennial, CO, US)                
                            Koster, Jean Nicolas (Boulder, CO, US)","The Regents of the University of Colorado, a body corporate (Denver, CO, US)",12/30/2010
US20110281679,US,11/17/2011,"HYBRID TRANSMISSION USING PLANETARY GEARSET FOR MULTIPLE SOURCES OF TORQUE FOR MARINE, OR TWO WHEELED LAND VEHICLES","Provided are alternative hybrid transmission systems for marine, or two wheeled land vehicles, as well as propulsion systems and vehicles comprising such transmission systems, to improve various propulsion systems using a combination of at least two power sources with the option for simultaneous or alternating power input from two or more power sources, while providing desired characteristics or components. Such characteristics or components can include, but are not limited to: power, torque, acceleration, cruising speed or power, fuel efficiency, battery charging, endurance, power sizing, weight, capacity, efficiency, speed, mechanically and/or electrically added system requirements, design, fuel selection, functional design, structural design, lift to drag ratio, weight, and/or other desired characteristic or component.","Larrabee, Daniel (Centennial, CO, US)                
                            Wormer, Thomas Northrop (Denver, CO, US)                
                            Rhode, Matt (Boulder, CO, US)                
                            Serani, Eric (Boulder, CO, US)                
                            Marshman, Josh (Broomfield, CO, US)                
                            Humbarger, Cody (Denver, CO, US)                
                            Gaide, Daniel (Pueblo, CO, US)                
                            Hillery, Derek (Boulder, CO, US)                
                            Velazco, Alec (Boulder, CO, US)                
                            Petersen, Eric (Centennial, CO, US)                
                            Koster, Jean Nicolas (Boulder, CO, US)","The Regents of the University of Colorado, a body corporate (Denver, CO, US)",12/30/2010
US20230182908,US,06/15/2023,"HYBRID-ELECTRIC AIRCRAFT, AND METHODS, APPARATUS AND SYSTEMS FOR FACILITATING SAME","Hybrid-electric aircraft and a series hybrid powertrain configured to power the aircraft for a medium-haul flight. The series hybrid power train includes a plurality of energy storage units, at least one range extending generator, and a plurality of electric propulsors, each coupled to a distribution bus. The electric propulsors can produce a maximum thrust of at least 15 MW. During a cruise regime, the hybrid-electric aircraft can have an airspeed of at least 0.7 Mach at an altitude of less than 32000 feet, and the plurality of electric propulsors can have a fan pressure ratio of between 1.15 and 1.19. The hybrid-electric aircraft can have a degree of hybridization of at least 25% for the medium-haul flight and carbon dioxide equivalent (CO2e) well-to-wake greenhouse gas (GHG) emissions less than 0.25 lbs/Available Seat Mile (ASM).","Kumar, Ashish Andrew (Bellevue, WA, US)                
                            Knapp, Burton Matthew (Redmond, WA, US)","Zunum Aero, Inc. (Bothell, WA, US)",10/10/2022
US20130318938,US,12/05/2013,HEAT ENGINE,"A non-compression engine having two or three variable volume mechanisms, an induction-displacer (1) and a combustion-expander (2) or an induction-displacer (1) and a combustion-expander (2) and an atmospheric-cooler (3). A working volume of gas is drawn into the induction-displacer, then displaced into the combustion-expander (2) at substantially constant volume passing through the regenerator (5). The gas in the combustor-expander (2) is further heated by combustion of a fuel then expanded to extract work. The gas is then displaced through the regenerator (5) into the atmospheric-cooler (3) at substantially constant volume, or exhaust from the regenerator at constant pressure. The gas is contracted in the atmospheric-cooler doing atmospheric work. Once the gas has equilibrated with the pressure of the atmosphere it is exhaust from the atmospheric-cooler (3).","Coates, Nicholas Richard (Crowborough, GB)",COATES NICHOLAS RICHARD,10/25/2010
US20100304440,US,12/02/2010,PROCESSING BIOMASS,"Biomass (e.g., plant biomass, animal biomass, and municipal waste biomass) is processed to produce useful products, such as fuels. For example, systems can use feedstock materials, such as cellulosic and/or lignocellulosic materials and/or starchy or sugary materials, to produce ethanol and/or butanol, e.g., by fermentation.","Medoff, Marshall (Brookline, MA, US)","XYLECO, INC. (Woburn, MA, US)",08/03/2010
US20190144894,US,05/16/2019,PROCESSING BIOMASS,"Biomass (e.g., plant biomass, animal biomass, and municipal waste biomass) is processed to produce useful products, such as fuels. For example, systems can use feedstock materials, such as cellulosic and/or lignocellulosic materials and/or starchy or sugary materials, to produce ethanol and/or butanol, e.g., by fermentation.","Medoff, Marshall (Wakefield, MA, US)","Xyleco, Inc. (Wakefield, MA, US)",11/30/2018
