Document Number,Document Type,Publication Date,Title,Abstract,Inventor Name,Assignee,Filing Date
WO/2021/058876A1,WIPO,2021-04-01,RENEWABLE ALKENE PRODUCTION ENGAGING METATHESIS,"Herein is provided a process for producing renewable products, such as alkenes, from a feedstock of biological origin. The process comprises subjecting a feedstock comprising fatty acid glycerides and optionally free fatty acids, wherein at least one hydrocarbon chain is unsaturated, to esterification reaction in the presence of an alcohol. The ester stream thereby obtained is then fractionated and a fraction comprising esters of unsaturated C18 fatty acids is subjected to metathesis conditions in the presence of an alkene to obtain metathesis products. Fractionation of said metathesis products comprises recovery of at least renewable 1-decene, and unsaturated C10-C15 fatty acid esters.",HIETALA JUKKA (FI); LEMINEN ANJA (FI); RÄMÖ VIRPI (FI); RÄSÄNEN JUKKA (FI),NESTE OYJ (FI),2020-09-25
WO/1993/024366A1,WIPO,1993-12-09,FLYING VEHICLE,"The invention relates to aviation namely to flying vehicles adapted to ride on an air cushion and to effect a take-off and landing on aerodromes of any category. The goal of the invention is to design a flying vehicle capable of aerodynamically efficient flight both at low and high level flight, as well as take-off and landing from non-prepared aerodromes and from water under the conditions of stabilization and movement control of all flight regimes. The goal is achieved due to the fact that in a flying vehicle comprising a fuselage in the form of a carrying wing, a power installation, a take-off and landing air cushion device, a gasodynamic system of boundary layer control, a device for controlling the position of flow leaving the trailing edge as well as stabilization and flight control systems, the take-off and landing air cushion device consists of a propelling slot nozzle (12) and side skegs (17) between which are mounted rotatable flaps (21, 22, 23) controlling the flight of the vehicle and regulating the position of the pressure centre on the bottom. The fuselage has the form of a cylindrical segment conjugating at its sides with spherical fairings.",SAVITSKY ANATOLY IVANOVICH (RU); SCHUKIN LEV NIKOLAEVICH (RU); KARELIN VIKTOR GEORGIEVICH (RU); PUSHKIN ROSTISLAV MIKHAILOVICH (RU); MASS ALEXANDR MIKHAILOVICH (RU); SHIBANOV ANATOLY PETROVICH (RU); SCHUKIN ILYA LVOVICH (RU); KHUTSISCHVILI VLADIMIR GEORGIE (RU); FISCHENKO SERGEI VIKTOROVICH (RU); ERMISCHIN ALEXANDR VIKTOROVICH (RU); SOBKO ALEXANDR PAVLOVICH (RU),EKIP N PROIZV KOOPERATIVNAYA (RU); SAVITSKY ANATOLY IVANOVICH (RU); SCHUKIN LEV NIKOLAEVICH (RU); KARELIN VIKTOR GEORGIEVICH (RU); PUSHKIN ROSTISLAV MIKHAILOVICH (RU); MASS ALEXANDR MIKHAILOVICH (RU); SHIBANOV ANATOLY PETROVICH (RU); SCHUKIN ILYA LVOVICH (RU); KHUTSISCHVILI VLADIMIR GEORGIE (RU); FISCHENKO SERGEI VIKTOROVICH (RU); ERMISCHIN ALEXANDR VIKTOROVICH (RU); SOBKO ALEXANDR PAVLOVICH (RU),1993-01-21
EP3669342A1,EP,2020-06-24,AN UNMANNED AERIAL VEHICLE SYSTEM FOR INSPECTING RAILROAD ASSETS,"An aerial system control network, an unmanned aerial vehicle (UAV) system, and a method provide for inspecting railroad assets using a UAV. The aerial system control network includes a plurality of towers and a ground control system connected to the plurality of towers. The ground control system transmits, via a plurality of communication towers, a flight plan including a rail system and a flight path; receives, via the plurality of communication towers, data while the UAV is in monitoring the rail system; detects an interference along the flight path based on the received data, and adjusts the flight plan based on the interference.",GRAETZ TODD (US); GRISSUM GARY (US); MISCHKE MICHAEL (US),"BNSF RAILWAY CO (Fort Worth, TX 76131, US)",2018-08-15
EP2430720B1,EP,2020-02-26,DISTRIBUTED POWER GENERATION,"Distributed power generation systems generally include a number of power sources and electrical power loads interconnected by a distribution network. Electrical switches and fuses are provided such that local groups of power sources and power loads can be established. Should there be a degradation in the distribution network in terms of a set of criteria such as electrical frequency, current or voltage then the switch or fuse may be thrown to establish each local group as an island. By monitoring divergence from a set of criteria a method and controller may be utilised whereby the distribution network as a whole is considered and configured to establish virtual islands which operate prior to the establishment whether inadvertently or deliberately of actual islands within the distribution network. In such circumstances the transition from normal operation for the distribution network to islanded operation for the distribution network is less severe.",ROSCOE ANDREW (GB); TRAINER DAVID (GB); KNIGHT RICHARD (GB),"ROLLS ROYCE PLC (London N1 9FX, GB)",2010-04-29
WO/2015/184252A1,WIPO,2015-12-03,ELECTRICAL POWER GENERATION SYSTEMS AND METHODS REGARDING SAME,"A solid or liquid fuel to plasma to electricity power source that provides at leas; one of electrical and thermal power comprising (i) at least one reaction cell for the catalysis of atomic hydrogen to form hydrinos, (ii) a chemical feel mixture comprising at least two components chosen from: a source of H2O catalyst or H2O catalyst; a source of atomic hydrogen or atomic hydrogen; reactants to form the source of H2O catalyst or H2O catalyst and a source of atomic hydrogen or atomic hydrogen; one or more reactants to initiate the catalysis of atomic hydrogen; and a material to cause the feel to be highly conductive, (iii) a fuel injection system such as a railgun shot injector, (iv) at least one set of electrodes that confine the fuel and an electrical power source that provides repetitive short bursts of low-voltage, high-current electrical energy to initiate rapid kinetics of the hydrino reaction and an energy gain due to forming hydrinos to torn! a brilliant-light emitting plasma, (v) a product recovery system such as at least one of an augmented plasma railgun recovery system and a gravity recovery system (vi) a fuel pelletizer or shot maker comprising a s me Her. a source or hydrogen and a source of H2O, a dripper and a water bath to form fuel pellets or shot, and an agitator to teed shot into the injector, and (vii) a power converter capable of converting the high-power light output of the cell into electricity such as a concentrated solar power device comprising a plurality of ultraviolet (UV) photoelectric cells or a plurality of photoelectric cells, and a UV window.",MILLS RANDELL L (US),BLACKLIGHT POWER INC (US),2015-05-29
DE1014852B,DE,1957-08-29,Steuerung fuer den Vortriebsschub und die Fluggeschwindigkeit von Flugmotoren,,OWEN JOHN CHESTER,BENDIX AVIAT CORP,1956-09-21
WO/2009/140057A2,WIPO,2009-11-19,PROCESSING BIOMASS,"Biomass (e.g., plant biomass, animal biomass, and municipal waste biomass) is processed to produce useful products, such as fuels. For example, systems can use feedstock materials, such as cellulosic and/or lignocellulosic materials and/or starchy or sugary materials, to produce ethanol and/or butanol, e.g., by fermentation.",MEDOFF MARSHALL (US),XYLECO INC (US); MEDOFF MARSHALL (US),2009-04-28
WO/2016/170072A2,WIPO,2016-10-27,SHRINKABLE AND EXPANDABLE DEVICE,"The present invention relates to a shrinkable and expandable device (1) comprising a center (2), three or more shrinkable and expandable arms (3), which are connected to the center (2), at least one power source (4), at least one motor (5) with a switch (6), wherein the motor (5) is connected to the power source (4) and the arms (3), at least one shrink element (7) to shrink the arms (3), and at least one expansion element (8) to expand the arms (3), wherein the shrinking and/or expansion of the arms (3) is powered by the motor (5). Claimed also is a process to make the device (1) and uses of the device (1), e.g. as an umbrella, tent, parachute, safety equipment and a number of various industrial uses.",MOTTALE SIMA (CH),MOTTALE SIMA (CH),2016-04-21
WO/2020/141254A1,WIPO,2020-07-09,PROCESS FOR CATALYTIC PRODUCTION OF PROPANOL,"The present disclosure is related to a multistep process for producing renewable gasoline components from a glyceride containing feedstock. The glycerides are split to provide a stream comprising fatty acids, or esters of fatty acids, and another stream comprising glycerol and water. Glycerol, preferably as crude glycerol recovered from splitting, is next converted to propanols at vapor phase, providing a renewable propanol gasoline component. Another renewable gasoline component is obtained from hydroprocessing of the fatty acids or esters thereof, as a renewable paraffinic naphtha component. Blending said renewable components, provides a novel 100 % renewable gasoline.",TIITTA MARJA (FI); KARVO ANNA (FI); KIISKI ULLA (FI); KOLEHMAINEN TERHI (FI); MYLLYOJA JUKKA (FI); PAASIKALLIO VILLE (FI),NESTE OYJ (FI),2019-12-20
EP2580339B1,EP,2019-12-04,PROCESS FOR PRODUCTION OF BIOFUELS,"According to one embodiment, a system and process for the equalization of pressures of a flow stream across one or more valves is provided. A process circuit having clean non-abrasive fluid and at least one slave cylinder for transmitting pressure to a process flow stream is employed.",BATHURST CHRISTOPHER FRANCIS (NZ),"SOLRAY HOLDINGS LTD (Christchurch 8011, NZ)",2011-05-05
WO/2015/184252A9,WIPO,2016-03-24,ELECTRICAL POWER GENERATION SYSTEMS AND METHODS REGARDING SAME,"A solid or liquid fuel to plasma to electricity power source that provides at leas; one of electrical and thermal power comprising (i) at least one reaction cell for the catalysis of atomic hydrogen to form hydrinos, (ii) a chemical feel mixture comprising at least two components chosen from: a source of H2O catalyst or H2O catalyst; a source of atomic hydrogen or atomic hydrogen; reactants to form the source of H2O catalyst or H2O catalyst and a source of atomic hydrogen or atomic hydrogen; one or more reactants to initiate the catalysis of atomic hydrogen; and a material to cause the feel to be highly conductive, (iii) a fuel injection system such as a railgun shot injector, (iv) at least one set of electrodes that confine the fuel and an electrical power source that provides repetitive short bursts of low-voltage, high-current electrical energy to initiate rapid kinetics of the hydrino reaction and an energy gain due to forming hydrinos to torn! a brilliant-light emitting plasma, (v) a product recovery system such as at least one of an augmented plasma railgun recovery system and a gravity recovery system (vi) a fuel pelletizer or shot maker comprising a s me Her. a source or hydrogen and a source of H2O, a dripper and a water bath to form fuel pellets or shot, and an agitator to teed shot into the injector, and (vii) a power converter capable of converting the high-power light output of the cell into electricity such as a concentrated solar power device comprising a plurality of ultraviolet (UV) photoelectric cells or a plurality of photoelectric cells, and a UV window.",MILLS RANDELL L (US),BRILLIANT LIGHT POWER INC (US),2015-05-29
EP2580339A1,EP,2013-04-17,SYSTEM AND PROCESS FOR PRODUCTION OF BIOFUELS,"According to one embodiment, a system and process for the equalization of pressures of a flow stream across one or more valves is provided. A process circuit having clean non-abrasive fluid and at least one slave cylinder for transmitting pressure to a process flow stream is employed.",BATHURST CHRISTOPHER FRANCIS (NZ),SOLRAY ENERGY LTD (NZ),2011-05-05
EP3408108A1,EP,2018-12-05,METHOD FOR PRODUCING A PRINTED DECORATIVE PANEL,"The disclosure relates to a method for producing a printed panel, comprising the following steps: a) providing a flat carrier; b) optionally applying a resin layer to the flat carrier; c) optionally applying a paper layer or nonwoven layer to the flat carrier; d) optionally calendering the produced layer structure, in particular at a temperature between ≥40° C. and ≤250° C., and e) optionally applying a printing substrate to the flat carrier; characterized in that the method has the following further steps: f) printing an application amount of radiation-curing printing ink onto the carrier, and g) curing the previously applied printing ink by treating the printing ink with radiation, wherein h) at least one parameter of radiation used in step g) is adapted to an application amount of radiation-curing printing ink, wherein step h) is based on an application amount of the radiation-curing printing ink determined by a sensor during the printing process, wherein at least one parameter of radiation used in step g) is adapted during the printing on the carrier according to step f).",BUHLMANN CARSTEN (DE),"SURFACE TECH GMBH & CO KG (15837 Baruth, DE)",2017-01-24
WO/2015/080902A1,WIPO,2015-06-04,UNSUPPORTED HETEROPOLYACID METAL SALT CATALYSTS FOR DIMERIZATION AND/OR OLIGOMERIZATION OF OLEFINS,"The present invention relates to unsupported metal (e.g., cesium) substituted heteropolyacid catalyst compositions useful for the production of butene dimers and/or oligomers from a mixed butenes feed, in which, under mild conditions, all isomers of mixed butenes produce highly branched C8 and C8+ olefins, useful as octane enhancers.",SUN MIAO (SA); XU WEI (SA),SAUDI ARABIAN OIL CO (SA); ARAMCO SERVICES CO (US),2014-11-18
WO/2014/126489A1,WIPO,2014-08-21,ELECTROLYSER AND METHOD FOR PRODUCING SYNTHESIS GAS BY WATER ELECTROLYSIS USING GRAPHITE/CARBON ELECTRODES,"The present invention relates to an alkaline electrolyser characterised in that electrolysis is performed without separating the hydrogen and oxygen gases obtained by the dissociation of the water by the graphite electrodes (2) that are isolated by separating plates (1) and permanently attached inside a suitably sealed tank (5) containing de-ionised water to which a sodium hydroxide electrolyte with a low concentration is added, the terminal electrodes forming the positive pole (4) and the negative pole (3). Each of the graphite plates (2) has two holes that form two electrolyte circulation channels; the bottom channel (6) is connected to the electrolyte inlet and the top channel (7) corresponds to the electrolyte outlet channel, entraining the gases produced during the electrolysis and oxidation process. The present invention also relates to the electrolytic process carried out in the electrolyser designed according to claim 1, supplied by an electric power source and producing a gaseous mixture containing hydrogen and oxygen which are conveyed to a reactor containing the carbonaceous material, yielding synthesis gas.",SANTANA CAMPOS RODRIGUES JOSÉ JO O (PT),SANTANA CAMPOS RODRIGUES JOSÉ JO O (PT),2014-02-13
WO/2013/158343A1,WIPO,2013-10-24,VARIOUS METHODS AND APPARATUSES FOR MULTI-STAGE SYNTHESIS GAS GENERATION,"A multiple stage synthesis gas generation system is disclosed including a high radiant heat flux reactor, a gasifier reactor control system, and a Steam Methane Reformer (SMR) reactor. The SMR reactor is in parallel and cooperates with the high radiant heat flux reactor to produce a high quality syngas mixture for MeOH synthesis. The resultant products from the two reactors may be used for the MeOH synthesis. The SMR provides hydrogen rich syngas to be mixed with the potentially carbon monoxide rich syngas from the high radiant heat flux reactor. The combination of syngas component streams from the two reactors can provide the required hydrogen to carbon monoxide ratio for methanol synthesis. The SMR reactor control system and a gasifier reactor control system interact to produce a high quality syngas mixture for the MeOH synthesis.",SIMMONS WAYNE W (US); WHITE SIDNEY P (US); PERKINS CHRISTOPHER (US),SUNDROP FUELS INC (US),2013-03-26
WO/2024/006078A1,WIPO,2024-01-04,"HIGH IMPACT-RESISTANT, REINFORCED FIBER FOR LEADING EDGE PROTECTION OF AERODYNAMIC STRUCTURES","Systems and methods for protecting an aerodynamic structure, e.g., a wind turbine blade, rotor blade, aerodynamic aerostructure, etc., are provided. Long fiber reinforced composites having a helicoidal architecture with material aligned with a graded hardness and stiffness are used to develop an efficient and highly tailorable leading edge protection (LEP) solution with longer durability than conventional solutions while yielding lighter, and optionally, more environmentally sustainable solutions. At least a portion of the plurality of plies are helicoidally arranged relative to one another to tailor stress wave propagation speed of the aerodynamic blade and to provide load carrying strength for the aerodynamic blade.",BERT ANTHONY (FR); MENCATTELLI LORENZO (GB); KISAILUS DAVID (US); WASILENKOFF CHADWICK (US),HELICOID IND INC (US),2023-06-14
EP2183414B1,EP,2017-02-15,FLUOROPOLYMER FINE FIBER,A layer of fluoropolymer fine fiber can be made. The fine fiber can be made by electrospinning from a solvent or a solvent blend. The layers of the invention are useful in general filtration of fluid streams including gaseous and liqiud streams. The fine fiber layers are also useful as hydrophobic filtration layers that can be used to separate water from a hydrocarbon stream.,FERRER ISMAEL (US); YANG CHUANFANG (US),"DONALDSON CO INC (Minneapolis, MN 55440-1299, US)",2008-07-31
WO/2011/008337A2,WIPO,2011-01-20,"FLUID DYNAMIC SECTION HAVING ESCAPELET OPENINGS FOR REDUCING INDUCED AND INTERFERENCE DRAG, AND ENERGIZING STAGNANT FLOW","A fluid dynamic section (11) provides one or more fixed size escapelets (17, 19) through a foil body to reduce the induced and interference drag caused by trailing vortices and similar wake turbulence. The escapelets, which can be provided in both aerodynamic and hydrodynamic structures, such as wings, tail sections, rotary blades, guy wire frames, wing sails, and various underwater keels and wing keels. The escapelets transfer energy from an inlet (51) located in the high-pressure surface (25) of the foil or foil body to an outlet (53) located in the lower-pressure surface (27), allowing energy that would normally form a vortex at the tip of the foil to be redirected and dissipated in a beneficial way. As a result, drag is reduced and fuel economy is increased, while at the same time increasing the authority of ailerons and similar flight control surfaces, allowing aircraft that were not previously spin recovery rated to become spin recoverable.",LONG DONALD JAMES (US),LONG DONALD JAMES (US),2010-05-18
WO/2011/016878A1,WIPO,2011-02-10,HETEROGENEOUS HYDROGEN-CATALYST POWER SYSTEM,"A power source and hydride reactor is provided that powers a power system comprising (i) a reaction cell for the catalysis of atomic hydrogen to form hydrinos, (ii) a chemical fuel mixture comprising at least two components chosen from: a source of catalyst or catalyst; a source of atomic hydrogen or atomic hydrogen; reactants to form the source of catalyst or catalyst and a source of atomic hydrogen or atomic hydrogen; one or more reactants to initiate the catalysis of atomic hydrogen; and a support to enable the catalysis, (iii) thermal systems for reversing an exchange reaction to thermally regenerate the fuel from the reaction products, (iv) a heat sink that accepts the heat from the power-producing reactions, and (v) a power conversion system. In an embodiment, the catalysis reaction is activated or initiated and propagated by one or more other chemical reactions such as a hydride-halide exchange reaction between a metal of the catalyst and another metal. These reactions are thermally reversible by the removal of metal vapor in the reverse exchange. The hydrino reactions are maintained and regenerated in a batch mode using thermally- coupled multi-cells arranged in bundles wherein cells in the power-production phase of the cycle heat cells in the regeneration phase. In this intermittent cell power design, the thermal power is statistically constant as the cell number becomes large, or the cells cycle is controlled to achieve steady power. In another power system embodiment, the hydrino reactions are maintained and regenerated continuously in each cell wherein heat from the power production phase of a thermally reversible cycle provides the energy for regeneration of the initial reactants from the products. Since the reactants undergo both modes simultaneously in each cell, the thermal power output from each cell is constant. Thermal power is converted to electrical power by a heat engine exploiting a cycle such as a Rankine, Brayton, Stirling, or steam-engine cycle. In another embodiment, the exchange reactions are constituted in half-cell reactions as the basis of a unique fuel cell wherein direct electrical power is developed with energy released by the reaction of hydrogen to form hydrinos.",MILLS RANDELL L (US),BLACKLIGHT POWER INC (US); MILLS RANDELL L (US),2010-03-18
EP3856640A1,EP,2021-08-04,METHODS AND SYSTEMS FOR IN-FLIGHT CHARGING OF AIRCRAFT,"A method of operating a supply aircraft for in-flight recharging comprises: transmitting a deploy command signal from a communication unit of the supply aircraft to a communication unit of a receiver aircraft, to cause a line and drogue to deploy from the receiver aircraft; controlling at least one of the supply aircraft and the drogue to engage the drogue with a first end of an electrical cable of the supply aircraft, a second end of the electrical cable being connected to the supply aircraft; and transmitting a return command signal from the communication unit of the supply aircraft to the communication unit of the receiver aircraft, to cause the line and drogue to return to the receiver aircraft with the first end of the electrical cable. The supply aircraft is located behind the receiver aircraft and the deploy command signal is for causing the line and drogue to deploy rearwardly of the receiver aircraft.",PITMAN JAMES (GB),"BRULIC LTD (Hove, East Sussex BN3 2FA, GB)",2019-09-19
WO/2001/000277A1,WIPO,2001-01-04,FIRE EXTINGUISHING APPARATUS,"Fire extinguishing apparatus comprises a tube (16) of thermoplastic material containing a pressurised non-combustion-sustaining gas (e.g., nitrogen) connected to and normally maintaining closed a servo-valve (17), a pressurised water reservoir (18) connected through the servo-valve, when actuated upon rupture of the pressurised tube (16), to at least one nozzle (19) capable of projecting a water fog with a droplet size of the order of 10 microns diameter; and the apparatus is shown applied to a deep fat fryer (10), the nozzle (19) being disposed in an extractor hood (11) 1.0 to 1.5 metres above the fryer along with a portion of the tube (16) which extends into a plenum (13) and ducting (14, 15) in which are disposed further nozzles (20, 21).",WAGGOTT DAVID (GB),WAGGOTT DAVID (GB),2000-06-27
EP2387653A2,EP,2011-11-23,ROTARY ENERGY CONVERTER WITH RETRACTABLE BARRIER,"A rotary internal combustion engine includes outer and inner housings defining an enclosure therebetween, and first and second side housings disposed on opposite sides of the outer housing. The inner housing is rotatable relative to the outer housing, at least one retractable barrier and at least one fixed barrier. The at least one retractable barrier and the at least one fixed barrier are disposed in the enclosure so as to divide the enclosure into a combustion chamber and an exhaust chamber. The at least one retractable barrier is mounted along a pivot axis and is pivotable between an extended position and a retracted position. An intake port, exhaust port, and ignition source are also provided. An exhaust duct extends from within the enclosure to outside the outer housing in a direction tangent to flow in the enclosure.",HUDSON SCOTT (US),HUDSON SCOTT (US),2010-01-06
WO/2022/169917A1,WIPO,2022-08-11,"ENVIRONMENTALLY-CLEAN WATER-BASED FIRE INHIBITING AND EXTINGUISHING COMPOSITIONS, AND METHODS OF AND APPARATUS FOR APPLYING THE SAME","An environmentally-clean water-based fire inhibiting and extinguishing compositions, and methods of and apparatus for applying the same, The environmentally-clean aqueous-based fire inhibitor biochemical compositions and concentrates in liquid phase can be atomized and sprayed, over a broad ambient working temperature range, as a fine mist over ground surfaces, native ground fuel, living plants, trees and shrubs and when dried forming a durable fire protective coatings having improved surface coverage, and being an effective proactive wildfire inhibitor. These environmentally-clean aqueous-based fire inhibitor biochemical compositions can also be applied to wood products, and wood-framed and mass-timber buildings, decks and anything of a combustible nature, to provide proactive wildfire protection without compromising wood-fiber strength or producing volatile organic components (VOCs).",CONBOY STEPHEN (US),M FIRE HOLDINGS LLC (US),2022-02-02
