Document Number,Document Type,Publication Date,Title,Abstract,Inventor Name,Assignee,Filing Date
JP2787061B2,JP,1998-08-13,【発明の名称】操縦制御用ディスプレイ,"PURPOSE:To provide a display screen, by which optimum display to a pilot can be made, and the flying condition of a pilotless aircraft can be understood and judged easily and precisely by the pilot by collectively displaying various kinds of flying data on a special-purpose control display, and providing a function capable of changing the display screen so as to be suitable for the pilot. CONSTITUTION:Plural pilotless aircrafts 11a-11n are loaded with telemeter signal transmitters 9a-9n, and control signal receivers 10a-10n, and on the other hand, a control display system special for each aircraft is provided on the ground side. Various kinds of flying data transmitted from the pilotless aircrafts 1a-11n is collectively displayed on one screen of the control display 1a-1n, and the display screen of the control display 1a-1n is changed depending on pilots 4a-4n, or switched to be displayed in scroll or dividing method.",YOKOTA KOICHI,NIPPON KOKU DENSHI KOGYO KK,1993-04-28
JP2015513531A,JP,2015-05-14,エネルギー変換および生成のための方法およびシステム,本発明は、電気エネルギーを化学エネルギーに変換する方法およびシステムに関するものであり、任意選択的にそのエネルギーを回収して必要に応じて電気を発生させる方法およびシステムに関する。好ましい実施形態において、電気エネルギー源の少なくとも一部は再生可能なエネルギー源から得られるものである。本発明によれば、ＣＯ２を大気中に放出することなく、利便性の高いエネルギー変換および生成が可能となる。【選択図】図１,Robert Simpson,Thermogas Dynamics Limited,2013-02-18
JP6450397B2,JP,2019-01-09,生物学的原材料から得られたパラフィンフラクションを含む組成物及びそれを製造する方法,"A composition, including 40-50 wt-% C14 paraffins, based on the total weight of the composition, and 35-45 wt-% C15 paraffins, based on the total weight of the composition, wherein the C14 and C15 paraffins are produced from a biological raw material.","Aalto, Pekka; Sand Bali, Katy; Neiman, Tomi; Hakora, maya","Neste Yurkinen, Salmon, Yukitua",2014-12-30
JP2022534294A,JP,2022-07-28,タンデム翼および分散型推進システムを使用する新規の航空機設計,本明細書に説明される主題は、航空機設計に関し、より具体的に、タンデム翼および分散型推進システムを使用する航空機設計に関する。説明される実施形態は、空気力学、推進力、構造、および安定性／制御の間の相乗効果を可能にする。一実施形態では、タンデム翼は、第１の翼組と第２の翼組とを含み、第１の翼組と第２の翼組の各々は、翼幅に沿って設置されるスラスタの組を伴う翼幅をする。一実施形態では、航空機は、前翼組および後翼組であって、各翼組は、右舷翼および左舷翼を有し、各翼は、翼端を有する、前翼組および後翼組と、前翼組の幅にわたって分配された複数の固定スラスタと、後翼組の幅にわたって分配された複数の固定スラスタとを備えている。,"Hosseini, Cave","Craft Aerospace Technologies, Incorporated",2020-05-28
JP2020518515A,JP,2020-06-25,一体型陸上−航空輸送システム,一体型陸上−航空輸送システムインフラストラクチャの一部として機能する乗客運搬空中車両は、ルートの臨界的な部分を航空輸送によって完結することを可能にする。いくつかの実装において、空中車両（ＡＶ）は、使用サイクルを通じて単一のユニットのままであるが、路上走行可能な車両を形成するためにスタンドアロン陸上車両アセンブリ（ＳＧＶ）との統合に対してＡＶを最適化するために、再構成可能な推進システムを利用する。他の実装において、客室は交互に、空中車両を形成するためにエアロモジュールと、及び陸上車両を形成するためにＳＧＶと、典型的には客室ユニット内に配置されるエアロモジュール用の動力源の少なくとも一部と、ドッキングする。【選択図】図３ｄ,"Tal, Oren; Tal, Leuven",Flyon Aero Systems LDT.,2018-04-29
JP2013542547A,JP,2013-11-21,電気化学的水素-触媒パワ-・システム,"An electrochemical power system is provided that generates an electromotive force (EMF) from the catalytic reaction of hydrogen to lower energy (hydrino) states providing direct conversion of die energy released from the hydrino reaction into electricity, the system comprising at least two components chosen from: a catalyst or a source of catalyst; atomic hydrogen or a source of atomic hydrogen; reactants to form the catalyst or source of catalyst and atomic hydrogen or source of atomic hydrogen, and one or more reactants to initiate the catalysis of atomic hydrogen. The electrochemical power system for forming hydrinos and electricity can further comprise a cathode compartment comprising a cathode, an anode compartment comprising an anode, optionally a salt bridge, reactants that constitute hydrino reactants during cell operation with separate electron flow and ion mass transport, and a source of hydrogen. Due to oxidation-reduction cell half reactions, the hydrino-producing reaction mixture is constituted with, the migration of electrons through an external circuit and ion mass transport through a separate path such as the electrolyte to complete an electrical circuit. A power source and hydride reactor is further provided that powers a power system comprising (i) a reaction cell for the catalysis of atomic hydrogen to form hydrinos, (ii) a chemical fuel mixture comprising at least two components chosen from: a source of catalyst or catalyst; a source of atomic hydrogen or atomic hydrogen; reactants to form the source of catalyst or catalyst and a source of atomic hydrogen or atomic hydrogen; one or more reactants to initiate the catalysis of atomic hydrogen; and a support to enable the catalysis, (iii) thermal systems for reversing an exchange reaction to thermally regenerate the fuel from the reaction products, (iv) a heat sink that accepts the heat from the power-producing reactions, and (v) a power conversion system.","Mills, Randell El.",Black Light Power Incorporated,2011-03-17
JP2015520251A,JP,2015-07-16,光開始剤を有する硫黄含有ポリマーを基礎とする母材及びシーラント、硬化及び被覆する方法並びにその使用,本発明は、硬化を、指令によりかつシーラントの不粘着表面が硬化開始時点から０．０５〜５分の不粘着時間で達成されるように急速に行う、硫黄含有ポリマーを基礎とする母材及び硬化剤からなる混合物の硬化方法、並びに硫黄含有ポリマーを有するシーラントの製造及び硬化のための母材及び硬化剤からなる混合物を用いた基材の被覆方法であって、混合物は、イソシアナート含分を有する未硬化の混合物であり、母材は未硬化でありかつ、ポリエーテル、ポリチオエーテル、ポリスルフィド、それらのコポリマー及び／又はそれらの混合物を基礎とするメルカプト末端基のベースポリマーを有し、未硬化の母材、硬化剤又はその両方は、立体障害の第３級アミンを基礎とする少なくとも１つの光開始剤を有し、少なくとも１つの光開始剤は高エネルギーの化学線の作用の際に、第３級アミンを基礎とする１分子当たり少なくとも１つのラジカルを脱離し、このラジカルから、特にＨ引き抜きにより活性触媒が形成され、この活性触媒は、シーラントの硬化のための触媒として作用することができ、この混合物は、高エネルギーの化学線の作用時点から−１０〜＋７０℃の温度範囲で硬化し、この混合物は硬化開始時点からシーラントといわれる、基材の被覆方法に関する。本発明は、更に、相応する母材Ａ、混合物Ｂ、硬化剤及びシーラント系並びにこれらを有する航空機にも関する。,Miroslav kralev; Bian Zie Firth; Peter Bons; Francisco Dies,Chemetall GmbH,2013-04-09
JP2015531228A,JP,2015-11-02,森林管理システム,森林（２０６）を管理するための方法及び装置が提供される。森林管理システム（１００）は、森林マネージャー（２０２）を備える。森林マネージャー（２０２）は、一群の自律したビークル（２２６）から森林（２０６）についての情報（２２０）を受信し、情報（２２０）から森林（２０６）の状態（３０４）についての結果（３０２）を発生させるために情報（２２０）を分析し、かつ結果（３０２）を使用して前記一群の自律したビークル（２２６）の作動を調整するように構成される。【選択図】図１,"Vian, john; Lowe, George M.; Prusch Vulco, Joshua",The Boeing Company,2013-08-09
JP6461795B2,JP,2019-01-30,森林管理システム,"A method and apparatus of managing a forest. A forestry management system comprises a forestry manager. The forestry manager is configured to receive information about a forest from a group of autonomous vehicles, analyze the information to generate a result about a state of the forest from the information, and coordinate operation of the group of autonomous vehicles using the result.","Vian, john; Lowe, George M.; Prusch Vulco, Joshua",The Boeing Company,2013-08-09
JP6430885B2,JP,2018-11-28,新規な往復動機械およびその他の装置,,"Hindarks, Mitoja, Victor","Hindarks, Mitoja, Victor",2015-04-24
JPWO2019083030A1,JP,2020-12-17,カーボンナノチューブ被覆電線およびその施工方法、識別マークの検出方法,識別性に優れたカーボンナノチューブ被覆電線を提供する。複数のカーボンナノチューブで構成されるカーボンナノチューブ集合体の単数または複数からなるカーボンナノチューブ線材と、カーボンナノチューブ線材を被覆する絶縁被覆層とを備え、絶縁被覆層は、識別マークを有する、カーボンナノチューブ被覆電線。,Hideki Aizawa; Satoshi Yamazaki; Tomohisa Yamashita; Kenji Hatamoto,"THE FURUKAW ELECTRIC CO.,LTD.",2018-10-26
JP5165737B2,JP,2013-03-21,火炎抑制システムおよび航空機用火炎抑制システム,"A fire suppression system (20) includes a container (22) for supplying a fire suppression agent into a compartment (A, B, C) to be protected. The container (22) communicates with a flow line (25) leading to the compartment (A ,B, C). A control (34) controls the fire suppression system, and a valve (30) on the flow line (25) delivers a variable pressure to the flow line (25) from the container (22). Further, a system is disclosed and claimed wherein a single gas supply communicates through a manifold (23) to each of a plurality of compartments (A, B, C). In addition, a system is disclosed and claimed wherein a primary gas supply container (22) switches to secondary gas supply containers (24) once a pressure within the primary gas supply (22) container drops below a predetermined amount.",Josephine Gabriel Gatosonides; Robert G. Dunster,"Kidda Technologies, Inc.",2010-08-17
JP7189882B2,JP,2022-12-14,カーボンナノチューブ被覆電線およびその施工方法、識別マークの検出方法,"Provided is a coated carbon nanotube electric wire superior in identifiability. The coated carbon nanotube electric wire includes: a carbon nanotube wire including one or a plurality of carbon nanotube aggregates formed by a plurality of carbon nanotubes; and an insulating coating layer coating the carbon nanotube wire, wherein the insulating coating layer has an identification mark.",Hideki Aizawa; Yamazaki Satoshi; Satoshi Yamashita; Kenji Hatamoto,"THE FURUKAW ELECTRIC CO.,LTD.",2018-10-26
JP7173680B2,JP,2022-11-16,軟質ポリウレタンフォーム用の反応性難燃剤混合物,"The present invention provides dialkyl phosphorus-containing compounds, namely reactive mono-hydroxyl-functional dialkyl phosphinates in a blend with a phosphate compound, said blend serving as highly efficient reactive flame retardant blend in flexible polyurethane foam. The invention further provides fire-retarded polyurethane compositions comprising said the reaction product of the flame retardant blend with polyol and isocyanate foam forming components.","Swell, Jeffrey; Chen, Jihao; Patel, Munjar","ICL-IP America, Inc.; ICL-IP AMERICA INC.",2018-07-23
JP6882160B2,JP,2021-06-02,植物脂質から工業製品を製造する工程,"The present invention relates to methods of producing industrial products from plant lipids, particularly from vegetative parts of plants. In particular, the present invention provides oil products such as biodiesel and synthetic diesel and processes for producing these, as well as plants having an increased level of one or more non-polar lipids such as triacylglycerols and an increased total non-polar lipid content. In one particular embodiment, the present invention relates to combinations of modifications in two or more of lipid handling enzymes, oil body proteins, decreased lipid catabolic enzymes and/or transcription factors regulating lipid biosynthesis to increase the level of one or more non-polar lipids and/or the total non-polar lipid content and/or mono-unsaturated fatty acid content in plants or any part thereof. In an embodiment, the present invention relates to a process for extracting lipids. In another embodiment, the lipid is converted to one or more hydrocarbon products in harvested plant vegetative parts to produce alkyl esters of the fatty acids which are suitable for use as a renewable biodiesel fuel.",Thomas Van Haake; James Robertson Petrie; Anna El Turchy; Slinder Pal Singh; Kyle Reynolds; Kin Liu; Benjamin Aldo Reita,COMMONWEALTH SCIENTIFIC AND INDUSTRIAL RESEARCH ORGANISATION,2015-07-07
JP2017529060A,JP,2017-10-05,植物脂質から工業製品を製造する工程,本発明は、植物脂質、特に植物の生育部分から工業製品を製造する方法に関する。特に、本発明は、バイオディーゼル及び合成ディーゼルなどの油製品、ならびにこれらを製造する工程に加え、トリアシルグリセロール等の１つ以上の非極性脂質レベルの増加した植物、及び非極性脂質の総含有量の増加した植物を提供する。特定の一実施形態では、本発明は、植物またはその任意の部分において、１つ以上の非極性脂質のレベル及び／または非極性脂質の総含有量及び／または一価不飽和脂肪酸含有量を増加させる、２つ以上の脂質処理酵素、油体タンパク質、低脂質分解酵素及び／または脂質生合成を調節する転写因子の改変の組み合わせに関する。一実施形態では、本発明は脂質の抽出工程に関する。別の実施形態では、採取された植物生育部分において、脂質を１つ以上の炭化水素生成物へと転換し、再生可能バイオディーゼル燃料としての用途に適した脂肪酸のアルキルエステルを製造する。,Thomas Van Haake; James Robertson Petrie; Anna El Turchy; Slinder Pal Singh; Kyle Reynolds; Kin Liu; Benjamin Aldo Reita,COMMONWEALTH SCIENTIFIC AND INDUSTRIAL RESEARCH ORGANISATION,2015-07-07
JP7182602B2,JP,2022-12-02,軟質ポリウレタンフォーム用の反応性難燃剤,"The present invention provides dialkyl phosphorus-containing compounds, namely reactive mono-hydroxyl-functional dialkyl phosphinates, serving as highly efficient reactive flame retardants in flexible polyurethane foams. The invention further provides fire-retarded polyurethane compositions comprising said the reaction product of the mono-hydroxyl-functional dialkyl phosphinates with polyol and isocyanate foam forming components.","Andrew Piotrowski; Jillber man, joseph; Swell, Jeffrey; Germont,mark; Shin, Mayank; Chen, Jihao; Graz, Elan","ICL-IP America, Inc.; ICL-IP AMERICA INC.",2018-07-23
JP6752219B2,JP,2020-09-09,冷却フィンを備えたケーシングを有するガスタービンエンジン,"The gas turbine engine (3) comprises a compressor section (9) configured for compressing combustion air, a combustor section (15) and a turbine section (21). The turbine section (21) comprises a turbine rotor (41) with a bladed wheel (43) rotating around a turbine rotation axis (A-A), an exhaust gas diffuser (65), and a casing (52) having an inner surface and an outer surface. The casing (52) further comprises a plurality of cooling fins (75) located on the outer surface thereof.","Lombardy, Luka; Mavrie, Lajesh; Lady, Vishnu Barhan",Nuovo Pignone Tecnologie S.R.L.,2016-04-22
JP2014516859A,JP,2014-07-17,ヘリコプタ,"A composite structure forming a load bearing composite shell for a helicopter, with a shell which defines the exterior of a fuselage and includes a central fuselage section and tail boom, a fuselage which is adapted house an engine or drive train, a layered composite crashworthy seat and support structure and a fastening and a method of fastening by providing an adhesive between two layers which is allowed to flow through opposing holes in the layers to provide a chemical and mechanical attachment between the layers.","Maloney, Peter; Heatray, Nina",Composite Helicopter Holdings Limited,2012-06-07
JP2010538642A,JP,2010-12-16,生物油ならびにその生産および使用,"The present invention provides biological oils and methods and uses thereof. The biological oils are preferably produced by heterotrophic fermentation of one or more microorganisms using cellulose-containing feedstock as a main source of carbon. The present invention also provides methods of producing lipid-based biofuels and food, nutritional, and pharmaceutical products using the biological oils.",Rip Myr James Cayce; Pfeiffer Third Joseph W.; Hansen John Milton; Apto Kirk E.; Berkeley William Robert; Burrens Paul Warren; Martin david christian,Martech Biosciences Corporation,2008-09-08
JP2018516330A,JP,2018-06-21,冷却フィンを備えたケーシングを有するガスタービンエンジン,ガスタービンエンジン（３）が、燃焼空気を圧縮するように構成された圧縮機セクション（９）と、燃焼器セクション（１５）と、タービンセクション（２１）とを備える。タービンセクション（２１）は、タービン回転軸線（Ａ−Ａ）を中心に回転するブレード付きホイール（４３）を有するタービンロータ（４１）と、排気ガスディフューザ（６５）と、内面および外面を有するケーシング（５２）とを備える。ケーシング（５２）は、その外面に配置された複数の冷却フィン（７５）をさらに備える。【選択図】図３,"Lombardy, Luka; Mavrie, Lajesh; Lady, Vishnu Barhan",Nuovo Pignone Tecnologie S.R.L.,2016-04-22
JPH09503159A,JP,1997-03-31,【発明の名称】スプレイノズル及びその製造方法,"A method of forming an atomizing spray nozzle (42) includes the steps of etching a swirl chamber (56) and a spray orifice (44) in a thin sheet of material (46). The swirl chamber (56) is etched in a first side of the disk (46) and the spray orifice (44) is etched through a second side to the center of the swirl chamber (56). Feed slots (58-64) are etched in the first side of the disk (46) extending non-radially to the swirl chamber (56) such that liquid can be conveyed to the swirl chamber (56) so as to create and sustain the swirling motion. An inlet piece (40) with inlet passage (88-90) therein is connected with first side of the disk (46) so as to convey liquid to the feed slots (58-64) of the disk (46) and to enclose the feed slots (58-64) and swirl chamber (56). In addition to the method described an atomizing spray nozzle (42) having the configuration described is much improved in its spray characteristics. The present invention also provides a method of forming a number of spray nozzles simultaneously in a single manufacturing process, ","Simons, harold sea; Harvey, Lexus Jay",GENERAL ELECTRIC COMPANY,1994-09-28
JP3289913B2,JP,2002-06-10,【発明の名称】スプレイノズル及びその製造方法,"A method of forming an atomizing spray nozzle (42) includes the steps of etching a swirl chamber (56) and a spray orifice (44) in a thin sheet of material (46). The swirl chamber (56) is etched in a first side of the disk (46) and the spray orifice (44) is etched through a second side to the center of the swirl chamber (56). Feed slots (58-64) are etched in the first side of the disk (46) extending non-radially to the swirl chamber (56) such that liquid can be conveyed to the swirl chamber (56) so as to create and sustain the swirling motion. An inlet piece (40) with inlet passage (88-90) therein is connected with first side of the disk (46) so as to convey liquid to the feed slots (58-64) of the disk (46) and to enclose the feed slots (58-64) and swirl chamber (56). In addition to the method described an atomizing spray nozzle (42) having the configuration described is much improved in its spray characteristics. The present invention also provides a method of forming a number of spray nozzles simultaneously in a single manufacturing process, ","Simons, harold sea; Harvey, Lexus Jay",GENERAL ELECTRIC COMPANY,1994-09-28
JP2023530059A,JP,2023-07-13,プロセス及び装置,本発明は、１つ以上の有用な生成物を製造するためのプロセスに関し、廃棄物及び／又はバイオマスを含む炭素質供給原料をガス化ゾーンでガス化して、原料合成ガスを生成する工程；任意選択で、部分酸化ゾーンで前記原料合成ガスを部分酸化して、部分酸化された原料合成ガスを生成する工程；任意に部分酸化された、原料合成ガスの少なくとも一部を浄化ゾーンに供給して、汚染物質を除去し、清浄な合成ガスを提供する工程；任意選択で、水素対一酸化炭素比シフトゾーンで清浄な合成ガスの水素対一酸化炭素比をシフトして、シフトされた清浄な合成ガスを生成する工程；任意にシフトされた、清浄な合成ガスを第１の更なる反応トレインに供給して、少なくとも１つの第１の有用な生成物及びテールガスを生成する工程；任意選択で、前記第１の有用な生成物を第２の更なる反応トレインでアップグレードして、第２の有用な生成物及び軽質ガス留分を生成する工程；並びに外部要因に応じて、前記プロセス全体の炭素強度を制御し、ＧＨＧ排出量の削減を可能にするために、当該プロセス内で、要求に応じて選択的に、炭素質供給原料、清浄な合成ガス、テールガス、及び軽質ガス留分のうちの少なくとも１つの一部を、発熱又は発電に方向転換する工程、を含むプロセスに関する。【選択図】図１,"Grieger, Ivan Phillip; Harris, Roger Allen; King, Neal Alexander; Deshmukh, Sumitra Earl.; Chu, Juyan",Velocies Technologies Limited,2021-05-10
JP2014510228A,JP,2014-04-24,タービンエンジンの回転失速を解消する方法,"A method for eliminating rotational stall in a compressor of a turbine engine, includes automatically detecting surge in the turbine engine; automatically shutting-down the turbine engine; in the event surge is detected, automatically restoring a surge margin; and automatically re-igniting the turbine machine.","Jeratsushi, Sedorsk",SNECMA,2012-02-28
JP2012523979A,JP,2012-10-11,航空機のウィングボックスから発した気体及び/または液体が当該航空機の機体胴体部の中へ侵入することを防止する装置,"A device is disclosed for preventing gases and/or fluids emanating from a wing box of an aircraft from passing to an aircraft fuselage cell situated underneath it. The device comprises at least one sheet-like material positioned below or above the wing box. The sheet-like material is preferably made of a woven fabric comprising aramid fibers or the like, which fabric in order to ensure the required seal vis-à-vis liquid and/or gaseous substances, in particular vis-à-vis fuels, has been impregnated or soaked with an epichlorohydrin elastomer compound or with some other elastomer, for example a rubber compound or the like.","Bogiazis, Christos",Airbus Operations Gezelshaft Mitt Beschlenktel Haftung,2010-04-15
JP6831359B2,JP,2021-02-17,生物学的原材料から得られたパラフィンフラクションを含む組成物及びそれを製造する方法,"A composition, including 40-50 wt-% C14 paraffins, based on the total weight of the composition, and 35-45 wt-% C15 paraffins, based on the total weight of the composition, wherein the C14 and C15 paraffins are produced from a biological raw material.","Aalto, Pekka; Sand Bali, Katy; Neiman, Tomi; Hakora, maya","Neste Yurkinen, Salmon, Yukitua",2018-10-31
