Document Number,Document Type,Publication Date,Title,Abstract,Inventor Name,Assignee,Filing Date
JP2017500293A,JP,2017-01-05,オレフィンの二量化および／またはオリゴマー化のための非担持ヘテロポリ酸金属塩触媒,本発明は、混合ブテン原料からブテン二量体および／またはオリゴマーを生成するのに有用な非担持金属（例えばセシウム）置換ヘテロポリ酸触媒組成物に関し、該生成では、温和な条件下で、すべての混合ブテンの異性体が、オクタン価向上剤として有用な高度に分岐したC8およびC8+オレフィンを生成する。,"Sun; Shu, Way",Saudi Arabian Oil Company,2014-11-18
JP2024007302A,JP,2024-01-18,環境保全と経済性を両立させる低エントロピー・エンジン,【課題】コアの排気ノズルを可変機構とし、離陸定格で可変コアノズル（ＶＣＮ）を広げて、推力を落さずタービン入口温度（ＴＩＴ）を下げる。巡航時にファン回転数を下げずに燃料流量を減らして推力を制御し、燃料消費率（ＳＦＣ）を低減する。【解決手段】ファン回転数が最大の離陸定格を空力設計点（ＡＤＰ）とし、高圧タービン（ＨＰＴ）、低圧タービン（ＬＰＴ）、ＶＣＮのノズルをＡＤＰでチョークさせ、ＶＣＮを開いたとき高圧軸回転数を高めずに低圧軸回転数を高めることを可能とし、亜音速機用ターボファン・エンジンのための新たな「ＴＩＴと流量と推力」の関係を生み出して、上記課題を解決する。【効果】低エントロピー・サイクルによって熱効率を高め、ＳＦＣを低減してＣＯ２排出量を削減、低いＴＩＴによってＮＯＸの排出量を低減し、タービン寿命を伸ばして、経済性と環境適合性の両立を果たす。【選択図】図１,Isamu Nemoto,Isamu Nemoto,2022-07-05
JP2022508447A,JP,2022-01-19,再生可能な生成物を製造するためのプロセス,本発明は、遊離脂肪酸およびグリセリドを含む生物学的起源のフィードストックから再生可能なベースオイルおよび他の価値の高い再生可能な燃料成分を製造するための方法に関する。フィードストックは、最初に脂肪酸留分およびグリセリド留分を含む２つまたはそれ以上の流出流に分離される。グリセリドは、遊離脂肪酸およびグリセロールに加水分解され、そして、得られた脂肪酸は、分離工程へとリサイクルされる、脂肪酸はその後、ケトン化、水素化脱酸素化、および水素異性化によってベースオイルに変換される。グリセロールは、選択的な水素化分解によってプロパノールに変換される。,"Mulloya, Yucca; Kanervo, Yana; McConnen, Jana; Titta, Maruya",Neste Osake Yukitua Yurukinen,2019-12-20
JP7304350B2,JP,2023-07-06,共通入口プレナム及び共通出口プレナムを有する積重ね可能な燃料電池発電機構成,A power module system includes a plurality of vertically stacked power modules. The plurality of vertically stacked power modules include at least two vertical stacks. A shared exhaust plenum is located between the at least two vertical stacks of power modules.,"Ballantyne, Earn; Mahler, Jessica; Parker, Ross; Richards, Gilbert; Sharp, Barry; Dan, scene; Lara, Santi; Otool, John; Trevisan, David; Kotturi, Karl; Weingertner, David; Vines, Daniel",Bloom Energy Corporation,2018-12-14
JP2019507270A,JP,2019-03-14,エアタービンスタータ、およびその始動方法,エアタービンスタータ（ＡＴＳ）組立体は、燃焼エンジン（１０）に結合された回転式ピニオンギア（７２）と、回転式ピニオンギア（７２）の回転速度（３０２）を測定する速度センサ（７８）と、ピニオンギア（７２）が受けるトルクを示すトルク出力（３０４）を供給するトルクセンサ（７９）と、ＡＴＳアセンブリに対する始動シーケンスを動作させるように構成され、それによってトルク出力（３０４）を始動シーケンス閾値（３１０）未満に維持しつつ、回転速度（３０２）を制御可能に上昇させるように構成されたコントローラモジュールを備える。【選択図】図５,"Redesma redesma, sole; Blanco Avils, Reuben",GE Aviation Systems LLC,2016-01-20
JPH05500548A,JP,1993-02-04,【発明の名称】一体パワーユニツト制御装置及び方法,"The invention relates to secondary power system apparatus and method for use aboard aircraft in place of conventional auxiliary power units (APU's) and emergency power units (EPU's). The invention integrated power unit (IPU) performs the function of both on APU and an EPU, while avoiding the use of hazardous monofuels. The IPU includes a turbine engine operable on pressurized ambient air, or on pressurized stored air, along with jet engine fuel. The structure of a combustion chamber for the engine which is able to use pressurized air from two separate sources; of a control able to selectively operate the engine as an EPU, as an APU, and to effect operating transition from EPU to APU; and of a complete secondary power system with the IPU are all disclosed.","Klaas, Rainhard M.; Minshiyaru, Bad Jei.; Suriano, Francis Jei.; William, William",Allied Signal Incorporated,1990-09-20
JP2021501231A,JP,2021-01-14,バイオマスの加工方法,バイオマスを加工するための技術が本明細書において開示される。ASTM 6866-18によって決定される場合、100%の生物起源炭素含有量を有するセルロース系エタノールを調製する方法は、粉砕トウモロコシ穂軸を電子ビーム照射で処理する工程、および照射を受けた粉砕トウモロコシ穂軸を糖化して糖を生産する工程を包含する。該方法は、微生物を用いて糖を発酵させる工程も包含する。加えて、約25%の芳香族炭化水素、約2.5%のアルケン、約41%のアルカン、および約8.5%の酸素化化合物（wt./wt.）を含む、セルロース系バイオマス由来のジェット燃料が開示される。,Medoff marshall,Xyreco Incorporated,2018-10-26
JP3007873B2,JP,2000-02-07,【発明の名称】吸気バルブ堆積物を極小化するための添加物、及びそれらの使用,"New, highly effective detergent/dispersants for use in spark ignition fuels are described. They are Mannich condensation products formed from (i) one mole part of at least one substituted hydroxyaromatic compound having on the ring both (a) an aliphatic hydrocarbyl substituent derived from a polyolefin having a number average molecular weight in the range of about 500 to about 3000, and (b) a C1-4 alkyl; (ii) from 0.8 to 1.5 mole part(s) of aliphatic polyamine having one and only one primary or secondary amino group in the molecule capable of participating in the Mannich condensation reaction; and (iii) from 0.8 to 1.3 mole part(s) of aldehyde, provided that the mole ratio of aldehyde to amine is 1.2:1 or less. Carrier fluids such as poly(oxyalkylene) compounds further enhance the effectiveness of these Mannich condensation products in minimizing or reducing intake valve deposits and/or intake valve sticking.",Dennis Jay Malfuar; William Jay Corsi; Randall M Franklin,ETHYL CORPORATION,1998-04-09
JP2008520877A,JP,2008-06-19,風エアエンジン、即ち燃料エネルギーの代わりに風力気圧が利用されるエンジン,"A wind-air engine namely an engine using wind and air pressure as energy to replace fuel is provided; The wind-air engine relates to an engine installed in large, medium or small size cargo or passenger vehicles having steering wheels, railway trains, subway trains moving on land, marine travel vehicle, aero space travel vehicle and all other motor vehicles that move at a speed; The wind-air engine includes a main body of the wind-air engine, a controller for HPCA automatic intermittent burst jet acceleration of the wind-air engine, and a deceleration and brake pressurizing device of a motor vehicle equipped with the wind-air engine; The wind-air engine is not restricted by natural weather, ambient or wind conditions, and uses HPCA stored therein to be started and accelerated to generate power output, the power drives the motor vehicle equipped with the wind-air engine moves at a speed and the wind force and wind resistance airflow encountered are transformed into mechanical kinetic energy; Then the mechanical kinetic energy and inertia when the motor vehicle equipped with the wind-air engine moves at a speed are output, so as to regenerate HPCA and convert it into mechanical power; The advantage lies in the feature of recycling the wind force and wind resistance kinetic power encountered when the engine runs at a speed and the regeneration HPCA, and converting them into mechanical kinetic power;","CONG,Yang","CONG,Yang",2005-11-14
JP5154568B2,JP,2013-02-27,フラッシュバックバリアを備えた火花一体型推進薬噴射器ヘッド,"High performance propellants flow through specialized mechanical hardware that allows for effective and safe thermal decomposition and/or combustion of the propellants. By integrating a sintered metal component between a propellant feed source and the combustion chamber, an effective and reliable fuel injector head may be implemented. Additionally the fuel injector head design integrates a spark ignition mechanism that withstands extremely hot running conditions without noticeable spark mechanism degradation.","Mangus, Gregory S.; Fisher, David Jay.; Mangus, Christopher","Fire Star Engineering, LLC",2007-12-04
JP2010511830A,JP,2010-04-15,フラッシュバックバリアを備えた火花一体型推進薬噴射器ヘッド,"High performance propellants flow through specialized mechanical hardware that allows for effective and safe thermal decomposition and/or combustion of the propellants. By integrating a sintered metal component between a propellant feed source and the combustion chamber, an effective and reliable fuel injector head may be implemented. Additionally the fuel injector head design integrates a spark ignition mechanism that withstands extremely hot running conditions without noticeable spark mechanism degradation.","Mangus, Gregory S.; Fisher, David Jay.; Mangus, Christopher","Fire Star Engineering, LLC",2007-12-04
JP5922591B2,JP,2016-05-24,パッケージ化推進薬空気誘導可変推力ロケット・エンジン,"This invention is a packaged propellant air-induced variable thrust rocket engine that has a vast number of uses and applications for this invention. The primary purpose of the device described here is to provide a light weight, torque and vibration free thrust generator for the propulsion of aircraft. This device will facilitate the fabrication of very light weight aircraft because of the lack these forces. This device can also be used anywhere high velocity air flow and or the resulting thrust is needed. The invention uses aerodynamic principles to compress and accelerate the incoming air, prior to it being heated and accelerated by a short duration burst of thermal and kinetic energy from discrete packets of a mixture of oxidizable fuels. The heated and accelerated air then expands as it travels thru the device providing thrust.","Manson, David, Murray, Junior; Collier, Nicholas","Innovative Defense, LRC",2011-02-23
JP2001503675A,JP,2001-03-21,【発明の名称】工業的プロセスによって生じる排出ガスからNOxを低減する方法,"Gas-phase methods and systems for reducing NOx emissions and other contaminants in exhaust gases, and industrial processes using the same, are disclosed. In accordance with the present invention, hydrocarbon(s) autoignite and autothermally heat an exhaust gas from an industrial process so that NH 3 , HNCO or a combination thereof are effective for selectively reducing NOx autocatalytically. Preferably, the reduction of NOx is initiated/driven by the autoignition of hydrocarbon(s) in the exhaust gas. Within the temperature range of about 482-871°C, the introduced hydrocarbon(s) autoignite spontaneously under fuel-lean conditions of about 2-18 % O 2  in the exhaust gas. Once ignited, the reactions proceed autocatalytically, heating the exhaust gas autothermally. Under some conditions, a blue chemiluminescence may be visible.","Sadas, Bruce Sea; Sloan, Ralph Jay; Palaiscar, Vishwesh; Ramavajara, Madue",Knoxtec Incorporated,1997-10-31
JP4673926B2,JP,2011-04-20,中央本体パイロットポッド,"A pilot for a scramjet provides a flame front whose arrival at the wall of the scramjet combustor is delayed thereby reducing combustor heat load. By combining in-stream injection of fuel with an interior pilot and a lean (fuel-poor) outer annulus, the bulk of combustion is confined to the scramjet combustor center. This concept, referred to as “core-burning,” further reduces combustor heat load. One such pilot is for a two dimensional scramjet effective to propel a vehicle. This pilot includes a plurality of spaced apart struts separated by ducts and a strut pilot contained within each strut. A second such pilot is for an axisymmetric scramjet engine has, in sequence and in fluid communication, an air intake, an open bore scramjet isolator and a scramjet combustor. This centerbody pilot pod includes a pilot isolator disposed between the air intake and a pilot diffuser, the pilot diffuser disposed between the pilot isolator and a pilot with the pilot disposed between the pilot diffuser and a pilot combustor. The pilot pod is in axis symmetry around a central axis of the scramjet isolator and supported by a plurality of struts extending from an inner wall of the open bore to an outer surface of the centerbody pilot pod.","Bullman, Melvin Jay.",Aerojet General Corporation,2007-10-15
JP5604075B2,JP,2014-10-08,液体燃料式パルスデトネーションエンジンの低温始動のためのプレナム空気予熱,,ナレンドラ ディガンバー Joshi; ヴェン cut S ワール tongue ギララ; Kevin Michael Hinckley,General Electric Co.,2009-10-09
JP2016511525A,JP,2016-04-14,集積化された動力発生におけるＮＯｘの軽減,溶融炭酸塩形燃料電池（ＭＣＦＣ）を使用して、燃焼供給源からのＣＯ２を捕捉するためのシステムおよび方法が提供される。燃料電池は、低下されたアノード燃料利用を有するように作動される。任意に、アノード排出物の少なくとも一部分は、燃焼供給源の燃料として使用するためにリサイクルされる。任意に、アノード排出物の第２の部分は、アノードインプット流の一部分として使用するためにリサイクルされる。これによって、燃焼供給源排出物からＣＯ２を分離するために必要とされる燃料電池の面積の量の減少、および／または燃料電池を作動させる方法の変更が可能となる。,Paul Jay Barlowitz; Timothy Andrew Burkholtz; Frank Harshkowitz; Alessandro Faldi; Allen S. Ericsson,EXXON RESEARCH AND ENGINEERING COMPANY,2014-03-13
JP2012512916A,JP,2012-06-07,触媒接触脱酸素及び縮合酸素化炭化水素を主成分とする液体燃料組成物,"A moderate fraction of a carbohydrate derived component, and a kerosene composition comprising the moderate fraction.",Joanna Margaret Bardley; Paul George Brommel; Randy Douglas Courtlight; Richard John Price,SHELL INTERNATIONALE RESEARCH MAATSCHAPPIJ BESLOTEN VENNOOTSHAP,2009-09-04
JP6700289B2,JP,2020-05-27,ガソリンエンジンの燃料送出システム、空気取り入れシステムおよび燃焼室を清浄化させるための組成物,"A cleaning composition, which is suitable for cleaning fuel delivery systems, air-intake systems, intake valves, and combustion chambers, includes at least 3 wt. % of a polyether component, at least 5 wt. % of a polar solvent, and at least 5 wt. % a non-polar solvent. The polyether component is selected from polyethers, polyetheramines, and mixtures thereof.","Bartley, Stuart El.; Weinberg, Thomas Earl.; Nichols, Michael Dee.; Hoodie, garrett",THE LUBRIZOL CORPORATION,2016-01-15
JP2018508619A,JP,2018-03-29,ガソリンエンジンの燃料送出システム、空気取り入れシステムおよび燃焼室を清浄化させるための組成物,燃料送出システム、空気取り入れシステム、取り入れ弁および燃焼室を清浄化させるのに適している清浄化組成物は、少なくとも３ｗｔ％のポリエーテル成分、少なくとも５ｗｔ％の極性溶媒および少なくとも５ｗｔ％の非極性溶媒を含む。ポリエーテル成分は、ポリエーテル、ポリエーテルアミンおよびそれらの混合物から選択される。例示的実施形態は、清浄化組成物、および組成物で清浄化する方法に関する。組成物および方法は、特に、内燃エンジンの燃料送出システム、空気取り入れシステムおよび燃焼室における炭素質堆積物を除去するのに効果的である。,"Bartley, Stuart El.; Weinberg, Thomas Earl.; Nichols, Michael Dee.; Hoodie, garrett",THE LUBRIZOL CORPORATION,2016-01-15
JP2022550052A,JP,2022-11-30,微生物でグラフェンオキシドを還元することによって窒素および硫黄でグラフェンをドープする方法、それにより得られた窒素および硫黄でドープされたグラフェンならびにその使用,本発明は、微生物によるグラフェンオキシドの還元を通じて、窒素原子および硫黄原子でデュアルドープされたグラフェンを製造する方法に関する。加えて、本発明は、この方法によって得られる窒素原子および硫黄原子でデュアルドープされたグラフェンに関し、かつそのようにドープされたグラフェンの、例えば電子部品または水精製機器を製造するための、使用に関する。特に、方法はエコサステナブルであり、かつ経済的であり、公知の製品と比べて著しく改善された性能を有する製品を提供するという、さらなる利点を有する。,Yakimov Valentino,Bioenergy Technologies Society A Responsibility Limited,2020-09-23
JP6746660B2,JP,2020-08-26,徐放性二重壁マイクロカプセル,A method of forming dual melamine/acrylic walled microcapsules having improved physical properties and release control as well as the microcapsules formed by the process wherein the capsule wall is formed by the use of select (meth)acrylate monomers and/or oligomers and/or select self-condensing melamine resins.,"Fen, Lin Shen; Robert, Stanley, Bobnock",THE PROCTER & GAMBLE COMPANY,2018-11-13
JP2022548420A,JP,2022-11-18,燃焼器の運転効率と排出性能を最大化できる燃焼装置,燃焼器の運転効率と排出性能を最大化できる燃焼装置に係り、ガス燃料が供給されるガスノズル部と、前記ガスノズル部と連通して空間を形成し、ガス燃料を分配するガス燃料分配部と、前記ガス燃料分配部と第１貫通孔により連通し、ガス燃料が空気と予混合される空間を形成する第１混合室と、前記ガス燃料分配部と第２貫通孔により連通し、ガス燃料が空気と予混合される空間を形成する第２混合室と、前記第１混合室と第２混合室との間に備えられ、前記第１混合室で予混合されたガス燃料と空気の予混合気を乱流化する乱流生成ノズル部と、空気ノズル部と連通し、前記第１混合室と第２混合室にそれぞれ燃焼用空気を供給する旋回ノズル部と、を含み、前記旋回ノズル部は、前記第１混合室と連通し、前記第１貫通孔から噴射されたガス燃料が旋回された空気と垂直で接触して混合されるようにする第１流路と、前記第２混合室と連通し、前記第２貫通孔から噴射されたガス燃料が前記第１流路に比べて旋回度が低い空気と垂直で接触して混合されるようにする第２流路と、を含み、前記乱流生成ノズル部は、複数個のフラクタル状の格子孔が備えられ、前記第１混合室で予混合されたガス燃料と空気の予混合気の乱流流れを誘導するブロック状の乱流生成部と、前記乱流生成部を通過したガス燃料と空気の予混合気を燃焼室に流動させる円筒状の内側ノズル部と、を含み、前記乱流生成部は、前記内側ノズル部の長手方向に沿って長く形成され、さか火現象により火炎が付着しても、剛性を維持して、持続的な燃焼を行うことにより、燃焼効率を増加させることを特徴とする。【選択図】 図１,"i, gi man; Kang, Young Se; Ann, Ji Hwang",INDUSTRY-ACADEMIC  COOPERATION  FOUNDATION  OF  SUNCHON  NATIONAL  UNIVERSITY,2020-10-28
JP2017501131A,JP,2017-01-12,イオン交換樹脂触媒による混合ブテンの二量化／オリゴマー化のためのプロセス,イオン交換樹脂系の触媒を使用した混合ブテン供給材料の効果的な二量化およびオリゴマー化のためのプロセスが提供される。二量化およびオリゴマー化プロセスは、より高いエネルギー含量、より高いオクタン価、より高いオクタン感度およびより低いRVPのための優れた燃料混合成分として使用できる高度に分岐したC8およびC8+オレフィン（例えば、C12、C16およびC20オレフィン）を生成する。,"Sun; Shu, Way",Saudi Arabian Oil Company,2014-11-21
JP7270111B2,JP,2023-05-09,燃焼器の運転効率と排出性能を最大化できる燃焼装置,"The present invention relates to a combustion device capable of maximizing a combustor's operation efficiency and exhaust performance and, more specifically, to a combustion device comprising: a gas nozzle unit that allows gas fuel to be supplied; a gas fuel distribution unit that is in communication with the gas nozzle unit to form a space and distributes gas fuel; a first mixing chamber that is in communication with the gas fuel distribution unit through a first through-hole to form a space in which gas fuel is premixed with air; a second mixing chamber that is in communication with the gas fuel distribution unit through a second through-hole to form a space in which gas fuel is premixed with air; a turbulence producing nozzle unit provided between the first mixing chamber and the second mixing chamber to produce a turbulent flow of a pre-mixture of gas fuel and air that are premixed in the first mixing chamber; and a swirl nozzle unit that is in communication with an air nozzle unit to allow air for combustion to be supplied into each of the first mixing chamber and the second mixing chamber. The swirl nozzle unit comprises: a first flow path that is in communication with the first mixing chamber to allow gas fuel ejected through the first through-hole to come into perpendicular contact and be mixed with swirling air; and a second flow path that is in communication with the second mixing chamber to allow gas fuel ejected through the second through-hole to come into perpendicular contact and be mixed with air having a lower swirl number than that in the first flow path. The turbulence producing nozzle unit comprises: a block-type turbulence producing unit including a plurality of grid holes having a fractal shape to induce a turbulent flow of the pre-mixture of gas fuel and air that are premixed in the first mixing chamber, and a cylindrical internal nozzle unit that allows the pre-mixture of gas fuel and air passing through the turbulence producing unit to flow into a combustion chamber, wherein the turbulence producing unit has an elongated form along the length direction of the internal nozzle unit and maintains rigidity, even when flames adhere thereto due to flash back, to enable continuous combustion, thus increasing combustion efficiency.","i, gi man; Kang, Young Se; Ann, Ji Hwang",INDUSTRY-ACADEMIC  COOPERATION  FOUNDATION  OF  SUNCHON  NATIONAL  UNIVERSITY,2020-10-28
