Document Number,Document Type,Publication Date,Title,Abstract,Inventor Name,Assignee,Filing Date
JP2013510997A,JP,2013-03-28,発電のための方法及び太陽電池式の風力発電装置,"The invention relates to the field of producing electric power by artificially creating an air stream incident on a power-generating module (turbine) using solar-powered batteries. The power-generating module turns, compresses the air stream and directs the latter onto the working surface of a blade-less rotor. The rotor is designed such that a reactive effect is created on the working surfaces thereof, which improves the turbine characteristics. In the proposed method for producing power, use is made of the kinetic and potential energy of the air stream, and also the moment of inertia of the installation and solar-powered batteries. The efficiency of the method reaches 50%, while traditional fuel is economized on and emissions of CO 2  into the atmosphere are reduced.","Urs, AEON Jorgevich; Potapov, Yury Semenovich",Alternative Energy Research Company Limited,2010-08-26
JP5857095B2,JP,2016-02-10,モリブデンベースの触媒を用いることにより再生可能な起源の流出物を優れた品質の燃料に転化する方法,"Supported or bulk catalyst (I) with an active phase comprising a Group VIB sulfide, in which the Group VIB element is molybdenum and the catalyst is in the sulfide form. An independent claim is also included for a method for the hydro-deoxygenation of charges obtained from renewable sources with decarboxylation/decarbonylation limited to not more than 10%, using the above catalyst (I) at 120-450[deg] C and 1-10 MPa with an hourly space velocity of 0.1-10 h -> 1>, in presence of a total amount of hydrogen (mixed in the charge) equal to 50-3000 Nm 3> hydrogen/m 3> of charge.",Antoine Dodane; Roland Brunet; Thierry Chapus,IFP ENERGIES NOUVELLES,2014-07-10
JP2021535028A,JP,2021-12-16,発射システム,少なくとも１つの実施例によれば、キャリア飛行体および少なくとも１つのペイロード飛行体を含む、発射システムが提供される。ペイロード飛行体は、ペイロード飛行体に所望の高度における設計亜音速巡航速度での空力動力飛行を提供するように設計されているペイロード推進システムおよび空力揚力面を含む。キャリア飛行体は、少なくとも１つのペイロード飛行体を少なくとも所望の高度まで搬送するように構成され、発射システムを所望の高度に推進するための固体ロケット推進システムをさらに含む。キャリア飛行体は所望の高度で所定の前進速度を提供するように構成され、所定の全身速度は設計亜音速巡航速度に相関している。キャリア飛行体は、所望の高度および所定の前進速度で、キャリア飛行体に対してペイロード飛行体を解放するように構成されている。設計亜音速巡航速度は、０．７マッハ数未満であり、所望の高度は、３ｋｍよりも大きい。【選択図】図１,"Peleg, Eyal; Valency, Tomel; Barboy, Iran",Israel Aerospace Industries Limited,2019-08-14
JP5116966B2,JP,2013-01-09,ガソリン,"PROBLEM TO BE SOLVED: To provide gasoline which contains a biomass-derived base from the viewpoint of regenerability and global warming prevention and is excellent in the easiness of exhaust gas cleaning, fuel consumption, and engine operation performance.  SOLUTION: Provided is gasoline which has a research octane number of 89.0 to below 96.0 and a sulfur content of 10 mass ppm or lower and is characterized by containing a base at least partially consisting of a fraction obtained by treating a feedstock oil mixed with biomass or with biomass and a mineral oil by fluidized catalytic cracking and having a distillation temperature range of from 25 to 220°C.  COPYRIGHT: (C)2007,JPO&INPIT",Takashi Kaneko; Masanori Hirose,"jx Nikko Nisseki Energy Co., Ltd.",2005-11-30
JP2021506539A,JP,2021-02-22,広域火災を抑制するための耐火性空中機,【解決手段】 軽量で耐衝撃性のあるセラミックマトリックス複合体を備えた、断熱性および耐炎性を備え、断熱材を取り付けられた、同心の二重船体、耐損傷性の機体車両二重クラッドであって、内部胴体領域の35℃から1350℃までの熱的保護を、極端な熱環境内で長期間にわたって行うことができ、半または完全に自律的な車両、有人または無人とすることができ、好ましくは、発射環境を出ることなく、火炎に対して圧力波を繰り返し放出することにより火炎を抑制又は消火するように設計された無人空中機が提供される。【選択図】 図１,"Thomas, Michael S.","Adaptive Global Solutions, LLC",2018-12-14
JPH10500983A,JP,1998-01-27,【発明の名称】化合物、組成物および用途,"PCT No. PCT/GB95/01206 Sec. 371 Date Dec. 9, 1996 Sec. 102(e) Date Dec. 9, 1996 PCT Filed May 26, 1995 PCT Pub. No. WO95/33754 PCT Pub. Date Dec. 14, 1995A method for the protection of a medium by susceptible to microbial attack by the treatment of the medium with an oxaborale or a salt of an oxaborale.","Austin, Peter William; Neil, Christopher Juan; Crawley, Patrick Jeruf; Clough, John Martin",Zeneca Limited,1995-05-26
JP2022508711A,JP,2022-01-19,ナノグラファイトスポンジおよびその製造方法,本開示は、ナノグラファイトスポンジ（ＮＧＳ）およびナノグラファイトスポンジを調製するための方法を提供する。開示されたナノグラファイトスポンジは、大きな表面積および細孔容積、低質量密度、良好な導電率および機械的特性を含む、多くの優れた特性を有する。これらの優れた特性により、ナノグラファイトスポンジは、バッテリーおよびスーパーキャパシターの電極、燃料電池や太陽電池、触媒や触媒担体、センサーなど、多くの用途に望ましい材料となっている。,"Nosker, Thomas, Jay.; Kia, Bernard, H.; He, Nofel, Tuhia; Lynch-Branzoy, Jennifer, Kay.; Tebetia, Aya, Shin","Rutgers, The State University of New Jersey",2019-10-15
JP2020531349A,JP,2020-11-05,鉄道資産を検査するための無人航空機システム,空中システム制御ネットワーク（２５００）、無人航空機（ＵＡＶ）システム（２４００）及び方法（２６００）は、ＵＡＶ（２４２０）を使用して鉄道資産を検査することを提供する。空中システム制御ネットワークは、複数の塔（２５１０、２５１５）と、複数の通信塔に接続された地上制御システム（２５２０）とを含む。地上制御システムは、複数の通信塔を介して、鉄道路線（１００）及び飛行経路（１０１０）を含む飛行計画を送信し、複数の通信塔を介して、ＵＡＶが鉄道路線をモニタしている間にデータを受信し、受信されたデータに基づいて飛行経路に沿って障害（１５００、１５０１、１５０２）を検出し、且つ障害に基づいて飛行計画を調整する。,"Greets, Todd; Grisam, Gerry; Mishke, Michael",BNSF RAILWAY COMPANY,2018-08-15
JP7205030B2,JP,2023-01-17,酸素含有の再生可能な油をアップグレーディングするプロセス,"The invention relates to producing upgraded renewable oil. Renewable crude oil is provided whose oxygen content, water content, and total acid number are within predetermined ranges. Respective fractions of the oil have boiling points below 350° C. and above 450° C. After the oil is pressurized, and hydrogen is added, the mixture is heated and contacted with a heterogeneous catalyst in a first reaction zone with weight based hourly space velocity (WHSV) of 0.1 to 1 h-1. The resultant partially hydrogenated and deoxygenated oil is further heated and contacted with a heterogeneous catalyst in a second reaction zone at WHSV of 0.1 to 1.5 h-1. Low and high boiling point liquid hydrocarbon fractions of the product of the second reaction zone are sent to third and fourth reaction zones, respectively, to be contacted with hydrogen and a heterogeneous catalyst under respective heating conditions and WHSV of 0.1 to 1 h-1.","Iversen, Steen Bee.; Jensen, Klaus Uhlenholt; Rodriguez Guerrero, Julie Catherine",Stepper Energy ASP,2019-01-10
JP2010511922A,JP,2010-04-15,対象物を輸送する方法、輸送システム、及び輸送手段,"The invention relates to a method for transporting physical objects, wherein at least one physical object is transported from a sending station to a receiving station, wherein the transport occurs through at least one physical router, wherein the physical router executes a decision about further parameters of transport to another physical router or to the receiving station.  The method is carried out in that a central control computer receives information for handling and moving the physical objects and that the central control computer influences supplies for transport means and/or the transport means according to environmental data.","Martin, Wegner; Ulrich, Caith; Michael, Lomeier",Deutsche Post Age,2007-08-06
JP2014530321A,JP,2014-11-17,風力エネルギータービンシェルステーション,ＷＥＴＳＳ（風力エネルギータービンシェルステーション）は、超高層シェル状フレーム構造であり、高い高度で風の運動エネルギーを収集する複数の小型の風力タービンを支持し、電力さらには水素を生成し、燃料電池の需要に合致する電力を生成するために水素を保管する。ＷＥＴＳＳの典型的な幅に対する高さの比は４−１０、厚さ８−２５ｍ（地震地域によって異なる）である。風速６ｍ／秒（２１.６ｋｍ／ｈ）と仮定すると、典型的な高さが１０００−２０００ｍ、直径２００−５００ｍ、非定常電力の実容量が１８７ＭＷ−３．７５ＧＷ、電力需要に合致した５０ＭＷ−１ＧＷ。典型的なＷＥＴＳＳでは、現在の実用的な風力タービンで必要である平均的な土地の約１／５００が必要である。ＷＥＴＳＳは、典型的には標準及び高降伏鋼から成る。ＷＥＴＳＳは、シェル形状を有しており階数が少なく荷重が小さいため、同様の大きさである従来の鋼の建造物の約２％の重さであり、耐震及び耐風力設計が比較的簡易である。ＷＥＴＳＳは、風力エネルギーを地球上で最も安価なエネルギーにして、静かで鳥に安全で需要に合致したものにする。【選択図】 図２,ヘイサム，  ヤクブ; リマ，  ゴーセン,ヘイサム，  ヤクブＨＡＩＳＡＭ，Ｙａｋｏｕｂ,2012-10-09
JP2009535449A,JP,2009-10-01,バイオ燃料組成物およびバイオ燃料の製造方法,"An emulsified biofuel composition comprising: (A) a continuous phase comprising about 50-95 wt % of at least one liquid oil of vegetable or animal origin or mixtures thereof; (B) a water-containing dispersed phase comprising about 1-50 wt % water; (C) about 1-25 wt % of hydroxyl-containing organic compound selected from the group consisting of mono-, di-, tri- and polyhydric alcohols, provided that when a monohydric alcohol is used there is also present at least one of tert-butyl alcohol, at least one C2-C4 alkylene glycol or a mixture of both; (D) about 0.05-10 wt % of at least one emulsifier; wherein the dispersed water-containing droplets have an average particle size of less than about 20 microns. The biofuel is prepared from these components by mixing under high shear conditions, preferably with ultrasonic energy. The emulsifier(s) preferably exhibit a hydrophilic-lipophilic balance of about 8.5 to about 18 and the biofuel includes a cetane enhancer and mixture of an alcohol and mono- or poly-alkylene glycol.","Petrucci, Ferdinand; Festuccia, Andrea","New Generation Biofuels, Incorporated; PJ Bio Energy Holding Limited",2007-04-10
JP2022502316A,JP,2022-01-11,航空機原動機システム、運用および使用,本発明は、極低温推進源と燃焼推進源とを備え、極低温推進源および燃焼推進源は、航空機の推進力を発生させるために選択的および独立的に作動可能であるマルチソース航空機推進装置に関する。【選択図】図５,"Taylor, Simon",GK N Aerospace Services Limited,2019-10-15
JP4705732B2,JP,2011-06-22,航空機用ガスタービン・エンジンのサージ検出装置,,Yukinobu Sugitani,Honda motor industry stock company,2001-05-23
JP2018526270A,JP,2018-09-13,空中、水中、及び地形環境において安全な操作のために改良された安定性を備える汎用乗り物,汎用乗り物システムは、前方中央モジュール、後方モジュール、及び前方中央モジュールに変位可能に接続され且つそれぞれの推進機構に作動可能に結合されているスラストベクトル化モジュールを含んでいる、揚力体の空気力学的に実行可能な輪郭を形成するように構成された複数の相互接続されたモジュールからなる揚力体を備えて設計されている。スラストベクトル化モジュールは、空中、水中及び地形環境における様々な作動モード及びそれらの間での移行での安全かつ安定した作動のために、必要に応じて推進機構を導きかつ作動させるべく、揚力体に対する動的な変位（チルト及び/又は並進の方式）のために制御される。,Evandro Gurugelde Amaral Valente; Norman M. Wally; Eduardo Guergerdo Amaral Valente,"University of Maryland, College Park",2016-08-30
JP2015523061A,JP,2015-08-13,バイオマス材料を処理する方法およびシステム,本発明の態様は、バイオマス材料からの揮発性有機化合物及び高級炭化水素の生産及び回収を提供する。一態様は、バイオマス材料の固形成分を消化用溶媒と接触させて、消化済みバイオマスストリームを形成することを含み、消化済みバイオマスの少なくとも一部をさらに熱触媒処理して、高級炭化水素を生成する。固形成分は、無溶媒回収システムの区画に１種又はそれより多くの揮発性有機化合物を含有するバイオマス材料を導入すること；区画中でバイオマス材料を過熱蒸気ストリームと接触させ、バイオマス材料中の最初の液状内容物の少なくとも一部を蒸発させること；加熱したバイオマス材料から蒸気成分及び固形成分を分離すること；ガス成分の少なくとも一部を、過熱蒸気ストリームの一部として使用するために保持することを含む方法によって生成する。【選択図】 図１,"Hamilton, Philip Guy; Radoki, Corey William; Crytman, Keith Michael",SHELL INTERNATIONALE RESEARCH MAATSCHAPPIJ BESLOTEN VENNOOTSHAP,2013-05-16
JPH07505708A,JP,1995-06-22,【発明の名称】航空機の重量および重心表示器,"An onboard system for use in measuring, computing and displaying the gross weight and location/relocation of the center of gravity, for aircraft. Temperature and pressure transducers are mounted in relation to each of the landing gear struts. Transmit those temperature and pressure signals to an onboard microcomputer/controller with redundancy for accuracy and failure protection. The system also incorporates a software correction program, along with attached hardware, to correct and compensate for physical changes to strut components due to temperature fluctuations, seal drag and hysteresis within modern day ""shock absorbing"" aircraft landing gear struts. The computer makes adjustments for internal temperature changes and drag; converts sustained pressures to the weight supported by each strut, and computes the aircrafts current gross weight and center of gravity. The computer is also programmed to illuminate a ""Hard Landing Indicator Light"" mounted on the display, when pre-programmed individual strut pressure limits are exceeded and sensed during landing. These pressure readings are stored in the computer memory and can be utilized when the aircraft is inspected and serviced.",AB Industry Osaka salmon yukichu,AB Industry Osaka salmon yukichu,1993-02-03
JP2019512058A,JP,2019-05-09,冷却、加熱、パワー、圧力、ワーク及び水を組み合わせるための同極ＤＣ発電機付きテーパー形スパイラルガスタービン,ガス膨張機によってワーク抽出又は空気冷却を行うためのテーパー形指数スパイラル。このようなテーパー形指数スパイラルは、ガス圧縮機に用いられて空気の圧力と温度を増加してもよい。前記圧縮機−膨張機が単一で簡単な構造を形成し、製造に便利である。空気の断熱膨張についてのテーパー形指数スパイラルの温度降下の簡単な式を得た。空気の等温圧縮についての、空気が外から内へ圧縮されると圧力が増加することを得た。エネルギー変換にとって、スパイラルが有効であると証明した。ファラデー単極直流発電機の幾何形状と技術を変更することによってそれを改良した。電力変換効率と高圧電力生産の面で多くの作業が成される。同じ発電機構造は単極直流モータとして利用できる。電圧を制御することによって、モータ又は発電機の速度は制御される。電流を制御することによって、利用又は生成されるトルク力も制御される。単極発電機とモータは、容易にスパイラル圧縮機及び膨張機と一体に集積できる。これらの基本的な発明を利用する３つの用途が提出された。まずはフォーカスされる太陽エネルギー又はガス燃料の燃焼により動力を供給する熱力タービンである。次は電力により動力を供給して水の冷却、クーリングと加熱に用いられるヒートポンプである。第３は太陽エネルギーの動力によって水を脱塩する方法であり、太陽を追跡するテーパー形反射表面によって、太陽光を塩水柱に集め、太陽エネルギー光起電力による動力を利用してスパイラル圧縮機に動力を提供して低圧蒸気を冷却する。Ｆｉｒｅｆｌｙ技術によって小規模、現地的で且つ簡単な多種のエネルギー生産を提供し、必要な場合、太陽エネルギーの動力を人にフィードバックする。【選択図】なし,"Joseph Wai, Huy",MONARCH POWER TECHNOLOGY(HK)LTD.,2016-11-11
JP2013520615A,JP,2013-06-06,パッケージ化推進薬空気誘導可変推力ロケット・エンジン,"This invention is a packaged propellant air-induced variable thrust rocket engine that has a vast number of uses and applications for this invention. The primary purpose of the device described here is to provide a light weight, torque and vibration free thrust generator for the propulsion of aircraft. This device will facilitate the fabrication of very light weight aircraft because of the lack these forces. This device can also be used anywhere high velocity air flow and or the resulting thrust is needed. The invention uses aerodynamic principles to compress and accelerate the incoming air, prior to it being heated and accelerated by a short duration burst of thermal and kinetic energy from discrete packets of a mixture of oxidizable fuels. The heated and accelerated air then expands as it travels thru the device providing thrust.","Manson, David, Murray, Junior; Collier, Nicholas","Innovative Defense, LRC",2011-02-23
JP2021507451A,JP,2021-02-22,共通入口プレナム及び共通出口プレナムを有する積重ね可能な燃料電池発電機構成,電力モジュール・システムは、複数の垂直に積み重ねられた電力モジュールを備える。この複数の垂直に積み重ねられた電力モジュールは、少なくとも２つの垂直スタックを備える。共有排出プレナムは、電力モジュールの少なくとも２つの垂直スタックの間に配置される。,"Ballantyne, Earn; Mahler, Jessica; Parker, Ross; Richards, Gilbert; Sharp, Barry; Dan, scene; Lara, Santi; Otool, John; Trevisan, David; Kotturi, Karl; Weingertner, David; Vines, Daniel",Bloom Energy Corporation,2018-12-14
JP2021518474A,JP,2021-08-02,シリコーンポリマー,式（１）Ｍ１ａＭ２ｂＭ３ｃＤ１ｄＤ２ｅＤ３ｆＴ１ｇＴ２ｈＴ３ｉＱｊここでＭ１＝Ｒ１Ｒ２Ｒ３ＳｉＯ１／２Ｍ２＝Ｒ４Ｒ５Ｒ６ＳｉＯ１／２Ｍ３＝Ｒ７Ｒ８Ｒ９ＳｉＯ１／２Ｄ１＝Ｒ１０Ｒ１１ＳｉＯ２／２Ｄ２＝Ｒ１２Ｒ１３ＳｉＯ２／２Ｄ３＝Ｒ１４Ｒ１５ＳｉＯ２／２Ｔ１＝Ｒ１６ＳｉＯ３／２Ｔ２＝Ｒ１７ＳｉＯ３／２Ｔ３＝Ｒ１８ＳｉＯ３／２Ｑ＝ＳｉＯ４／２ここでＲ１、Ｒ２、Ｒ３、Ｒ５、Ｒ６、Ｒ８、Ｒ９、Ｒ１０、Ｒ１１、Ｒ１３、Ｒ１５、Ｒ１６は、水素、Ｃ１−Ｃ６０脂肪族または芳香族基、またはＣ１−Ｃ６０アルコキシ基から独立して選択され、Ｒ４、Ｒ１２、Ｒ１７は、Ｃ１−Ｃ６０アルキル、Ｃ１−Ｃ６０アルコキシ、またはＲ１９−Ａ−Ｒ２０−から独立して選択され、ここでＡは、芳香族基、縮合芳香族基、不飽和脂環式基、不飽和複素環式基、またはそれらの２つ以上の組み合わせから選択される不飽和環状部分を含む基から選択され、Ｒ１９は、−Ｈ、Ｃ１−Ｃ６０アルキル、アリル、ビニル、アルコキシ、アリルオキシ、ビニルオキシ、アクリレート、またはメタクリレートから選択され、そしてＲ２０は二価の有機基から選択され、Ｒ７、Ｒ１４、Ｒ１８は、水素またはＯＲ２２、または不飽和一価ラジカル、または酸素、窒素、硫黄などのヘテロ原子を含むラジカル、またはオルガノシラン基を含むラジカルから独立して選択され、そして下付き文字ａ、ｂ、ｃ、ｄ、ｅ、ｆ、ｇ、ｈ、ｉ、ｊはゼロまたは正であって、以下の条件：２≦ａ＋ｂ＋ｃ＋ｄ＋ｅ＋ｆ＋ｇ＋ｈ＋ｉ＋ｊ≦１０００、ｂ＋ｅ＋ｈ＞０およびｃ＋ｆ＋ｉ≧０を受ける、のシリコーンポリマーが提供される。【選択図】なし,"Upkuttan, Vine Krishnan; Datta, Pranabesh; Nike, sandeep; Sachsena, Anouve Have",Momentive Performance Materials Inc.,2019-03-14
JP2003512254A,JP,2003-04-02,【発明の名称】ロケットの第1段の再使用型ブースタ,"A booster comprises a body including tanks for an oxidizer and fuel, a nose compartment with a dome, a between-tank section and an afterbody, a rocket engine installation, an all-moving wing with a unit for turning it and fixing in a position along the axis of the booster during the ascension step and in a position turned by 90 DEG during the return flight, horizontal and vertical fin assemblies, a triple-point support landing gear, aerodynamic control organs and units for jointing to the second stage of the launch vehicle. The booster is provided with an air-feed jet engine installation, comprising two engines with air intakes mounted in the nose compartment, and with gas-line extensions with exhaust nozzles extending beyond the bypasses of the external contours of the nose compartment, and a propellant system with propellant tanks in the wing, working and balancing tanks in the nose compartment. A wing is mounted on the upper surface of the booster body in the area of the between-tank section. Horizontal and vertical fins are mounted on the afterbody and are made respectively in the form of a stabilizer consisting of two all-moving consoles with a small negative V-shaped angle, and a fin with a yaw rudder. The dome of the nose compartment is made in the form of a portion of a sphere and has two inlet apertures for the aforesaid air intakes, closed by one turning plug. 6 dependent claims, 11 drawings. ","Kiselev, Anatoly Ivanovich; Medwedev, Alexander Aleksevic; Trufanov, Yuri Nikolaevich; Razoogin, Igor Sergevich; Kuznetsov, Yury Leonidovich; Pankevic, Alexandre Alexandrovich; Navoschikov, Gennadi Fedorovich; Ushakov, Vladimir Mikhailovich","Federal Noe Gosdarst Benoe Unita Noe Predpryaty ""Gosdarst Benny Kosmicjesky Naukno-Proise Bodst Bennie Zentle im M Buoy Krunicheva""",2000-10-13
