SHARETEX AB (SE),STIGSSON LARS (SE),WIPO,1.0,527.0,,527.0,527.0,527.0,527.0,527.0
SHELL DAVELOPMENT COMPANY,"Stanly, Albert L.                
                            Cattaneo, Alfred G.",US,1.0,295.0,,295.0,295.0,295.0,295.0,295.0
SHELL INT RESEARCH (NL),BREWER MARK LAWRENCE (GB); CRACKNELL ROGER FRANCIS (GB); GOH TOR KIT (MY),EP,2.0,338.5,478.7112908632927,0.0,169.25,338.5,507.75,677.0
SHELL INT RESEARCH (NL); SHELL OIL CO (US),BREWER MARK LAWRENCE (GB); CRACKNELL ROGER FRANCIS (GB); GOH TOR KIT (MY),WIPO,2.0,674.0,57.982756057296896,633.0,653.5,674.0,694.5,715.0
SHELL INT RESEARCH (NL); SHELL USA INC (US),VALENTICH GRIFFIN MICHAEL (US); MINER ELISE MARIE (US),WIPO,1.0,615.0,,615.0,615.0,615.0,615.0,615.0
SHELL INT RESEARCH; VIRENT INC,JOANNA MARGARET BAULDREAY; PAUL GEORGE BLOMMEL; RANDY DOUGLAS CORTRIGHT; RICHARD JOHN PRICE,JP,1.0,876.0,,876.0,876.0,876.0,876.0,876.0
SHELL INTERNAT RES MIJ OF (NL); VINEGAR HAROLD J (US); FOWLER THOMAS D (US); HARRIS CHRISTOPHER KELVIN (US); JOHN RANDY CARL (US); KIM DONG-SUB (US); LAMBIRTH GENE RICHARD (US); MASON STANLEY LEROY (US); MENOTTI JAMES LOUIS (US); MILLER DAVID SCOTT (US); NAIR VIJAY (US); ROES AUGUSTINUS WILHELMUS MARIA (US); BRADY MICHAEL PATRICK (US); HORTON JOSEPH ARNO (US); VITEK JOHN MICHAEL (US); GOLDBERG BERNARD (US); HALE ARTHUR HERMAN (US); CHRISTENSEN DEL SCOTT (US); MAZIASZ PHILLIP JAMES (US); SHINGLEDECKER JOHN PAUL (US); SANTELLA MICHAEL LEONARD (US); SCHNEIBEL JOACHIM HUGO (US); SIKKA VINOD KUMAR (US); KARANIKAS JOHN MICHAEL (US); CHERRILLO RALPH ANTHONY (US); STONE FRANCES MARION JR (US); GOODWIN CHARLES R (US); HINSON RICHARD A (US); RICHARD JAMES JR (US),VINEGAR HAROLD J (US); FOWLER THOMAS D (US); HARRIS CHRISTOPHER KELVIN (US); JOHN RANDY CARL (US); KIM DONG-SUB (US); LAMBIRTH GENE RICHARD (US); MASON STANLEY LEROY (US); MENOTTI JAMES LOUIS (US); MILLER DAVID SCOTT (US); NAIR VIJAY (US); ROES AUGUSTINUS WILHELMUS MARIA (US); BRADY MICHAEL PATRICK (US); HORTON JOSEPH ARNO (US); VITEK JOHN MICHAEL (US); GOLDBERG BERNARD (US); HALE ARTHUR HERMAN (US); CHRISTENSEN DEL SCOTT (US); MAZIASZ PHILLIP JAMES (US); SHINGLEDECKER JOHN PAUL (US); SANTELLA MICHAEL LEONARD (US); SCHNEIBEL JOACHIM HUGO (US); SIKKA VINOD KUMAR (US); KARANIKAS JOHN MICHAEL (US); CHERRILLO RALPH ANTHONY (US); STONE FRANCES MARION JR (US); GOODWIN CHARLES R (US); HINSON RICHARD A (US); RICHARD JAMES JR (US),WIPO,1.0,554.0,,554.0,554.0,554.0,554.0,554.0
SHELL INTERNATIONALE RESEARCH MAATSCHAPPIJ BESLOTEN VENNOOTSHAP,"Brewer, Mark Lawrence; Crackner, Roger Francis; Go, Thor kit",JP,1.0,303.0,,303.0,303.0,303.0,303.0,303.0
SHELL INTERNATIONALE RESEARCH MAATSCHAPPIJ BESLOTEN VENNOOTSHAP,"Bruer, mark lawrence; Crackner, Roger Francis; Go, To Quito",JP,2.0,155.5,219.9102089490163,0.0,77.75,155.5,233.25,311.0
SHELL INTERNATIONALE RESEARCH MAATSCHAPPIJ BESLOTEN VENNOOTSHAP,"Hamilton, Philip Guy; Radoki, Corey William; Crytman, Keith Michael",JP,1.0,357.0,,357.0,357.0,357.0,357.0,357.0
SHELL INTERNATIONALE RESEARCH MAATSCHAPPIJ BESLOTEN VENNOOTSHAP,Joanna Margaret Bardley; Paul George Brommel; Randy Douglas Courtlight; Richard John Price,JP,1.0,117.0,,117.0,117.0,117.0,117.0,117.0
SHELL OIL CO (US); VINEGAR HAROLD J (US); FOWLER THOMAS D (US); HARRIS CHRISTOPHER KELVIN (US); JOHN RANDY CARL (US); KIM DONG-SUB (US); LAMBIRTH GENE RICHARD (US); MASON STANLEY LEROY (US); MENOTTI JAMES LOUIS (US); MILLER DAVID SCOTT (US); NAIR VIJAY (US); ROES AUGUSTINUS WILHELMUS MARI (US); BRADY MICHAEL PATRICK (US); HORTON JOSEPH ARNO (US); VITEK JOHN MICHAEL (US); GOLDBERG BERNARD (US); HALE ARTHUR HERMAN (US); CHRISTENSEN DEL SCOTT (US); MAZIASZ PHILLIP JAMES (US); SHINGLEDECKER JOHN PAUL (US); SANTELLA MICHAEL LEONARD (US); SCHNEIBEL JOACHIM HUGO (US); SIKKA VINOD KUMAR (US); KARANIKAS JOHN MICHAEL (US); CHERRILLO RALPH ANTHONY (US); STONE FRANCES MARION JR (US); GOODWIN CHARLES R (US); HINSON RICHARD A (US); RICHARD JAMES JR (US),VINEGAR HAROLD J (US); FOWLER THOMAS D (US); HARRIS CHRISTOPHER KELVIN (US); JOHN RANDY CARL (US); KIM DONG-SUB (US); LAMBIRTH GENE RICHARD (US); MASON STANLEY LEROY (US); MENOTTI JAMES LOUIS (US); MILLER DAVID SCOTT (US); NAIR VIJAY (US); ROES AUGUSTINUS WILHELMUS MARI (US); BRADY MICHAEL PATRICK (US); HORTON JOSEPH ARNO (US); VITEK JOHN MICHAEL (US); GOLDBERG BERNARD (US); HALE ARTHUR HERMAN (US); CHRISTENSEN DEL SCOTT (US); MAZIASZ PHILLIP JAMES (US); SHINGLEDECKER JOHN PAUL (US); SANTELLA MICHAEL LEONARD (US); SCHNEIBEL JOACHIM HUGO (US); SIKKA VINOD KUMAR (US); KARANIKAS JOHN MICHAEL (US); CHERRILLO RALPH ANTHONY (US); STONE FRANCES MARION JR (US); GOODWIN CHARLES R (US); HINSON RICHARD A (US); RICHARD JAMES JR (US),WIPO,1.0,554.0,,554.0,554.0,554.0,554.0,554.0
"SHELL OIL COMPANY (HOUSTON, TX, US)","Price, Richard John (Vicars Cross, Chester, GB)                
                            Orlebar, Caroline Nicola (London, GB)                
                            Rigutto, Marcello Stefano (Amsterdam, NL)                
                            Clark, Richard Hugh (Manchester, GB)                
                            Chahal, Jasprit Kaur (London, GB)",US,1.0,621.0,,621.0,621.0,621.0,621.0,621.0
SHELLEY RUDOLPH ALLEN,"Shelley, Rudolph Allen (Chicago, IL, US)",US,1.0,346.0,,346.0,346.0,346.0,346.0,346.0
SHKALIM REUVEN (IL); 0LEVI TSEDEK PAZ (IL); LEVI RAFI (IL),SHKALIM REUVEN (IL); 0LEVI TSEDEK PAZ (IL); LEVI RAFI (IL),WIPO,1.0,295.0,,295.0,295.0,295.0,295.0,295.0
"SIEMENS AG (80333 München, DE)",KARLSSON ANDREAS (SE); MILOSAVLJEVIC VLADIMIR (SE),EP,2.0,906.5,0.7071067811865476,906.0,906.25,906.5,906.75,907.0
"SIEMENS AG (80333 München, DE)",MILOSAVLEVIC VLADIMIR (SE),EP,1.0,890.0,,890.0,890.0,890.0,890.0,890.0
"SIEMENS AG (80333 München, DE)",MILOSAVLJEVIC VLADIMIR (SE),EP,1.0,1280.0,,1280.0,1280.0,1280.0,1280.0,1280.0
"SIEMENS AG (80333 München, DE)",MILOSAVLJEVIC VLADIMIR (SE); PERSSON ALLAN (SE); PERSSON MAGNUS (SE),EP,1.0,955.0,,955.0,955.0,955.0,955.0,955.0
"SIEMENS AG (80333 München, DE)",MORTON DAVID (DE),EP,1.0,443.0,,443.0,443.0,443.0,443.0,443.0
"SIEMENS AG (80333 München, DE)",SANCHEZ FABIAN (CA),EP,1.0,857.0,,857.0,857.0,857.0,857.0,857.0
SIEMENS AG (DE),KARLSSON ANDREAS (SE); MILOSAVLJEVIC VLADIMIR (SE),EP,1.0,906.0,,906.0,906.0,906.0,906.0,906.0
SIEMENS AG (DE),MILOSAVLJEVIC VLADIMIR (SE),EP,4.0,1107.0,254.51129640941284,889.0,889.0,1084.0,1302.0,1371.0
SIEMENS AG (DE),MILOSAVLJEVIC VLADIMIR (SE); PERSSON ALLAN (SE); PERSSON MAGNUS (SE),EP,3.0,930.6666666666666,43.878620458411554,880.0,918.0,956.0,956.0,956.0
SIEMENS AG (DE),MILOSAVLJEVIC VLADIMIR DUSAN (SE),EP,2.0,1377.0,0.0,1377.0,1377.0,1377.0,1377.0,1377.0
SIEMENS AG (DE),SANCHEZ FABIAN (CA),WIPO,1.0,878.0,,878.0,878.0,878.0,878.0,878.0
SIEMENS AG (DE); CORNWALL MICHAEL (DE); KARLSSON ANDREAS (SE); MILOSAVLJEVIC VLADIMIR (SE),CORNWALL MICHAEL (DE); KARLSSON ANDREAS (SE); MILOSAVLJEVIC VLADIMIR (SE),WIPO,1.0,1053.0,,1053.0,1053.0,1053.0,1053.0,1053.0
SIEMENS AG (DE); KARLSSON ANDREAS (SE); MILOSAVLJEVIC VLADIMIR (SE),KARLSSON ANDREAS (SE); MILOSAVLJEVIC VLADIMIR (SE),WIPO,1.0,906.0,,906.0,906.0,906.0,906.0,906.0
SIEMENS AG (DE); MILOSAVLJEVIC VLADIMIR (SE),MILOSAVLJEVIC VLADIMIR (SE),WIPO,4.0,1204.25,214.5,889.0,1181.5,1279.0,1301.75,1370.0
SIEMENS AG (DE); MILOSAVLJEVIC VLADIMIR (SE); PERSSON ALLAN (SE); PERSSON MAGNUS (SE),MILOSAVLJEVIC VLADIMIR (SE); PERSSON ALLAN (SE); PERSSON MAGNUS (SE),WIPO,2.0,917.5,53.033008588991066,880.0,898.75,917.5,936.25,955.0
SIEMENS AKTIENGESELLSCHAFT,"Milosavljevic, Vladimir Dusan (Norrkoping, SE)",US,1.0,846.0,,846.0,846.0,846.0,846.0,846.0
"SIEMENS AKTIENGESELLSCHAFT (Munich, DE)","Milosavljevic, Vladimir Dusan (Norrköping, SE)",US,1.0,846.0,,846.0,846.0,846.0,846.0,846.0
"SIEMENS ENERGY GLOBAL GMBH & CO KG (81739 München, DE)",FLEISCHER MAXIMILIAN (DE); RENTSCHLER ALEXANDER (DE); THIEMANN THOMAS (DE),EP,1.0,670.0,,670.0,670.0,670.0,670.0,670.0
"SINCONO AG (Zug, CH)","Krass, Florian (Weggis, CH)",US,1.0,560.0,,560.0,560.0,560.0,560.0,560.0
"SINE WAVES, INC. (White Lake, MI, US)","Wright, Matthew Weston (White Lake, MI, US)",US,2.0,893.0,0.0,893.0,893.0,893.0,893.0,893.0
SINGH AKHILESH PRASAD (IN),SINGH AKHILESH PRASAD (IN); SINGH NIMESHEE (IN); SINGH DEEPITARK (IN),WIPO,1.0,946.0,,946.0,946.0,946.0,946.0,946.0
SKLAR ALFRED (US),SKLAR ALFRED (US),WIPO,1.0,667.0,,667.0,667.0,667.0,667.0,667.0
SKY CANOE INC (CA),GEORGE DALE ARTHUR (CA),WIPO,1.0,851.0,,851.0,851.0,851.0,851.0,851.0
"SKY CANOE INC (Toronto, Ontario M5X 1G5, CA)",GEORGE DALE ARTHUR (CA),EP,2.0,851.0,0.0,851.0,851.0,851.0,851.0,851.0
"SKYWORKS SOLUTIONS, INC. (Woburn, MA, US)","Hill, Michael David (Frederick, MD, US)                
                            Shunkwiler, Jeffrey Alan (Frederick, MD, US)",US,1.0,418.0,,418.0,418.0,418.0,418.0,418.0
"SL Aburn, Inc. (Auburn, NY)","Buer, Richard W. (Cortland, NY)",US,1.0,794.0,,794.0,794.0,794.0,794.0,794.0
"SMART DRILLING AND COMPLETION, INC. (BOTHELL, WA, US)","Vail III, William Banning (BOTHELL, WA, US)                
                            Skerl, Tomislav (HOUSTON, TX, US)                
                            Schwinberg, Paul B. (RICHLAND, WA, US)                
                            Momii, Steven T. (MERCER ISLAND, WA, US)",US,2.0,384.0,0.0,384.0,384.0,384.0,384.0,384.0
"SMITH LANCE L.                
                            ETEMAD SHAHROKH                
                            CASTALDI MARCO J.                
                            KARIM HASAN UL                
                            PFEFFERLE WILLIAM C.","Smith, Lance L. (North Haven, CT, US)                
                            Etemad, Shahrokh (Trumbull, CT, US)                
                            Castaldi, Marco J. (Bridgeport, CT, US)                
                            Karim, Hasan Ul (Hamden, CT, US)                
                            Pfefferle, William C. (Madison, CT, US)",US,1.0,355.0,,355.0,355.0,355.0,355.0,355.0
"SMITH LANCE L.                
                            ETEMAD SHAHROKH                
                            CASTALDI MARCO J.                
                            KARIM HASAN UL.                
                            PFEFFERLE WILLIAM C.","Smith, Lance L. (North Haven, CT, US)                
                            Etemad, Shahrokh (Trumbull, CT, US)                
                            Castaldi, Marco J. (Bridgeport, CT, US)                
                            Karim, Hasan Ul (Hamden, CT, US)                
                            Pfefferle, William C. (Madison, CT, US)",US,1.0,355.0,,355.0,355.0,355.0,355.0,355.0
SMITH MICHAEL J. C.,"Smith, Michael J. C. (Bellevue, WA)",US,1.0,905.0,,905.0,905.0,905.0,905.0,905.0
SMITH MICHAEL J. C.,"Smith, Michael J. C. (Jupiter, FL)",US,2.0,804.0,0.0,804.0,804.0,804.0,804.0,804.0
SMITH MICHAEL J. C.,"Smith, Michael J. C. (Jupiter, FL, US)",US,1.0,804.0,,804.0,804.0,804.0,804.0,804.0
SMITH; MARVIN M.,"Smith, Marvin M. (Muncie, IN)",US,1.0,950.0,,950.0,950.0,950.0,950.0,950.0
SNECMA,"Jeratsushi, Sedorsk",JP,1.0,311.0,,311.0,311.0,311.0,311.0,311.0
"SNECMA (PARIS, FR)","Seize, Guilhem (Corbeil-Essonnes, FR)",US,1.0,642.0,,642.0,642.0,642.0,642.0,642.0
"SNECMA (Paris, FR)","Biebel, Romain (Le Coudray Montceau, FR)                
                            Gautier, Claude (Savigny le Temple, FR)                
                            Sandelis, Denis Jean Maurice (Nangis, FR)",US,1.0,867.0,,867.0,867.0,867.0,867.0,867.0
"SNECMA (Paris, FR)","Biebel, Romain (Le Coudray Montceaux, FR)                
                            Gautier, Claude (Savigny Le Temple, FR)                
                            Sandelis, Denis Jean Murice (Nangis, FR)",US,1.0,979.0,,979.0,979.0,979.0,979.0,979.0
"SNECMA (Paris, FR)","Blanchard, Stephane Pierre Guillaume (Chartrettes, FR)                
                            Vuillemenot, Yann (Paris, FR)",US,1.0,415.0,,415.0,415.0,415.0,415.0,415.0
"SNECMA (Paris, FR)","Gauthier, Gerard Philippe (Champagne sur Seine, FR)                
                            Mourlan, Jean-pierre (Nogent sur Marne, FR)",US,1.0,426.0,,426.0,426.0,426.0,426.0,426.0
"SNECMA (Paris, FR)","Gerez, Valerio (Yerres, FR)                
                            Griffaton, Julien Christian Pascal (Paris, FR)",US,1.0,594.0,,594.0,594.0,594.0,594.0,594.0
"SNECMA (Paris, FR)","Seize, Guilhem (Corbeil-Essonnes, FR)",US,1.0,642.0,,642.0,642.0,642.0,642.0,642.0
SNECMA MOTEURS,MAILLARD DAVID; GARASSINO ALAIN PIERRE; MAILLARD CLAUDE MARCEL; DESSENNE CAROLINE; VEGIOTTI ISABELLE,JP,1.0,931.0,,931.0,931.0,931.0,931.0,931.0
SNECMA MOTEURS (FR),ANSART DENIS ROGER HENRI (FR); CICCIA PATRICK SAMUEL ANDRE (FR),EP,1.0,750.0,,750.0,750.0,750.0,750.0,750.0
SNELL WILLIAM,"Snell, William (Monmouth, OR, US)",US,1.0,1010.0,,1010.0,1010.0,1010.0,1010.0,1010.0
SNR Biome Arpes,Molten Sommer; Birgenia Martinez; Eric van der Helm; Jacob Clause Harbor; Ana de Santiago Trio; Christian Glendal; Yasper Kurube,JP,2.0,357.0,69.29646455628166,308.0,332.5,357.0,381.5,406.0
"SOLENA FUELS CORPORATION (Washington, DC, US)","Do, Robert T. (Potomac, MD, US)                
                            Motycka, Sylvain A. (Washington, DC, US)",US,2.0,939.0,31.11269837220809,917.0,928.0,939.0,950.0,961.0
"SOLRAY ENERGY LIMITED (INVERCARGILL, NZ)","Bathurst, Christopher Francis (Christchurch, NZ)",US,1.0,717.0,,717.0,717.0,717.0,717.0,717.0
SOLRAY ENERGY LTD (NZ),BATHURST CHRISTOPHER FRANCIS (NZ),EP,1.0,285.0,,285.0,285.0,285.0,285.0,285.0
SOLRAY ENERGY LTD (NZ); BATHURST CHRISTOPHER FRANCIS (NZ),BATHURST CHRISTOPHER FRANCIS (NZ),WIPO,3.0,600.6666666666666,194.56704071690388,376.0,544.5,713.0,713.0,713.0
"SOLRAY HOLDINGS LTD (Christchurch 8011, NZ)",BATHURST CHRISTOPHER FRANCIS (NZ),EP,1.0,285.0,,285.0,285.0,285.0,285.0,285.0
"SONIC BLUE AEROSPACE, INC. (Portland, ME, US)","Lugg, Richard H. (Falmouth, ME, US)",US,1.0,447.0,,447.0,447.0,447.0,447.0,447.0
SOPRAVIA INC (CA),ARMAND GEORGES (CA),EP,1.0,36.0,,36.0,36.0,36.0,36.0,36.0
SOPRAVIA INC (CA); ARMAND GEORGES (CA),ARMAND GEORGES (CA),WIPO,1.0,1117.0,,1117.0,1117.0,1117.0,1117.0,1117.0
SOUNDBLAST TECHNOLOGIES LLC (US),FULLERTON LARRY W (US),EP,1.0,659.0,,659.0,659.0,659.0,659.0,659.0
SOUNDBLAST TECHNOLOGIES LLC (US); FULLERTON LARRY W (US),FULLERTON LARRY W (US),WIPO,2.0,835.0,0.0,835.0,835.0,835.0,835.0,835.0
"SOUNDBLAST TECHNOLOGIES LLC (Winter Park, FL, US)","Fullerton, Larry W. (New Hope, AL, US)",US,1.0,768.0,,768.0,768.0,768.0,768.0,768.0
SPACE DATA CORP (US),KNOBLACH GERALD MARK (US),WIPO,1.0,797.0,,797.0,797.0,797.0,797.0,797.0
"SPACE DATA CORPORATION (Chandler, AZ, US)","Knoblach, Gerald M. (Chandler, AZ, US)",US,1.0,797.0,,797.0,797.0,797.0,797.0,797.0
"SPACE DATA CORPORATION (Chandler, AZ, US)","Knoblach, Gerald M. (Chandler, AZ, US)                
                            Frische, Eric A. (Addison, TX, US)",US,2.0,570.0,0.0,570.0,570.0,570.0,570.0,570.0
"SPACE DATA CORPORATION (Chandler, AZ, US)","Knoblach, Gerald Mark (Chandler, AZ, US)",US,2.0,797.0,0.0,797.0,797.0,797.0,797.0,797.0
"SPACE DATA CORPORATION (Chandler, AZ, US)","Knoblach, Gerald Mark (Chandler, AZ, US)                
                            Frische, Eric A. (Addison, TX, US)",US,1.0,570.0,,570.0,570.0,570.0,570.0,570.0
"SPACE DATA CORPORATION (Chandler, AZ, US)","Knoblach, Gerald Mark (Chandler, AZ, US)                
                            Frische, Eric A. (Sun Lakes, AZ, US)",US,2.0,570.0,0.0,570.0,570.0,570.0,570.0,570.0
SPERRY RAND CORP,"Miller, Harry, Scottsdale",DE,1.0,1905.0,,1905.0,1905.0,1905.0,1905.0,1905.0
"SPRAGUE BARRY N.                
                            VALENTINE JAMES M.","Sprague, Barry N. (Bethlehem, CT, US)                
                            Valentine, James M. (Fairfield, CT, US)",US,1.0,1094.0,,1094.0,1094.0,1094.0,1094.0,1094.0
STANDARD OIL CO,"Diwoky, Fred F.",US,1.0,294.0,,294.0,294.0,294.0,294.0,294.0
STANDARD OIL DEV CO,"Carleton, Ellis",US,2.0,294.0,0.0,294.0,294.0,294.0,294.0,294.0
STANDARD OIL DEV CO,"Frolich, Per K.",US,1.0,294.0,,294.0,294.0,294.0,294.0,294.0
STANDARD OIL DEV CO,"Hill, Ralph M.",US,1.0,301.0,,301.0,301.0,301.0,301.0,301.0
STANDARD OIL DEV CO,"Slotterbeck, Ober C.",US,1.0,297.0,,297.0,297.0,297.0,297.0,297.0
STARCHEM INC (US),DIJK CHRISTIAAN P VAN DIJK (US); FRALEY LOWELL DAVID (US),EP,1.0,961.0,,961.0,961.0,961.0,961.0,961.0
STARCHEM INC (US),VAN DIJK CHRISTIAAN P (US); FRALEY LOWELL DAVID (US),EP,1.0,961.0,,961.0,961.0,961.0,961.0,961.0
STARCHEM INC (US),VAN DIJK CHRISTIAAN P (US); FRALEY LOWELL DAVID (US),WIPO,1.0,904.0,,904.0,904.0,904.0,904.0,904.0
STATE OF FRANKLIN INNOVATION L (US); EASON MARTIN P (US); HEMPHILL WILLIAM K (US); OLSEN MARTIN E (US); SIMS J PAUL (US),EASON MARTIN P (US); HEMPHILL WILLIAM K (US); OLSEN MARTIN E (US); SIMS J PAUL (US),WIPO,2.0,707.0,0.0,707.0,707.0,707.0,707.0,707.0
STATE POWER INVESTMENT CORPORATION RES INSTITUTE (CN),LV XIJIA (CN),WIPO,1.0,1093.0,,1093.0,1093.0,1093.0,1093.0,1093.0
"STC (Developments) Limited (Gzira, MT)","Hearn Jr., Ralph Eugene (Gzira, MT)                
                            Rodenborg, Sten (Gzira, MT)",US,1.0,1043.0,,1043.0,1043.0,1043.0,1043.0,1043.0
"STC Developments B.V. (Amsterdam, NL)","Hearn Jr., Ralph Eugene (Gzira, MT)                
                            Rodenborg, Sten (Gzira, MT)",US,1.0,1043.0,,1043.0,1043.0,1043.0,1043.0,1043.0
"STEEPER ENERGY APS (2950 Vedbæk, DK)",IVERSEN STEEN B (DK); JENSEN CLAUS UHRENHOLT (DK); RODRIGUEZ GUERRERO JULIE KATERINE (CA),EP,1.0,926.0,,926.0,926.0,926.0,926.0,926.0
"STEEPER ENERGY APS (Horsholm, DK)","Iversen, Steen B. (Vedbæk, DK)                
                            Jensen, Claus Uhrenholt (Aalborg, DK)                
                            Rodriguez Guerrero, Julie Katerine (Calgary, CA)",US,1.0,2316.0,,2316.0,2316.0,2316.0,2316.0,2316.0
"STEEPER ENERGY APS (Hørsholm, DK)","Iversen, Steen B. (Vedbæk, DK)                
                            Jensen, Claus Uhrenholt (Aalborg, DK)                
                            Rodriguez Guerrero, Julie Katerine (Calgary, CA)",US,1.0,926.0,,926.0,926.0,926.0,926.0,926.0
STEPPS DALE B.,"Stepps, Dale B. (Plantation, FL, US)",US,1.0,969.0,,969.0,969.0,969.0,969.0,969.0
"STICKLES RICHARD W.                
                            HALPIN JOHN L.","Stickles, Richard W. (Loveland, OH, US)                
                            Halpin, John L. (Pointe Claire, CA)",US,1.0,571.0,,571.0,571.0,571.0,571.0,571.0
STRIEBEL HANS MARTIN (DE),STRIEBEL HANS-MARTIN (DE); STRIEBEL CHRISTHARD (DE),DE,1.0,1185.0,,1185.0,1185.0,1185.0,1185.0,1185.0
SUBHADRA BOBBAN,"Subhadra, Bobban (Albuquerque, NM, US)",US,1.0,472.0,,472.0,472.0,472.0,472.0,472.0
SUD AVIATION,EDMOND CAILLETTE GEORGES; AMABLE VIDAL JEAN,DE,1.0,1942.0,,1942.0,1942.0,1942.0,1942.0,1942.0
"SUDDUTH BRUCE C.                
                            SLONE RALPH J.                
                            PALEKAR VISHWESH                
                            RAMAVAJALA MADHU","Sudduth, Bruce C. (Corona, CA, US)                
                            Slone, Ralph J. (Columbus, IN, US)                
                            Palekar, Vishwesh (Irvine, CA, US)                
                            Ramavajala, Madhu (Austin, TX, US)",US,1.0,832.0,,832.0,832.0,832.0,832.0,832.0
SUNDROP FUELS INC (US),SIMMONS WAYNE W (US); WHITE SIDNEY P (US); PERKINS CHRISTOPHER (US),WIPO,1.0,844.0,,844.0,844.0,844.0,844.0,844.0
"SUNDROP FUELS, INC. (Longmont, CO, US)","Simmons, Wayne W. (Longmont, CO, US)                
                            White, Sidney P. (Fort Collins, CO, US)                
                            Perkins, Christopher (Boulder, CO, US)",US,1.0,844.0,,844.0,844.0,844.0,844.0,844.0
SUNDSTRAND CORPORATION,"JONES, ANTHONY, C.; WEBER, HENRY, A.",EP,1.0,671.0,,671.0,671.0,671.0,671.0,671.0
SUPERSONIC AEROSPACE INT (US); LEE HOWARD (US); MORGENSTERN JOHN M (US); ANDERSON THOMAS J (US); FRANKLIN WALTER M III (US); WILKINSON TODD (US); PEDERSON DARRELL (US); SMITH CHRISTOPHER J R (US); AMINPOUR HOSSEIN (US),LEE HOWARD (US); MORGENSTERN JOHN M (US); ANDERSON THOMAS J (US); FRANKLIN WALTER M III (US); WILKINSON TODD (US); PEDERSON DARRELL (US); SMITH CHRISTOPHER J R (US); AMINPOUR HOSSEIN (US),WIPO,2.0,568.0,0.0,568.0,568.0,568.0,568.0,568.0
"SURFACE TECH GMBH & CO KG (15837 Baruth, DE)",BUHLMANN CARSTEN (DE),EP,1.0,1092.0,,1092.0,1092.0,1092.0,1092.0,1092.0
SUSTAINABLE OILS INC (US),GUILEN PORTAL FERNANDO (US),WIPO,1.0,242.0,,242.0,242.0,242.0,242.0,242.0
SUSTAINABLE OILS INC (US),GUILLEN PORTAL FERNANDO (US),WIPO,5.0,244.2,5.357238094391549,239.0,241.0,241.0,250.0,250.0
"SUSTAINED ENERGY RECOVERY SYSTEMS, LLC (San Jose, CA, US)","Long, Donald James (San Jose, CA, US)",US,1.0,926.0,,926.0,926.0,926.0,926.0,926.0
"SWIFT ENTERPRISES, LTD. (West Lafayette, IN, US)","Rusek, John J. (West Lafayette, IN, US)                
                            Ziulkowski, Jonathon D. (West Lafayette, IN, US)                
                            Catania, Philip J. (West Lafayette, IN, US)                
                            Bower, Donald L. (West Lafayette, IN, US)",US,1.0,1086.0,,1086.0,1086.0,1086.0,1086.0,1086.0
"SWIFT ENTERPRISES, LTD. (West Lafayette, IN, US)","Rusek, John J. (West Lafyette, IN, US)",US,1.0,629.0,,629.0,629.0,629.0,629.0,629.0
SWIFT ENTPR LTD (US); RUSEK JOHN J (US); ZIULKOWSKI JONATHON D (US); CATANIA PHILIP J (US); BOWER DONALD L (US),RUSEK JOHN J (US); ZIULKOWSKI JONATHON D (US); CATANIA PHILIP J (US); BOWER DONALD L (US),WIPO,1.0,1081.0,,1081.0,1081.0,1081.0,1081.0,1081.0
SWIFT FUELS LLC (US),ZINK JUSTIN D (US); D'ACOSTA CHRIS (US); STIRM BRIAN (US); ALBUZAT THOMAS (DE),WIPO,1.0,464.0,,464.0,464.0,464.0,464.0,464.0
"SWIFT FUELS LLC (West Lafayette, IN 47906, US)",ZINK JUSTIN D (US); D'ACOSTA CHRIS (US); STIRM BRIAN (US); ALBUZAT THOMAS (DE),EP,2.0,463.0,0.0,463.0,463.0,463.0,463.0,463.0
"SWINSON JOHNNY                
                            JAMES; TERRY J.","Swinson Deceased., Johnny (late of Mineral Wells, TX)                
                            Walker, executrix; by Sueanne (Clinton, MS)                
                            James, Terry J. (Metter, GA)",US,1.0,1774.0,,1774.0,1774.0,1774.0,1774.0,1774.0
"SYNFUELS CHINA CO., LTD (Taiyuan, CN)","Cui, Minli (Taiyuan, CN)                
                            Huang, Jianwei (Taiyuan, CN)                
                            Hao, Xu (Taiyuan, CN)                
                            Cao, Liren (Taiyuan, CN)                
                            Li, Yongwang (Taiyuan, CN)",US,1.0,991.0,,991.0,991.0,991.0,991.0,991.0
"SYNTHETIC GENOMICS INC (La Jolla, CA 92037, US)",BENDERS GWYNEDD A (US); GLASS JOHN I (US); HUTCHISON CLYDE A (US); LARTIGUE CAROLE (FR); VASHEE SANJAY (US); ALGIRE MIKKEL A (US); SMITH HAMILTON O (US); MERRYMAN CHARLES E (US); NOSKOV VLADIMIR N (US); CHUANG RAY-YUAN (US); GIBSON DANIEL G (US); VENTER J CRAIG (US),EP,2.0,411.0,0.0,411.0,411.0,411.0,411.0,411.0
SYNTROLEUM CORP (US),AGEE KENNETH L; AGEE MARK A,WIPO,1.0,613.0,,613.0,613.0,613.0,613.0,613.0
"Sada-Salinas Jaime G.                
                            Arellano-Escarpita David Alejandro","Sada-salinas, Jaime G. (San Antonio, TX, US)                
                            Arellano-escarpita, David Alejandro (Durango, MX)",US,1.0,465.0,,465.0,465.0,465.0,465.0,465.0
"Samsung Electronics Co., Ltd. (Suwon, Kyungki-Do, KR)","Brenner, Robert E. (New Richmond, WI, US)                
                            Baker, James A. (Hudson, WI, US)",US,1.0,832.0,,832.0,832.0,832.0,832.0,832.0
"Sandia Corporation (Albuquerque, NM, US)","Davis, Ryan Wesley (San Jose, CA, US)                
                            Simmons, Blake (San Francisco, CA, US)                
                            Tran-gyamfi, Mary Bao (Pleasanton, CA, US)                
                            Wu, Benjamin Chiau-pin (San Ramon, CA, US)",US,1.0,431.0,,431.0,431.0,431.0,431.0,431.0
"Sapphire Energy, Inc. (San Diego, CA, US)","Cranford, Richard J. (San Diego, CA, US)                
                            Aravanis, Alex M. (San Diego, CA, US)                
                            Roussis, Stilianos G. (La Jolla, CA, US)",US,4.0,239.5,5.0,232.0,239.5,242.0,242.0,242.0
"Saskatchewan Research Council (Saskatoon, CA)","Vedachalam, Sundaramurthy (Saskatoon, CA)",US,1.0,488.0,,488.0,488.0,488.0,488.0,488.0
Saudi Arabian Oil Company,"Sun; Shu, Way",JP,2.0,165.0,32.526911934581186,142.0,153.5,165.0,176.5,188.0
"Saudi Arabian Oil Company (DHAHRAN, SA)","Xu, Wei (Dhahran, SA)                
                            Sun, Miao (Dhahran, SA)",US,1.0,410.0,,410.0,410.0,410.0,410.0,410.0
"Saudi Arabian Oil Company (Dhahran, SA)","Koseoglu, Omer Refa (Dhahran, SA)                
                            Sawan, Ali (Dhahran, SA)",US,2.0,638.0,0.0,638.0,638.0,638.0,638.0,638.0
"Saudi Arabian Oil Company (Dhahran, SA)","Sun, Miao (Dhahran, SA)                
                            Xu, Wei (Dhahran, SA)",US,2.0,321.0,19.79898987322333,307.0,314.0,321.0,328.0,335.0
"Saudi Arabian Oil Company (Dhahran, SA)","Younes, Mourad (Dhahran, SA)                
                            Alahmed, Ammar (Dhahran, SA)                
                            Al Rammah, Abdullah (Dhahran, SA)                
                            Jamal, Aqil (Dhahran, SA)",US,1.0,173.0,,173.0,173.0,173.0,173.0,173.0
"Schmidt Terrence W.                
                            Kline Jeffrey E.","Schmidt, Terrence W. (Santa Clara, CA, US)                
                            Kline, Jeffrey E. (Severna Park, MD, US)",US,1.0,991.0,,991.0,991.0,991.0,991.0,991.0
"Science Applications International Corporation (San Diego, CA)","Palmer, Miles R. (Great Falls, VA)",US,2.0,1302.5,195.86857838867365,1164.0,1233.25,1302.5,1371.75,1441.0
