"EMBRAER S.A. (São José dos Campos, São Paulo, BR)","Castelli, Alberto Dei (São Paulo, BR)                
                            Ferreira, Clovis Augusto Eça (São Paulo, BR)                
                            Montoro, Wanderley (São Paulo, BR)                
                            Filho, Aldemiro Lorenzini (São Paulo, BR)                
                            Bones Jr., Carlos Alberto (São Paulo, BR)                
                            De Oliveira, Juliano (São Paulo, BR)",US,1.0,652.0,,652.0,652.0,652.0,652.0,652.0
EN TECHNOLOGIES INC (US); NGUYEN THIEN DUYEN THI (US); PARIMI KRISHNIAH (US),NGUYEN THIEN DUYEN THI (US); PARIMI KRISHNIAH (US),WIPO,1.0,172.0,,172.0,172.0,172.0,172.0,172.0
"ENCAPSYS, LLC","Fen, Lin Shen; Robert, Stanley, Bobnock",JP,2.0,225.0,124.45079348883236,137.0,181.0,225.0,269.0,313.0
"ENCAPSYS, LLC","Fen, Lin Shen; Todd, Erlin, Schwantes; Robert, Stanley, Bobnock; Yang, Nianshi",JP,1.0,155.0,,155.0,155.0,155.0,155.0,155.0
"ENERGY FROM WASTE LTD. (Dunton Green, GB)","Hall, Philip Lawrence Timothy Richard (Dunton Green, GB)",US,1.0,596.0,,596.0,596.0,596.0,596.0,596.0
"ENG PROPULSION SYSTEMS INC (New Richmond, WI 54017, US); WEINZIERL STEVEN M (New Richmond, WI 54017, US); FUCHS MICHAEL J (New Richmond, WI 54017, US)",WEINZIERL STEVEN M (US); FUCHS MICHAEL J (US),EP,1.0,669.0,,669.0,669.0,669.0,669.0,669.0
"ENGELHARD MINERALS & CHEMICALS CORP., 07974 MURRAY HILL, N.J., US","PFEFFERLE, WILLIAM C., MIDDLETOWN, N.J., US",DE,1.0,0.0,,0.0,0.0,0.0,0.0,0.0
ENGINEERED PROPULSION SYSTEMS INC (US); WEINZIERL STEVEN M (US); FUCHS MICHAEL J (US),WEINZIERL STEVEN M (US); FUCHS MICHAEL J (US),EP,1.0,669.0,,669.0,669.0,669.0,669.0,669.0
ENGINEERED PROPULSION SYSTEMS INC (US); WEINZIERL STEVEN M (US); FUCHS MICHAEL J (US),WEINZIERL STEVEN M (US); FUCHS MICHAEL J (US),WIPO,1.0,671.0,,671.0,671.0,671.0,671.0,671.0
"ENGINEERED PROPULSION SYSTEMS, INC. (New Richmond, WI, US)","Fuchs, Michael J. (New Richmond, WI, US)                
                            Weinzierl, Steven M. (New Richmond, WI, US)                
                            Schneider, Oliver (Bonn, DE)                
                            Evers, Markus (Leverkusen, DE)",US,1.0,791.0,,791.0,791.0,791.0,791.0,791.0
"ENI S.p.A. (Rome, IT)","D'elia, Luigi (Pandino-Cremona, IT)                
                            Scorletti, Pietro (Giussago, IT)                
                            Rausa, Riccardo (San Donato Milanese-Milano, IT)                
                            Rivolta, Guido (Vigevano-Milano, IT)                
                            De Amicis, Alberto (San Donato Milanese-Milano, IT)                
                            Ambrosini, Tiziano (Settimo Milanese-Milano, IT)",US,1.0,558.0,,558.0,558.0,558.0,558.0,558.0
ENI SPA (IT); PIRELLI & C AMBIENTE TECNOLOGI (IT); ENITECNOLOGIE SPA (IT),D ELIA LUIGI (IT); SCORLETTI PIETRO (IT); RAUSA RICCARDO (IT); RIVOLTA GUIDO (IT); DE AMICIS ALBERTO (IT); AMBROSINI TIZIANO (IT),EP,1.0,22.0,,22.0,22.0,22.0,22.0,22.0
EQT CORP (US),WINGO ROBERT R (US); JORDAN WILLIAM E (US); RICE TOBY Z (US); KANTO RYAN (US),WIPO,1.0,699.0,,699.0,699.0,699.0,699.0,699.0
"EQT Corporation (Pittsburgh, PA, US)","Wingo, Robert R. (Pittsburgh, PA, US)                
                            Jordan, William E. (Pittsburgh, PA, US)                
                            Rice, Toby Z. (Pittsburgh, PA, US)                
                            Fenton, Sarah (Pittsburgh, PA, US)",US,1.0,783.0,,783.0,783.0,783.0,783.0,783.0
"EQT Corporation (Pittsburgh, PA, US)","Wingo, Robert R. (Pittsburgh, PA, US)                
                            Jordan, William E. (Pittsburgh, PA, US)                
                            Rice, Toby Z. (Pittsburgh, PA, US)                
                            Kanto, Ryan (Pittsburgh, PA, US)",US,2.0,699.0,0.0,699.0,699.0,699.0,699.0,699.0
"ESSENTIUM, INC. (Pflugerville, TX, US)","Teipel, Elisa (PFLUGERVILLE, TX, US)                
                            Holder, Kevin (HOUSTON, TX, US)                
                            Nagabandi, Nirup (PFLUGERVILLE, TX, US)                
                            Teipel, Blake (PFLUGERVILLE, TX, US)",US,1.0,277.0,,277.0,277.0,277.0,277.0,277.0
"ESSENTIUM, INC. (Pflugerville, TX, US)","Teipel, Elisa (Pflugerville, TX, US)                
                            Holder, Kevin (Houston, TX, US)                
                            Nagabandi, Nirup (Pflugerville, TX, US)                
                            Teipel, Blake (Pflugerville, TX, US)",US,1.0,277.0,,277.0,277.0,277.0,277.0,277.0
"ESSENTRA POROUS TECH CORP (Colonial Heights, VA 23834, US)",BERGER RICHARD M (US),EP,1.0,826.0,,826.0,826.0,826.0,826.0,826.0
ETHYL CORP,MALFER DENNIS J; COLUCCI WILLIAM J; FRANKLIN RANDALL M,JP,1.0,978.0,,978.0,978.0,978.0,978.0,978.0
"ETHYL CORP (Richmond, Virginia 23219-4304, US)",ARADI ALLEN A (US); ADAMS MICHAEL WAYNE (US); FACTOR STEPHEN ALAN (US),EP,2.0,845.5,14.849242404917497,835.0,840.25,845.5,850.75,856.0
"ETHYL CORP (Richmond, Virginia 23219-4304, US)",COLUCCI WILLIAM J (US); PETTIGREW ALEXANDER F (US); CUNNINGHAM LAWRENCE J (US),EP,3.0,857.0,12.12435565298214,843.0,853.5,864.0,864.0,864.0
"ETHYL CORP (Richmond, Virginia 23219-4304, US)",MALFER DENNIS J (US); FRANKLIN RANDALL M (US); COLUCCI WILLIAM L (US),EP,3.0,936.0,12.12435565298214,922.0,932.5,943.0,943.0,943.0
"ETHYL CORP (Richmond, Virginia 23219-4304, US)",MALFER DENNIS J (US); NOBLE ANDREA T (US); COLUCCI WILLIAM J (US); SHEETS ROGER M (US),EP,3.0,668.0,12.12435565298214,661.0,661.0,661.0,671.5,682.0
ETHYL CORPORATION,Dennis Jay Malfuar; William Jay Corsi; Randall M Franklin,JP,1.0,922.0,,922.0,922.0,922.0,922.0,922.0
ETTER ROGER G.,"Etter, Roger G. (Cardington, OH)",US,1.0,1369.0,,1369.0,1369.0,1369.0,1369.0,1369.0
"EUROCOPTER (Marignane, FR)","Lollini, Lionel (Montvendre, FR)",US,1.0,556.0,,556.0,556.0,556.0,556.0,556.0
"EUROCOPTER (Marignane, FR)","Vallart, Jean-baptiste (Marseille, FR)                
                            Vieira, Hilario (BERRE L'ETANG, FR)",US,1.0,895.0,,895.0,895.0,895.0,895.0,895.0
"EVONIK OPERATIONS GMBH (45128 Essen, DE)",HAAS THOMAS (DE); PAULMANN UWE (DE); BECK SIMON (DE),EP,1.0,402.0,,402.0,402.0,402.0,402.0,402.0
EXPANDER ENERGY INC (CA),KRESNYAK STEVE (CA); MIRHADI SEYEDAMIN (CA); PAUL HENDRIK (CA),WIPO,1.0,872.0,,872.0,872.0,872.0,872.0,872.0
EXPANDER ENERGY INC (CA); ATOMIC ENERGY OF CANADA LTD (CA),KRESNYAK STEVE (CA); CRAWFORD GORD (CA); SUPPIAH SELLATHURAI (CA),WIPO,1.0,782.0,,782.0,782.0,782.0,782.0,782.0
EXXON RESEARCH AND ENGINEERING COMPANY,Paul Jay Barlowitz; Timothy Andrew Burkholtz; Frank Harshkowitz; Alessandro Faldi; Allen S. Ericsson,JP,1.0,266.0,,266.0,266.0,266.0,266.0,266.0
EXXONMOBIL CHEM PATENTS INC (US); BROWN STEPHEN H (US); KUECHLER KEITH H (US); VERBERCKMOES AN (BE); PUTTEMANS MARC (BE); SILVERBERG STEVEN E (US); LUO SHIFANG (US); CHENG JANE C (US); JAENSCH HELGE (DE); MATHYS GEORGES M (BE),BROWN STEPHEN H (US); KUECHLER KEITH H (US); VERBERCKMOES AN (BE); PUTTEMANS MARC (BE); SILVERBERG STEVEN E (US); LUO SHIFANG (US); CHENG JANE C (US); JAENSCH HELGE (DE); MATHYS GEORGES M (BE),WIPO,1.0,723.0,,723.0,723.0,723.0,723.0,723.0
"EXXONMOBIL RES & ENG CO (Annandale, NJ 08801-0900, US)",CALCAVECCHIO PETER (US); SHOUGH ANNE MARIE (US); NG MAN KIT (US); DRAKE EVELYN N (US),EP,1.0,912.0,,912.0,912.0,912.0,912.0,912.0
EXXONMOBIL RES & ENG CO (US),BERLOWITZ PAUL J (US); BARCKHOLTZ TIMOTHY ANDREW (US); HERSHKOWITZ FRANK (US); FALDI ALESSANDRO (US); ERICKSON S ALLEN (US),EP,1.0,367.0,,367.0,367.0,367.0,367.0,367.0
EXXONMOBIL RES & ENG CO (US),BERLOWITZ PAUL J (US); BARCKHOLTZ TIMOTHY ANDREW (US); HERSHKOWITZ FRANK H (US); FALDI ALESSANDRO (US); ERICKSON S ALLEN (US),WIPO,1.0,584.0,,584.0,584.0,584.0,584.0,584.0
EXXONMOBIL RES & ENG CO (US),CALCAVECCHIO PETER (US); SHOUGH ANNE M (US); NG MAN KIT (US); DRAKE EVELYN N (US),WIPO,1.0,912.0,,912.0,912.0,912.0,912.0,912.0
"EXXONMOBIL RESEARCH AND ENGINEERING COMPANY (Annandale, NJ, US)","Berlowitz, Paul J. (Glen Gardner, NJ, US)                
                            Barckholtz, Timothy Andrew (Whitehouse Station, NJ, US)                
                            Hershkowitz, Frank (Basking Ridge, NJ, US)",US,3.0,536.6666666666666,40.991869112463434,513.0,513.0,513.0,548.5,584.0
"EXXONMOBIL RESEARCH AND ENGINEERING COMPANY (Annandale, NJ, US)","Berlowitz, Paul J. (Glen Gardner, NJ, US)                
                            Barckholtz, Timothy Andrew (Whitehouse Station, NJ, US)                
                            Hershkowitz, Frank (Basking Ridge, NJ, US)                
                            Faldi, Alessandro (Annandale, NJ, US)",US,1.0,595.0,,595.0,595.0,595.0,595.0,595.0
"EXXONMOBIL RESEARCH AND ENGINEERING COMPANY (Annandale, NJ, US)","Berlowitz, Paul J. (Glen Gardner, NJ, US)                
                            Barckholtz, Timothy Andrew (Whitehouse Station, NJ, US)                
                            Hershkowitz, Frank H. (Basking Ridge, NJ, US)",US,7.0,563.7142857142857,82.37862644665846,399.0,548.5,584.0,622.0,622.0
"EXXONMOBIL RESEARCH AND ENGINEERING COMPANY (Annandale, NJ, US)","Berlowitz, Paul J. (Glen Gardner, NJ, US)                
                            Barckholtz, Timothy Andrew (Whitehouse Station, NJ, US)                
                            Hershkowitz, Frank H. (Basking Ridge, NJ, US)                
                            Faldi, Alessandro (Annandale, NJ, US)",US,1.0,584.0,,584.0,584.0,584.0,584.0,584.0
"EXXONMOBIL RESEARCH AND ENGINEERING COMPANY (Annandale, NJ, US)","Berlowitz, Paul J. (Glen Gardner, NJ, US)                
                            Barckholtz, Timothy Andrew (Whitehouse Station, NJ, US)                
                            Hershkowitz, Frank H. (Basking Ridge, NJ, US)                
                            Faldi, Alessandro (Annandale, NJ, US)                
                            Erickson, Allen S. (Northglenn, CO, US)",US,1.0,584.0,,584.0,584.0,584.0,584.0,584.0
"EXXONMOBIL RESEARCH AND ENGINEERING COMPANY (Annandale, NJ, US)","Calcavecchio, Peter (Milford, NJ, US)                
                            Shough, Anne M. (High Bridge, NJ, US)                
                            Ng, Man Kit (Basking Ridge, NJ, US)                
                            Drake, Evelyn N. (Bernardsville, NJ, US)",US,1.0,912.0,,912.0,912.0,912.0,912.0,912.0
"EXXONMOBIL RESEARCH AND ENGINEERING COMPANY (Annandale, NJ, US)","Gaughan, Roger G. (Sewell, NJ, US)                
                            Peters, Robert T. (Kingwood, TX, US)                
                            Suter, Timothy D. (Vienna, VA, US)                
                            Knickerbocker, Bryan M. (Centreville, VA, US)",US,1.0,385.0,,385.0,385.0,385.0,385.0,385.0
"EXXONMOBIL RESEARCH AND ENGINEERING COMPANY (Annandale, NJ, US)","Rockwell, Gregory P. (Sarnia, CA)                
                            Poirier, Marc-andre (Sarnia, CA)",US,1.0,485.0,,485.0,485.0,485.0,485.0,485.0
EXXONMOBIL TECHNOLOGY & ENGINEERING COMPANY (US),ANDERSON TIMOTHY J (US); BERKHOUS SCOTT K (US); KAR KENNETH C H (US); KUECHLER KEITH H (US); LILIK GREGORY (US),WIPO,2.0,713.0,0.0,713.0,713.0,713.0,713.0,713.0
EXXONMOBIL TECHNOLOGY & ENGINEERING COMPANY (US),KADLECEK DANIEL E (US); KUECHLER KEITH H (US); WELLS PAUL P (US); LYNCH MICHAEL J (US); LILIK GREGORY (US),WIPO,2.0,500.0,0.0,500.0,500.0,500.0,500.0,500.0
EXXONMOBIL TECHNOLOGY & ENGINEERING COMPANY (US),SATTLER AARON (US); KIM HYUNG RAE (US); WALKER THEODORE W (US); DACOSTA ETHAN G (US); XU XIAOCHUN (US),WIPO,1.0,953.0,,953.0,953.0,953.0,953.0,953.0
EXXONMOBIL TECHNOLOGY & ENGINEERING COMPANY (US),VINCENT MATTHEW J (US); KUECHLER KEITH H (US),WIPO,1.0,654.0,,654.0,654.0,654.0,654.0,654.0
EXXONMOBIL TECHNOLOGY & ENGINEERING COMPANY (US),XU XIAOCHUN (US); DULIN ALEXANDER J (US); EVANS MADELYN M (US); BALIBAN RICHARD C (US),WIPO,1.0,407.0,,407.0,407.0,407.0,407.0,407.0
EXXONMOBIL TECHNOLOGY & ENGINEERING COMPANY (US),XU XIAOCHUN (US); EVANS MADELYN M (US),WIPO,1.0,562.0,,562.0,562.0,562.0,562.0,562.0
"EXXONMOBIL TECHNOLOGY AND ENGINEERING COMPANY (Annandale, NJ, US)","XU, Xiaochun (Annandale, NJ, US)                
                            Dulin, Alexander J. (Haddonfield, NJ, US)                
                            Evans, Madelyn M. (Annandale, NJ, US)                
                            Baliban, Richard C. (Annandale, NJ, US)",US,1.0,407.0,,407.0,407.0,407.0,407.0,407.0
"EXXONMOBIL TECHNOLOGY AND ENGINEERING COMPANY (Annandale, NJ, US)","XU, Xiaochun (Annandale, NJ, US)                
                            Evans, Madelyn M. (Jersey City, NJ, US)",US,1.0,562.0,,562.0,562.0,562.0,562.0,562.0
"EXXONMOBILE RESEARCH AND ENGINEERING COMPANY (Annandale, NJ, US)","Berlowitz, Paul J. (Glen Gardner, NJ, US)                
                            Barckholtz, Timothy Andrew (Whitehouse Station, NJ, US)                
                            Hershkowitz, Frank (Basking Ridge, NJ, US)",US,1.0,399.0,,399.0,399.0,399.0,399.0,399.0
"Eaton Intelligent Power Limited (Dublin, IE)","Gaikwad, Sandip Balasaheb (Pune, IN)                
                            Patil, Ranjit Dinkar (Kolahapur, IN)                
                            Olsztyn, Michael (Costa Mesa, CA, US)                
                            Baker, Graham Peter (Issaquah, WA, US)",US,1.0,677.0,,677.0,677.0,677.0,677.0,677.0
"Eaton Intelligent Power Limited (Dublin, IE)","Sarkar, Subrata (Pune, IN)                
                            Jones, Matthew Darren (Hampshire, GB)",US,1.0,791.0,,791.0,791.0,791.0,791.0,791.0
"Eclipse Aerospace, Inc.","Harland, Peter; Harness for ken",JP,1.0,442.0,,442.0,442.0,442.0,442.0,442.0
"Eclipse Aerospace, Inc. (Albuquerque, NM, US)","Haaland, Peter D. (Fraser, CO, US)                
                            Harness, Ken (Albuquerque, NM, US)",US,4.0,765.0,0.0,765.0,765.0,765.0,765.0,765.0
"Eclipse Aerospace, Inc. (Albuquerque, NM, US)","Haaland, Peter D. (Louisville, CO, US)                
                            Harness, Ken (Albuquerque, NM, US)",US,3.0,536.6666666666666,224.59815968376353,316.0,422.5,529.0,647.0,765.0
"Eclipse Aerospace, Inc. (Charleston, SC, US)","Haaland, Peter D. (Louisville, CO, US)                
                            Harness, Ken (Albuquerque, NM, US)",US,1.0,353.0,,353.0,353.0,353.0,353.0,353.0
Eclipse Aviation Corp.,"Haaland, Peter D. (Louisville, CO, US)                
                            Harness, Ken (Albuquerque, NM, US)",US,2.0,422.5,150.61374439273462,316.0,369.25,422.5,475.75,529.0
Eclipse Aviation Corporation,"Haaland, Peter D. (Louisville, CO, US)                
                            Harness, Ken (Albuquerque, NM, US)",US,1.0,765.0,,765.0,765.0,765.0,765.0,765.0
Eclipse Aviation Corporation,"Harland, Peter; Harness for ken",JP,1.0,442.0,,442.0,442.0,442.0,442.0,442.0
"ElectronAir LLC (Guilford, CT, US)","Walter-robinson, Dale Martin (Guilford, CT, US)",US,1.0,878.0,,878.0,878.0,878.0,878.0,878.0
"Elwha LLC, a limited liability corporation of the State of Delaware (Bellevue, WA, US)","Levien, Royce A. (Lexington, MA, US)                
                            Robert, Lord. W. (Seattle, WA, US)                
                            Richard, Lord. T. (Tacoma, WA, US)                
                            Malamud, Mark A. (Seattle, WA, US)                
                            Rinaldo Jr., John D. (Bellevue, WA, US)                
                            Wood Jr., Lowell L. (Bellevue, WA, US)",US,1.0,601.0,,601.0,601.0,601.0,601.0,601.0
"Embraer S.A. (São José dos Campos-SP, BR)","Da Silva, Paulo Anchieta (São José dos Campos, BR)                
                            Lazanha, Tomaz (São José dos Campos, BR)                
                            Rulli, Ricardo Pinheiro (São José dos Campos, BR)                
                            Dotta, Fernando (São José dos Campos, BR)",US,1.0,373.0,,373.0,373.0,373.0,373.0,373.0
"Emerging Fuels Technology, Inc. (Tulsa, OK, US)","Agee, Kenneth L. (Tulsa, OK, US)",US,1.0,840.0,,840.0,840.0,840.0,840.0,840.0
"Emerging Fuels Technology, Inc. (Tulsa, OK, US)","Agee, Kenneth L. (Tulsa, OK, US)                
                            Parker, Jennifer (Tulsa, OK, US)",US,2.0,1375.0,0.0,1375.0,1375.0,1375.0,1375.0,1375.0
"Endurant Systems, LLC (Alamo, CA, US)","Mcadoo, Gregory Leonard (Alamo, CA, US)",US,3.0,843.0,0.0,843.0,843.0,843.0,843.0,843.0
"Energia Technologies, Inc. (San Leando, CA, US)","Parimi, Krishniah (Alamo, CA, US)                
                            Nguyen, Thien Duyen Thi (Castro Valley, CA, US)",US,1.0,172.0,,172.0,172.0,172.0,172.0,172.0
"Energia Technologies, Inc. (San Leandro, CA, US)","Nguyen, Thien Duyen Thi (Castro Valley, CA, US)                
                            Parimi, Krishniah (Alamo, CA, US)",US,2.0,172.0,0.0,172.0,172.0,172.0,172.0,172.0
"Energia Technologies, Inc. (San Leandro, CA, US)","Parimi, Krishniah (Alamo, CA, US)                
                            Nguyen, Then Duyen Thi (Castro Valley, CA, US)",US,1.0,172.0,,172.0,172.0,172.0,172.0,172.0
"Energia Technologies, Inc. (San Leandro, CA, US)","Parimi, Krishniah (Alamo, CA, US)                
                            Nguyen, Thien Duyen Thi (Castro Valley, CA, US)",US,2.0,172.0,0.0,172.0,172.0,172.0,172.0,172.0
"Engineered Propulsion Systems, Inc. (New Richmond, WI, US)","Weinzierl, Steven M. (New Richmond, WI, US)                
                            Fuchs, Michael J. (New Richmond, WI, US)",US,4.0,619.0,101.3344298186291,467.0,618.5,669.5,670.0,670.0
"Engineered Propulsion Systems, Inc. (New Richmond, WI, US)","Weinzierl, Steven M. (New Richmond, WI, US)                
                            Fuchs, Michael J. (New Richmond, WI, US)                
                            Seybold-epting, Alexander (Stralsund, DE)",US,2.0,669.0,0.0,669.0,669.0,669.0,669.0,669.0
"Environmental & Energy Enterprises, LLC","Etter, Roger G. (Cardington, OH, US)",US,1.0,1370.0,,1370.0,1370.0,1370.0,1370.0,1370.0
"Environmental Tectonics Corporation (Southampton, PA, US)","Glaser, Scott (Rosamond, CA, US)                
                            King, Glenn B. (Riverside, NJ, US)                
                            Leland, Richard A. (Sellersville, PA, US)",US,1.0,1022.0,,1022.0,1022.0,1022.0,1022.0,1022.0
Error,Error,US,1.0,5.0,,5.0,5.0,5.0,5.0,5.0
"Ethyl Corporation (Richmond, VA)","Malfer, Dennis J. (Glen Allen, VA)                
                            Colucci, William J. (Glen Allen, VA)                
                            Franklin, Randall M. (Mechanicsville, VA)",US,1.0,922.0,,922.0,922.0,922.0,922.0,922.0
"Ethyl Corporation (Richmond, VA)","Malfer, Dennis J. (Glen Allen, VA)                
                            Noble, Andrea T. (Midlothian, VA)                
                            Colucci, William J. (Glen Allen, VA)                
                            Sheets, Roger M. (Glen Allen, VA)",US,1.0,647.0,,647.0,647.0,647.0,647.0,647.0
Ethyl Corporation (VA),"Colucci, William J. (Glen Allen, VA)                
                            Pettigrew, Alexander F. (Chesterfield, VA)                
                            Cunningham, Lawrence J. (Mechanicsville, VA)",US,1.0,864.0,,864.0,864.0,864.0,864.0,864.0
Etter Roger G.,"Etter, Roger G. (Cardington, OH, US)",US,1.0,1370.0,,1370.0,1370.0,1370.0,1370.0,1370.0
"Expander Energy Inc. (Calgary, CA)","Kresnyak, Steve (Calgary, CA)",US,1.0,629.0,,629.0,629.0,629.0,629.0,629.0
"Expander Energy Inc. (Calgary, CA)","Kresnyak, Steve (Calgary, CA)                
                            Price, Steve (Calgary, CA)                
                            Wagner, Jan (Calgary, CA)",US,2.0,631.0,0.0,631.0,631.0,631.0,631.0,631.0
"Expander Energy, Inc. (Calgary, CA)","Kresnyak, Steve (Calgary, CA)                
                            Price, Steve (Calgary, CA)                
                            Wagner, Jan (Calgary, CA)",US,1.0,631.0,,631.0,631.0,631.0,631.0,631.0
"ExxonMobil Chemical Patents Inc. (Houston, TX, US)","Kowalik, Ralph M. (Kingwood, TX, US)                
                            Gribschaw, Thomas A. (Friendswood, TX, US)                
                            Kuechler, Keith H. (Friendswood, TX, US)                
                            Hill Jr., Ronald R. (Houston, TX, US)",US,1.0,284.0,,284.0,284.0,284.0,284.0,284.0
"ExxonMobil Chemical Patents Inc. (Houston, TX, US)","Kuechler, Keith H. (Friendswood, TX, US)                
                            Brown, Stephen H. (Bernardsville, NJ, US)                
                            Puttemans, Marc P. (Schepdaal, BE)                
                            Silverberg, Steven E. (Seabrook, TX, US)                
                            Verberckmoes, An A. (Serskamp, BE)",US,1.0,823.0,,823.0,823.0,823.0,823.0,823.0
"ExxonMobil Chemical Patents Inc. (Houston, TX, US)","Kuechler, Keith H. (Friendswood, TX, US)                
                            Brown, Stephen Harold (Bernardsville, NJ, US)                
                            Verberckmoes, An Amandine (Serskamp, BE)                
                            Puttemans, Marc P. (Schepdaal, BE)                
                            Silverberg, Steven E. (Seabrook, TX, US)",US,2.0,826.5,89.80256121069154,763.0,794.75,826.5,858.25,890.0
"ExxonMobil Chemical Patents Inc. (Houston, TX, US)","Kuechler, Keith H. (Friendswood, TX, US)                
                            Brown, Stephen Harold (Bernardsville, NJ, US)                
                            Verberckmoes, An Amandine (Serskamp, BE)                
                            Silverberg, Steven E. (Seabrook, TX, US)                
                            Puttemans, Marc P. (Schepdaal, BE)                
                            Welford, Mark R. (Tervuren, BE)                
                            Godsmark, John S. (Grez Doiceau, BE)",US,1.0,307.0,,307.0,307.0,307.0,307.0,307.0
"ExxonMobil Chemical Patents, Inc. (Houston, TX, US)","Kuechler, Keith H. (Friendswood, TX, US)                
                            Brown, Stephen Harold (Bernardsville, NJ, US)                
                            Jaensch, Helge (Ixelles, BE)                
                            Mathys, Georges M. (Bierbeek, BE)                
                            Luo, Shifang (Pittsford, NY, US)                
                            Cheng, Jane C. (Bridgewater, NJ, US)",US,1.0,740.0,,740.0,740.0,740.0,740.0,740.0
"ExxonMobil Research and Engineering Company (Annandale, NJ, US)","Berlowitz, Paul J. (Glen Gardner, NJ, US)                
                            Barckholtz, Timothy A. (Whitehouse Station, NJ, US)                
                            Das, Sandipan K. (Spring, TX, US)",US,1.0,398.0,,398.0,398.0,398.0,398.0,398.0
"ExxonMobil Research and Engineering Company (Annandale, NJ, US)","Berlowitz, Paul J. (Glen Gardner, NJ, US)                
                            Barckholtz, Timothy Andrew (Whitehouse Station, NJ, US)                
                            Hershkowitz, Frank H. (Basking Ridge, NJ, US)",US,1.0,584.0,,584.0,584.0,584.0,584.0,584.0
"ExxonMobil Research and Engineering Company (Annandale, NJ, US)","Gaughan, Roger G. (Biltmore Lake, NC, US)                
                            Peters, Robert T. (Kingwood, TX, US)                
                            Suter, Timothy D. (The Woodlands, TX, US)                
                            Knickerbocker, Bryan M. (Garnet Valley, PA, US)",US,1.0,385.0,,385.0,385.0,385.0,385.0,385.0
"ExxonMobil Research and Engineering Company (Annandale, NJ, US)","Kadlecek, Daniel E. (Philadelphia, PA, US)                
                            Smiley, Randolph J. (Hellertown, PA, US)                
                            Lilik, Gregory K. (Media, PA, US)                
                            Noorman, Mike T. (Doylestown, PA, US)                
                            Luo, Shifang (Annandale, NJ, US)                
                            Laurenzi, Ian J. (Hampton, NJ, US)                
                            Jasmina, Poturovic (Spring, TX, US)",US,1.0,855.0,,855.0,855.0,855.0,855.0,855.0
"ExxonMobil Technology and Engineering Company (Annandale, NJ, US)","Kadlecek, Daniel E. (Philadelphia, PA, US)                
                            Smiley, Randolph J. (Hellertown, PA, US)                
                            Lilik, Gregory K. (Media, PA, US)                
                            Noorman, Mike T. (Doylestown, PA, US)                
                            Luo, Shifang (Annandale, NJ, US)                
                            Laurenzi, Ian J. (Hampton, NJ, US)                
                            Jasmina, Poturovic (Spring, TX, US)",US,1.0,855.0,,855.0,855.0,855.0,855.0,855.0
"ExxonMobil Technology and Engineering Company (Annandale, NJ, US)","Vincent, Matthew J. (Kingwood, TX, US)                
                            Kuechler, Keith H. (Friendswood, TX, US)",US,1.0,905.0,,905.0,905.0,905.0,905.0,905.0
"ExxonMobil Technology and Engineering Company (Annandale, NJ, US)","Wang, Kun (Branchburg, NJ, US)                
                            Sattler, Aaron (Annandale, NJ, US)                
                            Dakka, Jihad M. (Whitehouse Station, NJ, US)",US,1.0,489.0,,489.0,489.0,489.0,489.0,489.0
