Inventor Name,Document Number
"Fabijanski, Steven (Rockland, CA)                
                            Lindenbaum, Michael (Beaconsfield, CA)                
                            Benali, Mejda (Nepean, CA)",1
"Fan, Liang-shih (Columbus, OH, US)                
                            Gupta, Himanshu (Columbus, OH, US)",1
"Fan, Liang-shih (Columbus, OH, US)                
                            Gupta, Himanshu (Columbus, OH, US)                
                            Iyer, Mahesh V. (Columbus, OH, US)",1
"Fan, Long N.; Imani Nejad, Mohammad; Sweetland, Matthew",1
"Farmakis, Tom S. (Sharpsburg, GA)                
                            Routsong, Russell D. (Peachtree City, GA)",1
"Farmer, Gilbert (Cincinnati, OH)                
                            Dede, Mehmet M. (West Chester, OH)                
                            Goreschen, James A. (Hebron, KY)                
                            Houchens, William T. (Cincinnati, OH)",1
"Farmer, Gilbert (Cincinnati, OH)                
                            Groeschen, James A. (Burlington, KY)                
                            Hoppa, Jason P. (Springdale, OH)                
                            Seto, Stanford P. (Loveland, OH)                
                            Al-roub, Marwan (Cincinnati, OH)",1
"Fearn, Michael (Wellington, NZ)                
                            Fearn, Brian (Derbyshire, GB)",1
"Feldman, Boris (Thornhill, CA)",1
"Fell, Robert M. (Summerland, CA, US)                
                            Painter, Scott (Bel Air, CA, US)                
                            Bonsignore, Michael R. (Seattle, WA, US)                
                            Reed, Brian P. (Southlake, TX, US)                
                            Magnuson, Gary A. (Corpus Christi, TX, US)                
                            Gros, Thomas D. (Houston, TX, US)",1
"Fen, Lin Shen; Robert, Stanley, Bobnock",3
"Fen, Lin Shen; Todd, Erlin, Schwantes; Robert, Stanley, Bobnock; Yang, Nianshi",2
"Fernandes, Leslie (La Canada, CA, US)                
                            Amy, Arnaud (Studio City, CA, US)",1
"Fernando, Kurukulasuriya (Beavercreek, OH, US)                
                            Ruiz, Oscar N. (Bellbrook, OH, US)",1
"Ferrer, Ismael (Minneapolis, MN, US)                
                            Yang, Chuanfang (Eden Prairie, MN, US)",3
"Fetterly, Donald R. (Tucson, AZ, US)",2
"Fiato, Rocco A. (Basking Ridge, NJ, US)                
                            Bauman, Richard F. (Billingham, WA, US)                
                            Zaczepinski, Sioma (Morristown, NJ, US)                
                            Bisio, Attilio (Westfield, NJ, US)",2
"Fiato, Rocco A. (Basking Ridge, NJ, US)                
                            Sun, Yuhan (Pudong, CN)                
                            Allen, Mark (Littleton, CO, US)                
                            Zhao, Quanyu (Pudong, CN)",1
"Fiato, Rocco A. (Basking Ridge, NJ, US)                
                            Sun, Yuhan (Shanghai, CN)                
                            Allen, Mark (Littleton, CO, US)                
                            Zhao, Quanyu (Shanghai, CN)",4
"File, David J. (Huntington Beach, CA, US)",1
"Filler, Aaron Gershon (Santa Monica, CA, US)",1
"Fischer, Randal B. (Ridgway, CO, US)",2
"Fitzgerald, John William (Bradenton, FL, US)",2
"Fleckner, Karen (TACOMA, WA, US)",1
"Fleckner, Karen (Tacoma, WA, US)",1
"Fleming, Bruce A. (Indianapolis, IN, US)                
                            Wojciechowski, Michael (Indianapolis, IN, US)                
                            Colwell, Ron (Indianapolis, IN, US)                
                            Schule, Eric (Indianapolis, IN, US)                
                            Fowler, Scott (Houston, TX, US)                
                            Khurana, Vinay (Houston, TX, US)                
                            Karnik, Abhijeet (Houston, TX, US)                
                            Wagner, Eric (Houston, TX, US)",1
"Flory, Justin (Scottsdale, AZ, US)                
                            Fromme, Petra (Mesa, AZ, US)                
                            Vermaas, Willem (Tempe, AZ, US)                
                            Rittman, Bruce (Tempe, AZ, US)                
                            Torres, Cesar (Tempe, AZ, US)                
                            Moore, Thomas (Scottsdale, AZ, US)                
                            Moore, Ana (Scottsdale, AZ, US)",2
"Foland, Steven J. (Garland, TX, US)                
                            Henck, Thomas (SOUTH BURLINGTON, VT, US)                
                            Wiegman, Herman (SOUTH BURLINGTON, VT, US)",1
"Foland, Steven J. (Garland, TX, US)                
                            Henck, Thomas (South Burlington, VT, US)                
                            Wiegman, Herman (South Burlington, VT, US)",1
"Foody, Brian (Ottawa, CA)",1
"Foody, Patrick J. (Ottawa, CA)",1
"Foret, Todd (Lafayette, LA, US)",5
"Foret, Todd (The Woodlands, TX, US)",4
"Fox III, Angus C. (Provo, UT)",1
"Fox, Stephen John (Everett, WA, US)                
                            Kordel, Jan A. (Redmond, WA, US)                
                            Townsend, Keith (Everett, WA, US)                
                            Lassen, Matthew August (Seattle, WA, US)                
                            Gardner, Mark John (Snohomish, WA, US)",1
"Fox, Stephen John (Everett, WA, US)                
                            Kordel, Jan A. (Redmond, WA, US)                
                            Townsend, Keith (Everett, WA, US)                
                            Lassen, Matthew August (Seattle, WA, US)                
                            Gardner, Mark John (Snohomish, WA, US)                
                            Good, Mark Steven (Seattle, WA, US)",3
"Fox, Thomas Bruce (Bristol, VT, US)                
                            Darling, William Jon (Ferrisburg, VT, US)                
                            Brown, Rollin Winter (South Burlington, VT, US)                
                            Maier, Lawrence Carl (New Haven, VT, US)",2
"Fraga, Marco Andre (Rio Janeiro, BR)                
                            Pizzaro Borges, Luis Eduardo (Rio Janerio, BR)                
                            Dos Reis, Goncalves Flavio (Rio Janerio, BR)",1
"Fred Jr., Whitney Redding (Arlington, VA, US)                
                            Redding, Mary (Arlington, VA, US)",2
"Freer, Richard (Saint-Basile-Le-Grand, CA)                
                            Quillet, Dominik (Sherbrooke, CA)                
                            Rancourt, David (Sherbrooke, CA)",1
"Freiheit, Collin (Burlington, VT, US)",1
"Frey, Frederick E.                
                            Hepp, Harold J.",3
"Frolich, Per K.",1
"Fuchs, Michael J. (New Richmond, WI, US)                
                            Weinzierl, Steven M. (New Richmond, WI, US)                
                            Schneider, Oliver (Bonn, DE)                
                            Evers, Markus (Leverkusen, DE)",2
"Fuller, Jerome K. (Van Nuys, CA, US)",3
"Fullerton, Larry W. (New Hope, AL, US)",4
"Fulton Jr., Robert E.                
                            Jose, Alvarez Octavio",1
"Funderburk, Otis C.",1
GABLENZ CARL VON (DE); KESSEL CHRISTOPH VON (DE); HENK JUERGEN (DE); ZULKOWSKI ROLF (DE),1
GAIKWAD SANDIP BALASAHEB (IN); PATIL RANJIT DINKAR (IN); OLSZTYN MICHAEL (US); BAKER GRAHAM PETER (US),1
GAJANAYAKE CHANDANA (GB); GUPTA AMIT (GB); SLATER ROBERT (GB); BHANGU BIKRAMJIT (GB); VILATHGAMUWA DON (GB); BENG GILBERT (GB),1
GALL BARBARA (FI); DIEHL FLORIAN (FI),2
GALL BARBARA (FI); DIEHL FLORIAN (FI); MIETTINEN MAUNO (FI),1
GANTI SATYANARAYANA (US),2
GATSONIDES JOSEPHINE GABRIELLE; DUNSTER ROBERT G,1
GEORGE DALE ARTHUR (CA),3
GESANG WANGJIE (CN); CHA WEI (CN),2
GEYER KAROLIN (DE); WEISS THOMAS (DE); KASHANI NAWID (DE); RITTIG FRANK (DE); GOYAL ARJUN K (DE); MA QUINGGAO PHILIP (DE); STRITTMATTER JAN (DE); SCHERER MARKUS (DE); RUEHLE THOMAS (DE); BALASUBRAMANIAM VASUDEVAN (US),1
GIANNAKOPOULOS PAVLOS (GR),2
GIL JAE-HYOUNG; JANG JAE-HYUK; JUNG CHANG-RYUL,1
GONZALEZ CESAR (US),2
"GONZALEZ, CESAR",1
GOOSSEN EMRAY R; HORN RANDALL E,1
GOSANGARI SAIKRISHNA (US); MATHUR ASHISH (US),1
GRABARSE WOLFGANG (DE); HAERING DIETMAR (DE); SCHULZ GERHARD (DE); GRUMBRECHT BASTIAN (DE); KLOSTERHALFEN STEFFEN (DE); KRUEGER CHRISTIAN (DE); WENZEL KURT (DE); ALBA PEREZ ANA (DE); ANDERLOHR CHRISTOPHER ALEC (DE); BINDER MARTIN (DE); PISTILLO ALESSANDRO (DE); LOISEL KATELL (DE); GRUETTNER-MERTEN SABINE (DE); KLOS MICHAEL (DE),1
GRAETZ TODD (US); GRISSUM GARY (US); MISCHKE MICHAEL (US),2
GRANDA CESAR B (US); HOLTZAPPLE MARK T (US); HOLTZAPPLE ERIK (US),1
GREAGER IVAN (US); HARRIS ROGER (US); HAVENGA RUDOLPH (GB); KING NEIL ALEXANDER (GB),1
GREAGER IVAN PHILIP (US); HARRIS ROGER ALLEN (US); HAVENGA RUDOLPH (GB); KING NEIL ALEXANDER (GB),1
GREAGER IVAN PHILIP (US); HARRIS ROGER ALLEN (US); KING NEIL ALEXANDER (GB); DESHMUKH SOUMITRA R (US); QIU ZHEYAN (US),1
GREAGER IVAN PHILIP (US); HARRIS ROGER ALLEN (US); KING NEIL ALEXANDER (GB); DESHMUKH SOUMITRA R (US); QIU ZHEYAN (US); GUPTA ASHISH (US),1
GREENIDGE DARIUS (US); GREENIDGE JEAN (US),1
GREWAL NAROTAM SINGH (US); SHIRAZEE NABEEL AHMED (GB),1
GRIMALD CYRILLE (FR); URIEN BENOÎT (FR),1
GROEN HENRY JAY (US); GROEN DAVID LYNN (US),3
GRUBER PATRICK (US); IMPEKOVEN CHRISTOPH (DE),1
GUARRERO BRETT (US),1
GUBLER LORENZ (CH); MUROYAMA ALEXANDER (CH),1
GUEH HOW KIAP (SG),2
GUILEN PORTAL FERNANDO (US),1
GUILLEN PORTAL FERNANDO (US),5
"Gagliano, Christopher (Melbourne, FL, US)",1
"Gaikwad, Sandip Balasaheb (Pune, IN)                
                            Patil, Ranjit Dinkar (Kolahapur, IN)                
                            Olsztyn, Michael (Costa Mesa, CA, US)                
                            Baker, Graham Peter (Issaquah, WA, US)",1
"Gajanayake, Chandana Jayampathi (Singapore, SG)                
                            Gupta, Amit Kumar (Singapore, SG)                
                            Slater, Robert (Derby, GB)                
                            Bhangu, Bikramjit (Singapore, SG)                
                            Foo, Gilbert Hock Beng (Singapore, SG)                
                            Vilathgamuwa, Don Mahinda (Singapore, SG)",1
"Galati, Gary (Ronkonkoma, NY, US)                
                            Benward, Robert (Hauppauge, NY, US)",1
"Ganti, Raghu Kiran (Elmsford, NY, US)                
                            Srivatsa, Mudhakar (White Plains, NY, US)                
                            Rao, Venkatesh Ashok Rao (Natick, MA, US)                
                            Chu, Linsong (White Plains, NY, US)",1
"Ganti, Satyanarayana (Dover, PA, US)",2
"Garcia, Ernest J. (Albuquerque, NM)",1
"Garretson, Owen L.",1
"Gaughan, Roger G. (Biltmore Lake, NC, US)                
                            Peters, Robert T. (Kingwood, TX, US)                
                            Suter, Timothy D. (The Woodlands, TX, US)                
                            Knickerbocker, Bryan M. (Garnet Valley, PA, US)",1
"Gaughan, Roger G. (Sewell, NJ, US)                
                            Peters, Robert T. (Kingwood, TX, US)                
                            Suter, Timothy D. (Vienna, VA, US)                
                            Knickerbocker, Bryan M. (Centreville, VA, US)",1
"Gauthier, Gerard Philippe (Champagne sur Seine, FR)                
                            Mourlan, Jean-pierre (Nogent sur Marne, FR)",1
Gauzy Ltd. (IL),1
"Gee, Robert (Lake Barrington, IL, US)                
                            Almquist, Edward (Bartlett, IL, US)                
                            Brey, Thomas (Lake in the Hills, IL, US)                
                            Seymour, Shafer (Bartlett, IL, US)                
                            D'avello, Robert (Lake Zurich, IL, US)                
                            Lasch, Jonathan (Vernon Hills, IL, US)",1
"Geiselman, Gina Marie (Alameda, CA, US)                
                            Kirby, James (Berkeley, CA, US)                
                            Lee, Taek Soon (Berkeley, CA, US)                
                            Gladden, John M. (Alameda, CA, US)                
                            Simmons, Blake A. (San Francisco, CA, US)",2
"Geiss, Michael (Moettingen, DE)",2
"Gemin, Paul Robert (Cincinnati, OH, US)                
                            Becker, Thomas Lee (Symmes Township, OH, US)                
                            Steen, Tod Robert (Cincinnati, OH, US)",1
"Gemin, Paul Robert (Cincinnati, OH, US)                
                            Radun, Arthur Vorwerk (Galway, NY, US)                
                            Barone, Dominic (Centerville, OH, US)",1
"Gentle, Dave (Edinburgh, GB)                
                            Cameron, Scott (Edinburgh, GB)                
                            Kennedy, Terry (Calgary, CA)",2
"George, Dale Arthur (Tiny, CA)",3
"George, Herman F.; Burlington, James Dee.; Pudderski, John Kay.; Roski, James P.; Martin, John Earl.; Ineman, Jennifer M.; Garvin, Gary A.; Van Riel, Frank M.; McKay, David A.",1
"Gerardi, Joseph J. (Dryden, NY)                
                            Dahl, Philip R. (Encino, CA)                
                            Hickman, Gail A. (Dryden, NY)",1
"Gerez, Valerio (Yerres, FR)                
                            Griffaton, Julien Christian Pascal (Paris, FR)",2
"Gernandt, Waldo G.",1
"Gervasio, Dominic Francis (Tucson, AZ, US)                
                            Li, Peiwen (Tucson, AZ, US)",1
"Gervasio, Dominic Francis (Tucson, AZ, US)                
                            Li, Peiwen (Tucson, AZ, US)                
                            Xu, Xinhai (Tucson, AZ, US)                
                            Zhang, Shuyang (Tucson, AZ, US)                
                            Wang, Xiaoxin (Tucson, AZ, US)",1
"Gesang, Wangjie (Shanghai, CN)                
                            Cha, Wei (Shanghai, CN)",1
"Ghalebsaz Jeddi, Babak (Fairfax, VA, US)",1
"Giannakopoulos, Pavlos (Patra, GR)",1
"Gibson, Nathan Evan Mccurdy (West Chester, OH, US)                
                            Kroger, Christopher James (West Chester, OH, US)                
                            Binion, Sean Christopher (Loveland, OH, US)                
                            Waun, Scott Douglas (Loveland, OH, US)",2
"Gibson, Nathan Evan Mccurdy (West Chester, OH, US)                
                            Zatorski, Darek Tomasz (Fort Wright, KY, US)",4
"Gilbert, Eric B. (Seatle, WA, US)",2
"Gill, Paul E. (Santa Clara, CA)",1
"Gill, Paul E. (Santa Clara, CA, US)",2
"Giroux, Andrew (Georgia, VT, US)                
                            Richter, Timothy Gerard (Wynantskill, NY, US)                
                            Moy, Nicholas (Burlington, VT, US)",1
"Gizara, Andrew Roman (Lake Forest, CA, US)                
                            Cicali, Michael Dominic (Galloway, NJ, US)",8
"Glaser, Scott (Rosamond, CA, US)                
                            King, Glenn B. (Riverside, NJ, US)                
                            Leland, Richard A. (Sellersville, PA, US)",2
"Glass, Brian J. (Palo Alto, CA)                
                            Spirkovska, Liljana (Sunnyvale, CA)                
                            Mcdermott, William J. (Menlo Park, CA)                
                            Reisman, Ronald J. (Palo Alto, CA)                
                            Gibson, James (Campbell, CA)                
                            Iverson, David L. (Sunnyvale, CA)",1
"Goes, Nilson Mendes (Village of Loch Lloyd, MO, US)                
                            Albertson, Timothy Allen (Lawrence, KS, US)",2
"Goldberg, Bernard (Houston, TX, US)                
                            Hale, Arthur Herman (Houston, TX, US)                
                            Miller, David Scott (Katy, TX, US)                
                            Vinegar, Harold J. (Bellaire, TX, US)",1
"Gonzalez, Cesar (Wichita, KS)",1
"Gonzalez, Jesus Antonio Romero (Aliso Viejo, CA, US)",1
"Gonzalez, Jesus Antonio Romero (Foothill Ranch, CA, US)",1
"Goodall, Brian L. (Spring, TX, US)                
                            Aravanis, Alex M. (San Diego, CA, US)                
                            Behnke, Craig A. (San Diego, CA, US)                
                            Cranford, Richard J. (San Diego, CA, US)                
                            Sajkowski, Daniel J. (Frankfurt, IL, US)",1
"Gouzou, Christophe (Chalons en Champagne, FR)                
                            Renard, Eric (Compertrix, FR)                
                            De Savasse, Humbert De (Reims, FR)",1
"Gouzou, Christophe (Châlons en Champagne, FR)                
                            Renard, Eric (Compertrix, FR)                
                            De Monts, De Savasse Humbert (Reims, FR)",1
"Graetz, Todd (Keller, TX, US)                
                            Grissum, Gary (Fort Worth, TX, US)                
                            Mischke, Michael (Fort Worth, TX, US)",1
"Graham, Donald E. (Phoenix, AZ)                
                            Nelson, Raymond A. (Phoenix, AZ)                
                            Olive, Edmond E. (Phoenix, AZ)",1
"Graves, Scott (Felton, CA, US)",1
"Grayson, Michael Curtis (Bolivar, TN, US)",1
"Greager, Ivan (Houston, TX, US)                
                            Harris, Roger (Houston, TX, US)                
                            Havenga, Rudolph (Berkshire, GB)                
                            King, Neil (Oxford, GB)",4
"Greager, Ivan (Houston, TX, US)                
                            Harris, Roger (Houston, TX, US)                
                            Havenga, Rudolph (Workingham, GB)                
                            King, Neil Alexander (Oxford, GB)",1
"Greager, Ivan Philip (Houston, TX, US)                
                            Harris, Roger Allen (Houston, TX, US)                
                            Havenga, Rudolph (Berkshire, GB)                
                            King, Neil Alexander (Oxford, GB)",2
"Greager, Ivan Philip (Houston, TX, US)                
                            Harris, Roger Allen (Houston, TX, US)                
                            Havenga, Rudolph (Workingham, GB)                
                            King, Neil Alexander (Oxford, GB)",1
"Greager, Ivan Philip (Houston, TX, US)                
                            Harris, Roger Allen (Houston, TX, US)                
                            Hopkins, Martin (High Peak, GB)                
                            King, Neil Alexander (Oxford, GB)                
                            Ward, Malcolm John (Tonbridge, GB)",1
"Greager, Ivan Philip (Houston, TX, US)                
                            Harris, Roger Allen (Houston, TX, US)                
                            King, Neil Alexander (Oxford, GB)                
                            Deshmukh, Soumitra R. (Houston, TX, US)                
                            Qiu, Zheyan (Sugar Land, TX, US)",7
"Greager, Ivan Philip (Houston, TX, US)                
                            Harris, Roger Allen (Houston, TX, US)                
                            King, Neil Alexander (Oxford, GB)                
                            Deshmukh, Soumitra R. (Houston, TX, US)                
                            Qiu, Zheyan (Sugar Land, TX, US)                
                            Gupta, Ashish (Houston, TX, US)",4
"Greager, Philip Ivan (Houston, TX, US)                
                            Harris, Roger Allen (Houston, TX, US)                
                            Hopkins, Martin (High Peak, GB)                
                            King, Neil Alexander (Oxford, GB)                
                            Ward, Malcolm John (Tonbridge, GB)",1
"Green, Donna Louise (Eastleigh, GB)                
                            Larder, Brian David (Eastleigh, GB)                
                            Knight, Peter Robin (Eastleigh, GB)                
                            Thuong, Olivier (Eastleigh, GB)",2
"Greene, Christopher Britton (Hebron, CT, US)                
                            Donohue, James M. (Glastonbury, CT, US)                
                            Cocks, Peter At (South Glastonbury, CT, US)",3
"Greets, Todd; Grisam, Gerry; Mishke, Michael",1
"Grieger, Ivan Phillip; Harris, Roger Allen; King, Neal Alexander; Deshmukh, Somitra Earl.; Chiu and Ziyang; Gupta, Ashish",1
"Grieger, Ivan Phillip; Harris, Roger Allen; King, Neal Alexander; Deshmukh, Sumitra Earl.; Chu, Juyan",1
"Griffin Jr., John R.                
                            Ess, Paul Van R.",2
"Griffin, Riley (Montpelier, VT, US)                
                            Moy, Nicholas (Burlington, VT, US)                
                            Auerbach, Joshua E. (Waterbury Center, VT, US)",1
"Griffiths, Paul Philip (Mountsorrel, GB)",1
"Groen, Henry J. (Salt Lake City, UT)                
                            Groen, David L. (Salt Lake City, UT)",1
"Groen, Henry J. (Salt Lake City, UT)                
                            Groen, David L. (Tooele, UT)",2
"Groman, Kevin J. (Scottsdale, AZ, US)",1
"Gruber, Patrick Richard (Longmont, CO, US)                
                            Impekoven, Christoph (Frankfurt, DE)",1
"Guarrero, Brett P. (Telluride, CO, US)",7
"Guay, Donald F. (Stevens Point, WI, US)                
                            Singsaas, Eric L. (Stevens Point, WI, US)",4
"Gueh, How Kiap (Singapore, SG)",1
"Guillen Portal, Fernando (College Station, TX, US)",12
"Guillen-portal, Fernando (Bozeman, MT, US)",6
"Gupta, Bhupendra Kumar (Cincinnati, OH, US)                
                            Emilianowicz, Edward John (West Chester, OH, US)                
                            Muneeruddin, Mohamed (Lynnfield, MA, US)",1
GÜNTHER SEBASTIAN (DE); BEBESEL MARIUS (DE); MORES SEBASTIAN (DE); JOLY LAURENE (DE),1
HAALAND PETER (US); HARNESS KEN (US),3
HAALAND PETER D (US); HARNESS KEN (US),1
HAALAND PETER; HARNESS KEN,2
HAAS THOMAS (DE); PAULMANN UWE (DE); BECK SIMON (DE),1
HAGEN DAVID L (US); GINTER GARY (US); TRAVERSO ALBERT (IT); GOHEEN BILL (US); MCGUIRE ALLAN (US); RANKIN JANET (US); MASSARDO ARISTRIDE (IT),2
HAGEN DAVID L (US); GINTER GARY (US); TRAVERSO ALBERTO (IT); GOHEEN BILL (US); MCGUIRE ALLAN (US); RANKIN JANET (US),2
HAGEN DAVID L (US); GINTER GARY (US); TRAVERSO ALBERTO (IT); GOHEEN BILL (US); MCGUIRE ALLAN (US); RANKIN JANET (US); MASSARDO ARISTIDE (IT); KLAUS RONALD L (US),1
HALL PHILIP LAWRENCE TIMOTHY RICHARD (GB),1
HALSEY COLIN JOHN (GB),1
HALSEY COLIN JOHN (GB); BAILEY MICHAEL DAVID (GB); WILLIAMS ROSS JONATHAN (GB),1
HALSEY COLIN JOHN (GB); RAINBOW ALEXANDER JAMES (GB),1
HAMPDEN-SMITH MARK J (US); ATANASSOVA PAOLINA (US); SHEN JING-PING (US); BREWSTER JAMES (US); NAPOLITANO PAUL (US),1
HAMPDEN-SMITH MARK J (US); ATANASSOVA PAOLINA (US); SHEN JING-PING (US); NAPOLITANO PAUL (US); BREWSTER JAMES (US); KYRLIDIS AGATHAGELOS (US),2
HARMAN JOHN ALBION (AU); PALASTHY ATTILA KAROLY (AU),1
HARPER BRENT (US); MACKIE THOMAS ROCK (US); HOLZMANN TIMOTHY (US),1
HARRIS KENNETH (US); ERIDON JOHN M (US); SIKKENGA STEVEN L (US),2
HARRISON SHAY L (US); SCHNEITER JOHN L (US); PEGNA JOSEPH (US); GODUGUCHINTA RAM K (US); WILLIAMS KIRK L (US); VAALER ERIK G (US),1
HARTMANN TIMO (DE); CELINSKI VINICIUS RIBEIRO (DE); RAMIREZ GARCIA PAULA (DE); WERMER ANDREAS (DE); RODRIGUEZ GAYA CARLOS (ES); HERRERO HERNÁNDEZ JORGE (ES); NAVAS ROJO DAVID (ES),1
"HARTMANN, Timo (Dachau, DE); CELINSKI, Vinicius Ribeiro (München, DE); RAMIREZ GARCIA, Paula (Landshut, DE); WERNER, Andreas (Erding, DE); RODRIGUEZ GAYA, Carlos (Yuncos, ES); HERRERO HERNÁNDEZ, Jorge (Yuncos, ES); NAVAS ROJO, David (Maspujols, ES)",1
HARTVIGSEN JOSEPH (US); ELANGOVAN S (US); CZERNICHOWSKI PIOTR (US); HOLLIST MICHELE (US),1
HAVLIK PETER Z (US); ABHARI RAMIN (US); ROTH E GARY (US); TOMLINSON H LYNN (US),1
HAYASHI SHIGERU,1
HEINTZ CLIFFORD E,1
HEJCZYK ARTUR (DE); KALLFASS CHRISTOPH (DE),2
HEMMELGARN CHIRSTOPHER DOUGLAS (US); CABLE KRISTIN MARIE (US); KIRBY BRANDON CHARLES (US); PELLEY BRYAN MICHAEL (US),1
HEMMELGARN CHRISTOPHER D (US); PELLEY BRYAN M (US),1
HERRMANN MATHIAS (DE),1
HIEBL MANFRED (DE); PONGRATZ HANS WOLFGANG (DE),1
HIETALA JUKKA (FI); LEMINEN ANJA (FI); RÄMÖ VIRPI (FI); RÄSÄNEN JUKKA (FI),1
HIGGS ANDREW (JP),2
HILL JASON (GB),1
HILLSBERG MITCHELL C; ROTHMAN PAUL J,1
HINCKLIEFF IAN R (GB); ALLEN CHRISTOPHER M (GB),1
HOFFJANN CLAUS (DE); SCHULDZIG HANSGEORG (DE); PFAFFEROTT TORGE (DE); FRAHM LARS (DE); NICKEL LARS (DE),1
HOLLAND GRAHAM (GB),1
HOLLAND GRAHAM ANDREW (GB),2
HOLLAWAY JOHN WILLIAM (ZW),1
HOLMES RICHARD (US); TRYON ROBERT G III (US); POPE JOHN E (US); NASSER DANIEL A (US); OJA MICHAEL (US); DEY ANIMESH (US); HAMLER JESSE (US); BROOKS JONATHAN (US); TRYON JAMES (US),1
"HOLTZAPPLE, DR. MARK T.; RABROKER, ANDREW G.",1
HOLZEM HEINZ (DE); HEMMER GEORG (DE); KANIS PAUL-GERHARD (DE); HECKLER ROLF PETER (DE),1
HOSSEINI KAVEH (US),1
HU QIANG (CN); WU JIAN (CN),1
HU QIANG (US); SUMMERFELD MILTON (US),1
