Inventor Name,Document Number
"Patel, Nayan Vinodbhai (Liberty Township, OH, US)                
                            Mccambridge, Michael Scott (Loveland, OH, US)                
                            Kress, Eric John (Loveland, OH, US)                
                            Graziano, Kevin Richard (Cincinnati, OH, US)                
                            Leeker, Brendon Matthew (Cincinnati, OH, US)",2
"Patterson, William P. (Jacksonville, FL)                
                            Bailey, Ronald J. (Jacksonville, FL)",1
Paul Jay Barlowitz; Timothy Andrew Burkholtz; Frank Harshkowitz; Alessandro Faldi; Allen S. Ericsson,1
"Paul, Jacques (Lynn, MA, US)                
                            Dowdell, Charles W. (Lynn, MA, US)                
                            Noel, James R. (Lynn, MA, US)",1
"Paul, Marius Angelo (Yorba Linda, CA, US)",3
"Paul, Pevney",1
"Peleg, Eyal; Valency, Tomel; Barboy, Iran",1
"Perkins, Michael T. (Austin, TX, US)",1
"Pero III, Michael A. (WOOD RIDGE, NJ, US)",1
"Pero III, Michael A. (Wood Ridge, NJ, US)",4
"Peryea, Martin (Fort Worth, TX, US)                
                            Smith, Michael Reaugh (Fort Worth, TX, US)                
                            Hamelwright Jr., Douglas (Fort Worth, TX, US)                
                            Brand, Albert G. (Fort Worth, TX, US)                
                            Plagianos, Nicholas J. (Fort Worth, TX, US)                
                            Emrich, Joshua (Fort Worth, TX, US)                
                            Carr, Timothy (Fort Worth, TX, US)",2
"Peters, Matthew W. (Highlands Ranch, CO, US)                
                            Taylor, Joshua D. (Evergreen, CO, US)                
                            Henton, David E. (Midland, MI, US)                
                            Manzer, Leo E. (Wilmington, DE, US)",1
"Peters, Matthew W. (Highlands Ranch, CO, US)                
                            Taylor, Joshua D. (Evergreen, CO, US)                
                            Henton, David E. (Midland, MI, US)                
                            Manzer, Leo E. (Wilmington, DE, US)                
                            Gruber, Patrick R. (Longmont, CO, US)                
                            Griffith, Josefa M. (Parker, CO, US)                
                            Obaidi, Yassin Al (Somerset, KY, US)",1
"Peters, Matthew W..; Taylor, Joshua Dee.; Jenny, Madeleine M.; Henton, David E.; Manzer, Leo Yi.",1
"Petrucci, Ferdinand; Festuccia, Andrea",1
"Petruska, David C. (Fort Collins, CO)                
                            Barrett, Jeffrey B. (Bolton, MA)                
                            Woolston, Mark R. (Bolton, MA)",1
"Pfefferle, William C. (Madison, CT)                
                            Smith, Lance L. (North Haven, CT)                
                            Castaldi, Manco J. (Bridgeport, CT)",1
"Pham, Roger N. C. (Grand Prairie, TX)",1
Philip Daniel Naples,1
"Phillips, Samuel (Bristol, GB)                
                            Becks, Ralf (Bristol, GB)",1
"Pickard III, William Marshall (Montgomery, AL, US)",1
"Pinckard, Joseph A. (San Jose, CA)                
                            Gill, Paul E. (Santa Clara, CA)",1
"Pitman, James (London, GB)",3
"Pixton, Stephen G. (South Windsor, CT, US)                
                            Collopy, Gary (Vernon, CT, US)                
                            Turgut, Ozhan (South Windsor, CT, US)",1
"Plantinga, Jeffrey M. (Grand Rapids, MI, US)                
                            Hochwarth, Joachim K. (Caledonia, MI, US)                
                            Coutts, Benjamin I. (Rockford, MI, US)                
                            Boozer, Ralph D. (Rockford, MI, US)",3
"Pontes Bittencourt, Roberto Carlos (Rio de Janeiro, BR)",1
"Porter, David R. (Huntsville, AL, US)",2
"Potega, Patrick Henry (West Hills, CA, US)",1
"Prewitt, Richard H. (Lexington, KY)",1
"Price, Richard John (Vicars Cross, Chester, GB)                
                            Orlebar, Caroline Nicola (London, GB)                
                            Rigutto, Marcello Stefano (Amsterdam, NL)                
                            Clark, Richard Hugh (Manchester, GB)                
                            Chahal, Jasprit Kaur (London, GB)",1
"Pursifull, Ross Dykstra (Dearborn, MI)",1
"Pursifull, Ross Dykstra (Dearborn, MI, US)",1
"Quave Jr., Richard F. (Montgomery, AL, US)",1
R KASSNER RUDOLPH; L BINSLEY ROBERT,1
RABELLO CARLOS RENE KLOTZ (BR); JUNIOR MARLITO GOMES (BR),1
RAMOS AGUNDO OCTAVIO (ES),1
RANDELL L MILLS,2
RANDELL MILLS,1
RANKIN GERALD L,1
RANTASALO TEEMU (FI); TUOMALA OLLI (FI); NEUVONEN ARTO (FI); VILJA JESSE (FI),1
RATEAU AYMERIC (BE),1
RATNASAMY PAUL (IN),2
RATNASAMY PAUL (IN); CARREON MOISES A (US); AHMADI MASOUDEH (US),2
RAYNER DIGNAN (AU),2
REAMS JOSIAH T (US); GUENTHNER ANDREW (US); MABRY JOSEPH (US); LAMISON KEVIN (US); TUTEJA ANISH (US); KOTA ARUN K (US); KWON GIBUM (US),1
REDMOND SCOTT D (US),1
REEH JONATHAN (US); WAJE MAHESH (US); KESMEZ MEHMET (US); SALINAS CARLOS (US); VARUGHESE JIBI (US); ZBRANEK JOHN (US); COCKING SETH (US); BALASUBRAMANIAN ASHWIN (US); TEURMAN CORY (US); NETHERLAND JAMES (US); HITCHENS GEOFFREY DUNCAN (US),1
REN MINGQI (CN); YAN FEIYU (CN); LV LEI (CN),1
RENE CHAMBERLAIN PRAVIA OSCAR (BR); BELLO DE OLIVEIRA ANDRE (BR); DE REZENDE PINHO ANDREA (BR); LOUREIRO XIMENES VITOR (BR); BRANDO BEZERRA DE ALMEIDA MARLON (BR),1
REUTHER JOHN F,1
RHEAUME JONATHAN (US); TONGUE STEPHEN E (US),2
RICHARDS ALAN K (US),1
RIEPKIN OLEKSANDR OLEKSANDROVYCH (UA),1
RINGEL ANTON (DE); HACKENBERG JUERGEN (DE); DRILLKENS JULIA (DE); MARINO MICHAEL GIUSEPPE (DE),1
ROBERGE GARY D (US); CARLTON RICHARD A (US); HUDSON ERIC A (US),1
ROBERTS SHANE (US),1
RODRIGUES DE LIMA NETO MANOEL (BR); RODRIGUES DE LIMA JUNIOR MANOEL (BR),2
ROSCOE ANDREW (GB); TRAINER DAVID (GB); KNIGHT RICHARD (GB),1
ROSING HOWARD STEPHEN (US); CROSS RICHARD J (US),1
ROTH SIEGFRIED DIPL ING (DE); SCHROEDER HANS-WOLFGANG DR RER (DE); HIMMEL NORBERT DIPL ING (DE); POENITZSCH WERNER DR ING (DE); UHSE WOLFGANG DIPL ING (DE),1
RUSEK JOHN J (US); ZIULKOWSKI JONATHON D (US); CATANIA PHILIP J (US); BOWER DONALD L (US),1
RUSSELL BRADLEY (US); JIN LIN (US),1
RYABUKHA NIKOLAY NIKOLAYEVICH (RU),1
RYCHLIK F,1
"Rajish K. R. (Ernakulam, IN)",1
"Ramasamy, Karthikeyan Kallupalayam (West Richland, WA, US)                
                            Guo, Mond F. (Richland, WA, US)                
                            Brady, Casper O. (Pasadena, CA, US)",1
"Ramirez Verduzco, Luis Felipe (Mexico City, MX)                
                            Aburto Anell, Jorge Arturo (Mexico City, MX)                
                            Amezcua Allieri, Myriam Adela (Mexico City, MX)                
                            Luna Ramirez, Maria Del Rosario Socorro (Mexico City, MX)                
                            Diaz Garcia, Leonardo (Mexico City, MX)                
                            Medellin Rivera, Blanca Lucia (Mexico City, MX)                
                            Rodriguez Rodriguez, Javier Esteban (Mexico City, MX)",1
"Ramos Agundo, Octavio (Barcelona, ES)",1
"Rantasalo, Teemu (Espoo, FI)                
                            Tuomala, Olli (Espoo, FI)                
                            Neuvonen, Arto (Espoo, FI)                
                            Vilja, Jesse (Espoo, FI)",1
"Ratnasamy, Paul (Pune, IN)",1
"Ratnasamy, Paul (Pune, IN)                
                            Carreon, Moises A. (Boulder, CO, US)                
                            Ahmadi, Masoudeh (Louisville, KY, US)",1
"Ratnasamy, Paul (Pune, IN)                
                            Carron, Moises A. (Golden, CO, US)                
                            Ahmadi, Masoudeh (Louisville, KY, US)",1
"Ratnasamy, Paul (Pune, IN)                
                            Wagle, Sanjay (San Francisco, CA, US)                
                            Dicosola, Gregory (Westmont, IL, US)",1
"Ratner, Daniel (San Francisco, CA, US)",3
"Rawdon, Blaine Knight (Long Beach, CA, US)",2
"Rawdon, Blaine Knight (Riverside, CA, US)",2
"Rawdon, Blaine Knight (Riverside, CA, US)                
                            Kawai, Ronald Tatsuji (Rancho Palos Verdes, CA, US)",1
"Rawdon, Blaine Knight (San Pedro, CA, US)                
                            Kawai, Ronald Tatsuji (Rancho Palos Verdes, CA, US)                
                            O'leary, Thomas James (Orange, CA, US)                
                            O'leary Jr., Terrence Kevin (Dripping Springs, TX, US)",1
"Rayner, Dignan (Brisbane, AU)",2
"Rayner, Dignan (Eight Mile Plains, AU)",1
"Rayner, Dignan (Eight Mile Plains, Brisbane, Queensland, AU)",1
"Reams, Josiah T. (Lancaster, CA, US)                
                            Guenthner, Andrew (Lancaster, CA, US)                
                            Mabry, Joseph (Lancaster, CA, US)                
                            Lamison, Kevin (Lancaster, CA, US)                
                            Tuteja, Anish (Ann Arbor, MI, US)                
                            Kota, Arun K. (Fort Collins, CO, US)                
                            Kwon, Gibum (Ann Arbor, MI, US)",4
"Redding Jr. Deceased., Redding Executrix Fred Whitney Mary (late of Arlington;Arlington, VA)",1
"Redding Jr., Fred Whitney (late of Arlington, VA)                
                            Redding, Mary (Arlington, VA)",1
"Redesma redesma, sole; Blanco Avils, Reuben",1
"Redmond, Scott D. (San Francisco, CA, US)",2
"Reed, John S. (Berkeley, CA, US)                
                            Dyson, Lisa (Berkeley, CA, US)",1
"Reeh, Jonathan (College Station, TX, US)                
                            Waje, Mahesh (College Station, TX, US)                
                            Kesmez, Mehmet (College Station, TX, US)                
                            Salinas, Carlos (Bryan, TX, US)                
                            Varughese, Jibi (College Station, TX, US)                
                            Zbranek, John (College Station, TX, US)                
                            Cocking, Seth (College Station, TX, US)                
                            Balasubramanian, Ashwin (College Station, TX, US)                
                            Teurman, Cory (College Station, TX, US)                
                            Netherland, James (Bryan, TX, US)                
                            Hitchens, Geoffrey Duncan (Allen, TX, US)",4
"Reepmeyer, James Ryan (Cincinnati, OH, US)                
                            Nott, Cameron Roy (Fairfield, OH, US)                
                            Andarawis, Emad Andarawis (Ballston Lake, NY, US)                
                            Wallace, Kirk Dennis (Glenville, NY, US)",2
"Rehage, Peter (South Lake Tahoe, CA, US)",10
"Ren, Xiaoming (Menands, NY, US)                
                            Shufon, Kevin J. (Troy, NY, US)                
                            Kovacs, Frank W. (Waterford, NY, US)",2
"Renninger, Neil Stephen (Oakland, CA, US)                
                            Mcphee, Derek James (Fairfield, CA, US)",4
"Reslein, James Patrick (Victoria, British Columbia, CA)",1
"Rey, Gonzalo Javier (Torrance, CA, US)                
                            Manzanares, David James (Snohomish, WA, US)                
                            Alarie, Sylvain (Heidelberg, DE)                
                            Esterhuizen, Deon (Clearwater, FL, US)",1
"Reynolds, Brandon Allanson (Cincinnati, OH, US)                
                            Weaver, Matthew Mark (Loveland, OH, US)                
                            Kerns, Daniel Patrick (Mason, OH, US)",5
"Reynolds, Paul (Mountain View, CA, US)                
                            Banks, Robert Andrew (Mountain View, CA, US)",2
"Rheaume, Jonathan (West Hartford, CT, US)",2
"Rheaume, Jonathan (West Hartford, CT, US)                
                            Cordatos, Haralambos (Colchester, CT, US)",1
"Rheaume, Jonathan (West Hartford, CT, US)                
                            Tongue, Stephen E. (Hampden, MA, US)",2
"Ribeiro, Raphael Felipe Gama (São José dos Campos, BR)                
                            Trapp, Luis Gustavo (São Paulo, BR)                
                            Affonso, Luis Carlos (São José dos Campos, BR)",1
"Rich Jr., John W. (Auburn, PA, US)",1
"Richards Jr., Chester L. (Thousand Oaks, CA, US)",1
"Richards, Alan K. (Houston, TX, US)",1
"Richards, Alan K. (Palm City, FL, US)",2
"Riediger, Carsten (Herrsching, DE)                
                            Nusseler, Martin (Oberostendorf, DE)",1
"Rigi, Luigi Peep.; Talbot, Mark A.; Wellbrook, Gregory M.",1
"Riley, Shawn P. (Cincinnati, OH, US)                
                            Ozbaysal, Kazim (Cincinnati, OH, US)                
                            Wilson, Paul Stuart (New Richmond, OH, US)                
                            Budiner, David Edwin (Loveland, OH, US)",1
Rip Myr James Cayce; Pfeiffer Third Joseph W.; Hansen John Milton; Apto Kirk E.; Berkeley William Robert; Burrens Paul Warren; Martin david christian,1
"Ritchey, Harold W. (Huntsville, AL)                
                            Mcdermott, John M. (Brigham City, UT)",1
"Ritter, Wolfgang (Vienna, AT)                
                            Lendl, Bernhard (Vienna, AT)",1
"Roberge, Gary D. (Tolland, CT, US)                
                            Berryann, Andrew P. (Coventry, CT, US)                
                            Carr, Scott A. (Manchester, CT, US)",1
Robert Simpson,1
"Roberts IV, William L. (Raleigh, NC, US)                
                            Lamb, Henry H. (Apex, NC, US)                
                            Stikeleather, Larry F. (Raleigh, NC, US)                
                            Turner, Timothy L. (Chapel Hill, NC, US)",7
"Roberts, David Killin (Pershore, GB)",2
"Roberts, Shane (Blountville, TN, US)",1
"Robertson, Daniel (Southlake, TX, US)                
                            Groninga, Kirk (Keller, TX, US)                
                            Louis, Matthew (Fort Worth, TX, US)",3
"Robinson, Nicholas Paul (Cottingham, GB)",1
"Robota, Heinz J. (Dayton, OH, US)                
                            Alger, Jhoanna C. (Dayton, OH, US)",2
Rocco A. Fearto; Yuhan Sun; Mark Allen; Quan Yu Jiao,1
"Rockwell, Gregory P. (Sarnia, CA)                
                            Poirier, Marc-andre (Sarnia, CA)",1
"Rodriguez, Jorge (Abu Dhabi, AE)                
                            Uratani, Joao Marcus (Abu Dhabi, AE)",1
"Rodriguez, Jose M. (Starkville, MS, US)",1
"Rodriguez, Jose Maria (Starkville, MS, US)",1
"Rosin, Richard Russell (Glencoe, IL, US)                
                            Yu, Yen-lu (Buffalo Grove, IL, US)                
                            Rollag, Sean Alex (Chicago, IL, US)                
                            Schulz, Taylor Craig (Chicago, IL, US)                
                            Conrado, Robert John (Washington, DC, US)",1
"Rosing, Howard S. (Naples, FL, US)                
                            Cross, Richard J. (Wilmington, DE, US)",1
"Rosplock, James D. (Roscoe, IL, US)",1
"Ross Morrey, Dennis Alexander (Germantown, MD, US)                
                            Cappello, Giovanni (GALBIATE (LECCO), IT)",1
"Ross Morrey, Dennis Alexander (Germantown, MD, US)                
                            Cappello, Giovanni (Galbiate, IT)",1
"Ross, Gary (Houston, TX, US)",1
"Rostoker, Norman (Irvine, CA, US)",1
"Rostoker, Norman (Oakland, CA, US)",1
"Ruiz, Oscar N. (Bellbrook, OH, US)                
                            Gunasekera, Thusitha S. (Beavercreek, OH, US)                
                            Radwan, Osman (Urbana, IL, US)",1
"Ruiz, Oscar N. (Bellbrook, OH, US)                
                            Kahandawala, Moshan S. P. (Washington Township, OH, US)                
                            Fernando, Kurukulasuriya (Beavercreek, OH, US)",2
"Rule, Evan T. (Burtonsville, MD, US)                
                            Shields, Eric B. (Germantown, MD, US)                
                            Lutkenhouse, Crystal P. (Garrett Park, MD, US)                
                            Trehubenko, John A. (Arlington, VA, US)",1
"Rusek, John J. (West Lafayette, IN, US)",1
"Rusek, John J. (West Lafayette, IN, US)                
                            Ziulkowski, Jonathon D. (West Lafayette, IN, US)                
                            Catania, Philip J. (West Lafayette, IN, US)                
                            Bower, Donald L. (West Lafayette, IN, US)",2
"Rusek, John J. (West Lafyette, IN, US)",1
"Russell, Bradley (Fall Branch, TN, US)                
                            Jin, Lin (Inverness, IL, US)",2
SAHA BASUDEB (US); LIU SIBAO (US); VLACHOS DIONISIOS (US),2
SAHA BASUDEB (US); LIU SIBAO (US); VLACHOS DIONISIOS (US); NORTON ANGELA M (US),1
SAKAI SHIGERU (JP); KANEMASU MASAYUKI (JP); ABE KENICHIRO (JP); HIGUCHI NAOKI (JP),2
SANCHEZ FABIAN (CA),2
SANCHEZ PAULO (PT),1
SANDBERG KATI (FI); KIISKI ULLA (FI),3
SANTANA CAMPOS RODRIGUES JOSÉ JO O (PT),1
SATHYA SANTH (US),1
SATTLER AARON (US); KIM HYUNG RAE (US); WALKER THEODORE W (US); DACOSTA ETHAN G (US); XU XIAOCHUN (US),1
SAVITSKY ANATOLY IVANOVICH (RU); SCHUKIN LEV NIKOLAEVICH (RU); KARELIN VIKTOR GEORGIEVICH (RU); PUSHKIN ROSTISLAV MIKHAILOVICH (RU); MASS ALEXANDR MIKHAILOVICH (RU); SHIBANOV ANATOLY PETROVICH (RU); SCHUKIN ILYA LVOVICH (RU); KHUTSISCHVILI VLADIMIR GEORGIE (RU); FISCHENKO SERGEI VIKTOROVICH (RU); ERMISCHIN ALEXANDR VIKTOROVICH (RU); SOBKO ALEXANDR PAVLOVICH (RU),1
SCHAUB STEVEN J (US); ANDERSON ERIC N (US),1
SCHLITT RAINER (DE); RICHARTS FRITZ (DE); KRAFT RALF (SG),1
SCHMITZ OLIVER (DE); KONLE MARCO (DE); KLINGELS HERMANN (DE),1
SCHOENSLEBEN SVEN PATRICK (US),1
SCHUETZLE DENNIS (US); SCHUETZLE ROBERT (US); BUCHER JAMES (US); CALDWELL MATTHEW (US); GALLOWAY ANJA (US); HANBURY ORION (US); MCGINNIS GLENN (US),1
SCHUETZLE DENNIS (US); SCHUETZLE ROBERT (US); GALLOWAY ANJA RUMPLECKER (US); MCGINNIS GLENN (US); MATTANA ALEX (US),1
SCHUETZLE ROBERT (US); SCHUETZLE DENNIS (US); GALLOWAY ANJA RUMPLECKER (US); GRIFFIN THOMAS P (US); HANBURY ORION (US); CALDWELL MATTHEW (US); DIKRAN SOLMON (US),1
SCHWARZE MALTE (DE); ZÖLD THOMAS (SE),1
SEALE JOSEPH B (US); SLOAN WALKER M (US),3
SELLMANN MEINOLF (US); WANG TIANYI (US); CUDDIHY PAUL (US); MULWAD VARISH (US),1
SENNOUN MOHAMMED EL HACIN (US),2
SEVAST'YANOV VLADIMIR PETROVICH (RU); PETROV ALEKSEJ IVANOVICH (UA); VARY'GIN VITALIJ NIKOLAEVICH (RU),1
SHEEHAN STAFFORD W (US); CHEN CHI (US); GAREDEW-BALLARD MAHLET (US); LUTHRIA NEVA (US); SHAH MIHIR R (US); WU QIYUAN (US),1
SHEEHAN STAFFORD W (US); CHEN CHI (US); STEINKE NICHOLAS J (US),1
SHKALIM REUVEN (IL); 0LEVI TSEDEK PAZ (IL); LEVI RAFI (IL),1
SIMMONS HAROLD C (US); HARVEY REX J (US),10
SIMMONS HAROLD C; HARVEY REX J,1
SIMMONS WAYNE W (US); WHITE SIDNEY P (US); PERKINS CHRISTOPHER (US),1
SIMPSON ROBERT (GB),3
SIMPSON SEAN DENNIS (NZ); TRAN PHUONG LOAN (NZ); MIHALCEA CHRISTOPHE DANIEL (NZ); FUNG JENNIFER MON YEE (US); LIEW FUNGMIN (NZ),1
SIMPSON SEAN DENNIS (US); HOLMGREN JENNIFER ROSA (US); CLOMBURG JAMES MACALLISTER (US); DALEIDEN JIM JEFFREY (US); HARRIS AUDREY JEAN (US); JONES STEPHANIE RHIANON (US); KOEPKE MICHAEL (US); POLITANO TIMOTHY JAMES (US),1
SINGH AKHILESH PRASAD (IN); SINGH NIMESHEE (IN); SINGH DEEPITARK (IN),1
SINGH NAVNEET R (US); AGRAWAL RAKESH (US),2
SKLAR ALFRED (US),1
SLADE DAVID (US); ABHARI RAMIN (US); HAVERLY MARTIN (US),1
SMITH LANCE L (US); ETEMAD SHAHROKH (US); KARIM HASAN (US); PFEFFERLE WILLIAM C (US),2
SOLODOVNIKOV IURII VLADIMIROVICH (UA),1
SONE TADATOSHI; IGARASHI JINICHI; OKAMOTO KENICHI; SAITO KENICHIRO; KONISHI SHOZABURO,1
SORIANO NESTOR (US); MAGLINAO RANDY (US); NARANI AKASH (US); ABEDIN MD JOYNAL (US),1
STEIN STUART ALAN (US); SMITH CRAIG STEVEN (US); STEIN JEFFREY HOLT (US),1
STEINER STEPHEN (US); NELSON RYAN (US); BUCKWALTER MORIAH (US); GRIFFIN JUSTIN (US),1
STEWART DONALD B JR C O ALLIED (US),1
STEWART JOSEPH (BE); VERMEIREN WALTER (BE),2
STIGSSON LARS (SE),1
STRATTON RUSSELL (CA),1
STRIEBEL HANS-MARTIN (DE); STRIEBEL CHRISTHARD (DE),1
SUCIU GABRIEL L (US); ALVANOS IOANNIS (US),1
SUDDUTH BRUCE C (US); SLONE RALPH J (US); PALEKAR VISHWESH (US); RAMAVAJJALA MADHU (US),2
SUKHOROSOV JURY LEONIDOVICH (RU); GNIDKIN JURY MIKHAILOVICH (RU); VRONSKY JURY NIKOLAEVICH (RU),1
SUN MIAO (SA); XU WEI (SA),4
SUNDBERG AARNE (FI); AALTONEN HEIKKI (FI); KARVO ANNA (FI); VIRTANEN JUHA-PEKKA (FI),2
SUNTIO VILLE (FI); SIFONTES HERRERA VÍCTOR (FI),1
SWANN PETER (GB); BEAVEN DAVID M (GB); BEMMENT CRAIG W (GB); HOBDAY ALASTAIR G (GB); KEELER BENJAMIN J (GB); MADDEN CHRISTOPHER P (GB); YATES MARTIN K (GB),8
SWANN PETER (GB); BEMMENT CRAIG W (GB); HOBDAY ALASTAIR G (GB); KEELER BENJAMIN J (GB); MADDEN CHRISTOPHER P (GB),1
"Sada-salinas, Jaime G. (San Antonio, TX, US)                
                            Arellano-escarpita, David Alejandro (Durango, MX)",2
"Sadas, Bruce Sea; Sloan, Ralph Jay; Palaiscar, Vishwesh; Ramavajara, Madue",1
"Saens, Giorgi, Ivan",1
"Saenz, Jorge Ivan (Indianapolis, IN, US)",3
"Saenz, Jorge Ivan (Zionsville, IN, US)",3
"Saha, Basudeb (Newark, DE, US)                
                            Liu, Sibao (Newark, DE, US)                
                            Norton, Angela M. (Newark, DE, US)                
                            Vlachos, Dionisios G. (Voorhees, NJ, US)",1
"Sakai, Shigeru (Bellevue, WA, US)                
                            Kanemasu, Masayuki (Aichi, JP)                
                            Abe, Kenichiro (Aichi, JP)                
                            Higuchi, Naoki (Aichi, JP)",1
"Sakai, Shigeru (Bellevue, WA, US)                
                            Kanemasu, Masayuki (Aichi-ken, JP)                
                            Abe, Kenichiro (Aichi, JP)                
                            Higuchi, Naoki (Aichi, JP)",1
"Sakita, Masami (Palo Alto, CA, US)",2
"Salentiny, Dustin M. (GRAND FORKS, ND, US)                
                            Mewes, John J. (MAYVILLE, ND, US)",2
"Salentiny, Dustin M. (Grand Forks, ND, US)                
                            Mewes, John J. (Mayville, ND, US)",2
"Salkeld, Robert J. (Malibu, CA)",1
"Sanchez, Fabian Enrique (Montreal, CA)",2
"Sandberg, Kati (Järvenpää, FI)                
                            Kiiski, Ulla (Porvoo, FI)",2
"Sargisson, Donald Farley (Cincinnati, OH)                
                            Rundell, Dan Joseph (Milford, OH)",1
"Sarjovaara, Teemu (ESPOO, FI)                
                            Haara, Riikka-mari (ESPOO, FI)                
                            Kouva, Merja (ESPOO, FI)                
                            Kiiski, Ulla (ESPOO, FI)                
                            Vilja, Jesse (ESPOO, FI)",1
"Sarkar, Bipul (Dehradun, IN)                
                            Singh, Om Vir (Dehradun, IN)                
                            Agrawal, Ankit (Dehradun, IN)                
                            Ray, Anjan (Dehradun, IN)                
                            Kumar, Sanat (Dehradun, IN)                
                            Vempatapu, Bhanu Prasad (Dehradun, IN)                
                            Kumar, Jagdish (Dehradun, IN)",1
"Sarkar, Subrata (Pune, IN)                
                            Jones, Matthew Darren (Hampshire, GB)",1
"Sarker, Moinuddin (Bridgeport, CT, US)",2
"Sathya, Santh (Chuluota, FL, US)",1
"Saul, Gilbert D. (Mission Viejo, CA)",1
"Sauti, Godfrey (Hampton, VA, US)                
                            XU, Tian-bing (Hampton, VA, US)                
                            Siochi, Emilie J. (Newport News, VA, US)                
                            Wilkinson, Stephen P. (Poquoson, VA, US)                
                            Meador, Mary Ann B. (Strongsville, OH, US)                
                            Guo, Haiquan N. (Avon, OH, US)",1
"Sauti, Godfrey (Hampton, VA, US)                
                            Xu, Tian-bing (Hampton, VA, US)                
                            Siochi, Emilie J. (Newport News, VA, US)                
                            Wilkinson, Stephen P. (Poquoson, VA, US)                
                            Meador, Mary Ann B. (Strongsville, OH, US)                
                            Guo, Haiquan N. (Avon, OH, US)",1
"Sautron, Dominique Patrick (CHICAGO, IL, US)                
                            Opificius, Julian Alexander (ELK RIVER, MN, US)",2
"Sautron, Dominique Patrick (Chicago, IL, US)",7
"Sautron, Dominique Patrick (Chicago, IL, US)                
                            Opificius, Julian Alexander (Elk River, MN, US)",1
"Schaub, Steven J. (Cedar Rapids, IA, US)                
                            Anderson, Eric N. (Marion, IA, US)",1
"Schilling, Thaddeus A. (Lander, WY)",1
"Schlüter, Claus, Dipl.-Ing. (DE)",1
"Schmidt, Terrence W. (Santa Clara, CA, US)                
                            Kline, Jeffrey E. (Severna Park, MD, US)",3
"Schmitt, Wolfgang (Bray, IE)                
                            O'toole, Annemarie (Delgany, IE)",1
"Schmitt, Wolfgang (Bray, IE)                
                            O'toole, Annmarie (Delgany, IE)",1
"Schneiter, John L. (Cohoes, NY, US)                
                            Novalis, John (Raleigh, NC, US)                
                            Harrison, Shay L. (East Greenbush, NY, US)",1
